geak_eval/sample/20250530_reflexion_oneshot_codeQwen-1.5-7B-FT-new_2_0/exec/perf/block_pointer_matmul_perf.json
[
    {
        "params": {
            "M": 64,
            "N": 64,
            "K": 64,
            "num_warps": 4,
            "dtype_str": "fp16"
        },
        "ms": 0.0068,
        "min_ms": 0.0071,
        "max_ms": 0.0066,
        "GB/s": 3.63,
        "TFLOPS": 0.08
    },
    {
        "params": {
            "M": 128,
            "N": 128,
            "K": 128,
            "num_warps": 4,
            "dtype_str": "fp16"
        },
        "ms": 0.0191,
        "min_ms": 0.0194,
        "max_ms": 0.019,
        "GB/s": 5.14,
        "TFLOPS": 0.22
    },
    {
        "params": {
            "M": 64,
            "N": 128,
            "K": 256,
            "num_warps": 4,
            "dtype_str": "fp16"
        },
        "error": "out of resource: shared memory, Required: 131072, Hardware limit: 65536. Reducing block sizes or `num_stages` may help."
    },
    {
        "params": {
            "M": 256,
            "N": 64,
            "K": 128,
            "num_warps": 4,
            "dtype_str": "fp16"
        },
        "error": "out of resource: shared memory, Required: 131072, Hardware limit: 65536. Reducing block sizes or `num_stages` may help."
    },
    {
        "params": {
            "M": 128,
            "N": 256,
            "K": 64,
            "num_warps": 4,
            "dtype_str": "fp16"
        },
        "ms": 0.0232,
        "min_ms": 0.0235,
        "max_ms": 0.0229,
        "GB/s": 4.95,
        "TFLOPS": 0.18
    },
    {
        "params": {
            "M": 64,
            "N": 64,
            "K": 64,
            "num_warps": 8,
            "dtype_str": "fp16"
        },
        "ms": 0.008,
        "min_ms": 0.0081,
        "max_ms": 0.0079,
        "GB/s": 3.08,
        "TFLOPS": 0.07
    },
    {
        "params": {
            "M": 128,
            "N": 128,
            "K": 128,
            "num_warps": 8,
            "dtype_str": "fp16"
        },
        "ms": 0.0193,
        "min_ms": 0.0195,
        "max_ms": 0.0192,
        "GB/s": 5.1,
        "TFLOPS": 0.22
    },
    {
        "params": {
            "M": 64,
            "N": 128,
            "K": 256,
            "num_warps": 8,
            "dtype_str": "fp16"
        },
        "error": "out of resource: shared memory, Required: 131072, Hardware limit: 65536. Reducing block sizes or `num_stages` may help."
    },
    {
        "params": {
            "M": 256,
            "N": 64,
            "K": 128,
            "num_warps": 8,
            "dtype_str": "fp16"
        },
        "error": "out of resource: shared memory, Required: 131072, Hardware limit: 65536. Reducing block sizes or `num_stages` may help."
    },
    {
        "params": {
            "M": 128,
            "N": 256,
            "K": 64,
            "num_warps": 8,
            "dtype_str": "fp16"
        },
        "ms": 0.0225,
        "min_ms": 0.0229,
        "max_ms": 0.0215,
        "GB/s": 5.1,
        "TFLOPS": 0.19
    },
    {
        "params": {
            "M": 64,
            "N": 64,
            "K": 64,
            "num_warps": 4,
            "dtype_str": "fp32"
        },
        "ms": 0.0069,
        "min_ms": 0.0071,
        "max_ms": 0.0068,
        "GB/s": 7.09,
        "TFLOPS": 0.08
    },
    {
        "params": {
            "M": 128,
            "N": 128,
            "K": 128,
            "num_warps": 4,
            "dtype_str": "fp32"
        },
        "ms": 0.0211,
        "min_ms": 0.0213,
        "max_ms": 0.021,
        "GB/s": 9.31,
        "TFLOPS": 0.2
    },
    {
        "params": {
            "M": 64,
            "N": 128,
            "K": 256,
            "num_warps": 4,
            "dtype_str": "fp32"
        },
        "error": "out of resource: shared memory, Required: 131072, Hardware limit: 65536. Reducing block sizes or `num_stages` may help."
    },
    {
        "params": {
            "M": 256,
            "N": 64,
            "K": 128,
            "num_warps": 4,
            "dtype_str": "fp32"
        },
        "error": "out of resource: shared memory, Required: 131072, Hardware limit: 65536. Reducing block sizes or `num_stages` may help."
    },
    {
        "params": {
            "M": 128,
            "N": 256,
            "K": 64,
            "num_warps": 4,
            "dtype_str": "fp32"
        },
        "ms": 0.0203,
        "min_ms": 0.0205,
        "max_ms": 0.0202,
        "GB/s": 11.31,
        "TFLOPS": 0.21
    },
    {
        "params": {
            "M": 64,
            "N": 64,
            "K": 64,
            "num_warps": 8,
            "dtype_str": "fp32"
        },
        "ms": 0.0079,
        "min_ms": 0.0081,
        "max_ms": 0.0078,
        "GB/s": 6.22,
        "TFLOPS": 0.07
    },
    {
        "params": {
            "M": 128,
            "N": 128,
            "K": 128,
            "num_warps": 8,
            "dtype_str": "fp32"
        },
        "ms": 0.0191,
        "min_ms": 0.0192,
        "max_ms": 0.019,
        "GB/s": 10.28,
        "TFLOPS": 0.22
    },
    {
        "params": {
            "M": 64,
            "N": 128,
            "K": 256,
            "num_warps": 8,
            "dtype_str": "fp32"
        },
        "error": "out of resource: shared memory, Required: 131072, Hardware limit: 65536. Reducing block sizes or `num_stages` may help."
    },
    {
        "params": {
            "M": 256,
            "N": 64,
            "K": 128,
            "num_warps": 8,
            "dtype_str": "fp32"
        },
        "error": "out of resource: shared memory, Required: 131072, Hardware limit: 65536. Reducing block sizes or `num_stages` may help."
    },
    {
        "params": {
            "M": 128,
            "N": 256,
            "K": 64,
            "num_warps": 8,
            "dtype_str": "fp32"
        },
        "ms": 0.019,
        "min_ms": 0.0192,
        "max_ms": 0.0189,
        "GB/s": 12.07,
        "TFLOPS": 0.22
    }
]