geak_eval/sample/20250530_reflexion_oneshot_codeQwen-1.5-7B-FT-new_2_0/exec/perf/kernel_dot_triton_perf.json
[
    {
        "params": {
            "DIM": 16,
            "dtype_str": "fp32",
            "num_warps": 1
        },
        "ms": 0.006,
        "min_ms": 0.0061,
        "max_ms": 0.0059,
        "GB/s": 0.51,
        "TFLOPS": 0.0
    },
    {
        "params": {
            "DIM": 16,
            "dtype_str": "fp16",
            "num_warps": 1
        },
        "ms": 0.006,
        "min_ms": 0.006,
        "max_ms": 0.0059,
        "GB/s": 0.26,
        "TFLOPS": 0.0
    },
    {
        "params": {
            "DIM": 16,
            "dtype_str": "fp32",
            "num_warps": 2
        },
        "ms": 0.006,
        "min_ms": 0.006,
        "max_ms": 0.0059,
        "GB/s": 0.51,
        "TFLOPS": 0.0
    },
    {
        "params": {
            "DIM": 16,
            "dtype_str": "fp16",
            "num_warps": 2
        },
        "ms": 0.006,
        "min_ms": 0.006,
        "max_ms": 0.0059,
        "GB/s": 0.26,
        "TFLOPS": 0.0
    },
    {
        "params": {
            "DIM": 16,
            "dtype_str": "fp32",
            "num_warps": 4
        },
        "ms": 0.006,
        "min_ms": 0.006,
        "max_ms": 0.0059,
        "GB/s": 0.51,
        "TFLOPS": 0.0
    },
    {
        "params": {
            "DIM": 16,
            "dtype_str": "fp16",
            "num_warps": 4
        },
        "ms": 0.006,
        "min_ms": 0.006,
        "max_ms": 0.0059,
        "GB/s": 0.26,
        "TFLOPS": 0.0
    }
]