geak_eval/data/ROCm/data/performance/golden_results/gemm_fusion_triton_perf.json
[
    {
        "params": {
            "M": 128,
            "N": 128,
            "K": 32,
            "block_m": 32,
            "block_n": 32,
            "block_k": 32,
            "dtype_str": "fp16",
            "num_warps": 4
        },
        "ms": 0.0063,
        "min_ms": 0.0065,
        "max_ms": 0.0061,
        "GB/s": 5.24,
        "TFLOPS": 0.34
    },
    {
        "params": {
            "M": 128,
            "N": 128,
            "K": 32,
            "block_m": 32,
            "block_n": 64,
            "block_k": 32,
            "dtype_str": "fp16",
            "num_warps": 4
        },
        "ms": 0.006,
        "min_ms": 0.0061,
        "max_ms": 0.0059,
        "GB/s": 5.45,
        "TFLOPS": 0.35
    },
    {
        "params": {
            "M": 128,
            "N": 128,
            "K": 32,
            "block_m": 32,
            "block_n": 128,
            "block_k": 32,
            "dtype_str": "fp16",
            "num_warps": 4
        },
        "ms": 0.006,
        "min_ms": 0.0061,
        "max_ms": 0.0059,
        "GB/s": 5.45,
        "TFLOPS": 0.35
    },
    {
        "params": {
            "M": 128,
            "N": 128,
            "K": 32,
            "block_m": 64,
            "block_n": 32,
            "block_k": 32,
            "dtype_str": "fp16",
            "num_warps": 4
        },
        "ms": 0.0062,
        "min_ms": 0.0063,
        "max_ms": 0.0061,
        "GB/s": 5.27,
        "TFLOPS": 0.34
    },
    {
        "params": {
            "M": 128,
            "N": 128,
            "K": 32,
            "block_m": 64,
            "block_n": 64,
            "block_k": 32,
            "dtype_str": "fp16",
            "num_warps": 4
        },
        "ms": 0.006,
        "min_ms": 0.0061,
        "max_ms": 0.0059,
        "GB/s": 5.49,
        "TFLOPS": 0.35
    },
    {
        "params": {
            "M": 128,
            "N": 128,
            "K": 32,
            "block_m": 64,
            "block_n": 128,
            "block_k": 32,
            "dtype_str": "fp16",
            "num_warps": 4
        },
        "ms": 0.006,
        "min_ms": 0.0061,
        "max_ms": 0.0059,
        "GB/s": 5.45,
        "TFLOPS": 0.35
    },
    {
        "params": {
            "M": 128,
            "N": 128,
            "K": 32,
            "block_m": 128,
            "block_n": 32,
            "block_k": 32,
            "dtype_str": "fp16",
            "num_warps": 4
        },
        "ms": 0.0063,
        "min_ms": 0.0065,
        "max_ms": 0.0063,
        "GB/s": 5.17,
        "TFLOPS": 0.33
    },
    {
        "params": {
            "M": 128,
            "N": 128,
            "K": 32,
            "block_m": 128,
            "block_n": 64,
            "block_k": 32,
            "dtype_str": "fp16",
            "num_warps": 4
        },
        "ms": 0.006,
        "min_ms": 0.0061,
        "max_ms": 0.0059,
        "GB/s": 5.49,
        "TFLOPS": 0.35
    },
    {
        "params": {
            "M": 128,
            "N": 128,
            "K": 32,
            "block_m": 128,
            "block_n": 128,
            "block_k": 32,
            "dtype_str": "fp16",
            "num_warps": 4
        },
        "ms": 0.006,
        "min_ms": 0.0061,
        "max_ms": 0.0059,
        "GB/s": 5.49,
        "TFLOPS": 0.35
    },
    {
        "params": {
            "M": 128,
            "N": 256,
            "K": 32,
            "block_m": 32,
            "block_n": 32,
            "block_k": 32,
            "dtype_str": "fp16",
            "num_warps": 4
        },
        "ms": 0.0076,
        "min_ms": 0.0077,
        "max_ms": 0.0075,
        "GB/s": 6.49,
        "TFLOPS": 0.55
    },
    {
        "params": {
            "M": 128,
            "N": 256,
            "K": 32,
            "block_m": 32,
            "block_n": 64,
            "block_k": 32,
            "dtype_str": "fp16",
            "num_warps": 4
        },
        "ms": 0.0068,
        "min_ms": 0.0069,
        "max_ms": 0.0067,
        "GB/s": 7.25,
        "TFLOPS": 0.62
    },
    {
        "params": {
            "M": 128,
            "N": 256,
            "K": 32,
            "block_m": 32,
            "block_n": 128,
            "block_k": 32,
            "dtype_str": "fp16",
            "num_warps": 4
        },
        "ms": 0.0069,
        "min_ms": 0.0071,
        "max_ms": 0.0069,
        "GB/s": 7.09,
        "TFLOPS": 0.6
    },
    {
        "params": {
            "M": 128,
            "N": 256,
            "K": 32,
            "block_m": 64,
            "block_n": 32,
            "block_k": 32,
            "dtype_str": "fp16",
            "num_warps": 4
        },
        "ms": 0.0077,
        "min_ms": 0.0078,
        "max_ms": 0.0076,
        "GB/s": 6.39,
        "TFLOPS": 0.54
    },
    {
        "params": {
            "M": 128,
            "N": 256,
            "K": 32,
            "block_m": 64,
            "block_n": 64,
            "block_k": 32,
            "dtype_str": "fp16",
            "num_warps": 4
        },
        "ms": 0.0069,
        "min_ms": 0.007,
        "max_ms": 0.0068,
        "GB/s": 7.13,
        "TFLOPS": 0.61
    },
    {
        "params": {
            "M": 128,
            "N": 256,
            "K": 32,
            "block_m": 64,
            "block_n": 128,
            "block_k": 32,
            "dtype_str": "fp16",
            "num_warps": 4
        },
        "ms": 0.0071,
        "min_ms": 0.0072,
        "max_ms": 0.007,
        "GB/s": 6.93,
        "TFLOPS": 0.59
    },
    {
        "params": {
            "M": 128,
            "N": 256,
            "K": 32,
            "block_m": 128,
            "block_n": 32,
            "block_k": 32,
            "dtype_str": "fp16",
            "num_warps": 4
        },
        "ms": 0.0078,
        "min_ms": 0.0079,
        "max_ms": 0.0077,
        "GB/s": 6.29,
        "TFLOPS": 0.54
    },
    {
        "params": {
            "M": 128,
            "N": 256,
            "K": 32,
            "block_m": 128,
            "block_n": 64,
            "block_k": 32,
            "dtype_str": "fp16",
            "num_warps": 4
        },
        "ms": 0.007,
        "min_ms": 0.0071,
        "max_ms": 0.0069,
        "GB/s": 7.01,
        "TFLOPS": 0.6
    },
    {
        "params": {
            "M": 128,
            "N": 256,
            "K": 32,
            "block_m": 128,
            "block_n": 128,
            "block_k": 32,
            "dtype_str": "fp16",
            "num_warps": 4
        },
        "ms": 0.0071,
        "min_ms": 0.0072,
        "max_ms": 0.007,
        "GB/s": 6.93,
        "TFLOPS": 0.59
    },
    {
        "params": {
            "M": 128,
            "N": 512,
            "K": 32,
            "block_m": 32,
            "block_n": 32,
            "block_k": 32,
            "dtype_str": "fp16",
            "num_warps": 4
        },
        "ms": 0.0106,
        "min_ms": 0.0107,
        "max_ms": 0.0105,
        "GB/s": 7.71,
        "TFLOPS": 0.79
    },
    {
        "params": {
            "M": 128,
            "N": 512,
            "K": 32,
            "block_m": 32,
            "block_n": 64,
            "block_k": 32,
            "dtype_str": "fp16",
            "num_warps": 4
        },
        "ms": 0.0089,
        "min_ms": 0.0091,
        "max_ms": 0.0088,
        "GB/s": 9.16,
        "TFLOPS": 0.94
    },
    {
        "params": {
            "M": 128,
            "N": 512,
            "K": 32,
            "block_m": 32,
            "block_n": 128,
            "block_k": 32,
            "dtype_str": "fp16",
            "num_warps": 4
        },
        "ms": 0.0089,
        "min_ms": 0.0093,
        "max_ms": 0.0088,
        "GB/s": 9.16,
        "TFLOPS": 0.94
    },
    {
        "params": {
            "M": 128,
            "N": 512,
            "K": 32,
            "block_m": 64,
            "block_n": 32,
            "block_k": 32,
            "dtype_str": "fp16",
            "num_warps": 4
        },
        "ms": 0.0107,
        "min_ms": 0.0109,
        "max_ms": 0.0107,
        "GB/s": 7.62,
        "TFLOPS": 0.78
    },
    {
        "params": {
            "M": 128,
            "N": 512,
            "K": 32,
            "block_m": 64,
            "block_n": 64,
            "block_k": 32,
            "dtype_str": "fp16",
            "num_warps": 4
        },
        "ms": 0.0091,
        "min_ms": 0.0092,
        "max_ms": 0.009,
        "GB/s": 9.04,
        "TFLOPS": 0.93
    },
    {
        "params": {
            "M": 128,
            "N": 512,
            "K": 32,
            "block_m": 64,
            "block_n": 128,
            "block_k": 32,
            "dtype_str": "fp16",
            "num_warps": 4
        },
        "ms": 0.0091,
        "min_ms": 0.0092,
        "max_ms": 0.009,
        "GB/s": 9.0,
        "TFLOPS": 0.92
    },
    {
        "params": {
            "M": 128,
            "N": 512,
            "K": 32,
            "block_m": 128,
            "block_n": 32,
            "block_k": 32,
            "dtype_str": "fp16",
            "num_warps": 4
        },
        "ms": 0.0109,
        "min_ms": 0.011,
        "max_ms": 0.0108,
        "GB/s": 7.54,
        "TFLOPS": 0.77
    },
    {
        "params": {
            "M": 128,
            "N": 512,
            "K": 32,
            "block_m": 128,
            "block_n": 64,
            "block_k": 32,
            "dtype_str": "fp16",
            "num_warps": 4
        },
        "ms": 0.0091,
        "min_ms": 0.0093,
        "max_ms": 0.009,
        "GB/s": 9.0,
        "TFLOPS": 0.92
    },
    {
        "params": {
            "M": 128,
            "N": 512,
            "K": 32,
            "block_m": 128,
            "block_n": 128,
            "block_k": 32,
            "dtype_str": "fp16",
            "num_warps": 4
        },
        "ms": 0.0091,
        "min_ms": 0.0092,
        "max_ms": 0.009,
        "GB/s": 9.04,
        "TFLOPS": 0.93
    },
    {
        "params": {
            "M": 128,
            "N": 1024,
            "K": 32,
            "block_m": 32,
            "block_n": 32,
            "block_k": 32,
            "dtype_str": "fp16",
            "num_warps": 4
        },
        "ms": 0.0169,
        "min_ms": 0.017,
        "max_ms": 0.0168,
        "GB/s": 8.74,
        "TFLOPS": 0.99
    },
    {
        "params": {
            "M": 128,
            "N": 1024,
            "K": 32,
            "block_m": 32,
            "block_n": 64,
            "block_k": 32,
            "dtype_str": "fp16",
            "num_warps": 4
        },
        "ms": 0.0132,
        "min_ms": 0.0133,
        "max_ms": 0.0132,
        "GB/s": 11.15,
        "TFLOPS": 1.27
    },
    {
        "params": {
            "M": 128,
            "N": 1024,
            "K": 32,
            "block_m": 32,
            "block_n": 128,
            "block_k": 32,
            "dtype_str": "fp16",
            "num_warps": 4
        },
        "ms": 0.0128,
        "min_ms": 0.013,
        "max_ms": 0.0127,
        "GB/s": 11.49,
        "TFLOPS": 1.31
    },
    {
        "params": {
            "M": 128,
            "N": 1024,
            "K": 32,
            "block_m": 64,
            "block_n": 32,
            "block_k": 32,
            "dtype_str": "fp16",
            "num_warps": 4
        },
        "ms": 0.017,
        "min_ms": 0.0171,
        "max_ms": 0.0168,
        "GB/s": 8.69,
        "TFLOPS": 0.99
    },
    {
        "params": {
            "M": 128,
            "N": 1024,
            "K": 32,
            "block_m": 64,
            "block_n": 64,
            "block_k": 32,
            "dtype_str": "fp16",
            "num_warps": 4
        },
        "ms": 0.0134,
        "min_ms": 0.0135,
        "max_ms": 0.0133,
        "GB/s": 11.01,
        "TFLOPS": 1.25
    },
    {
        "params": {
            "M": 128,
            "N": 1024,
            "K": 32,
            "block_m": 64,
            "block_n": 128,
            "block_k": 32,
            "dtype_str": "fp16",
            "num_warps": 4
        },
        "ms": 0.0132,
        "min_ms": 0.0132,
        "max_ms": 0.0131,
        "GB/s": 11.21,
        "TFLOPS": 1.28
    },
    {
        "params": {
            "M": 128,
            "N": 1024,
            "K": 32,
            "block_m": 128,
            "block_n": 32,
            "block_k": 32,
            "dtype_str": "fp16",
            "num_warps": 4
        },
        "ms": 0.0169,
        "min_ms": 0.0171,
        "max_ms": 0.0168,
        "GB/s": 8.72,
        "TFLOPS": 0.99
    },
    {
        "params": {
            "M": 128,
            "N": 1024,
            "K": 32,
            "block_m": 128,
            "block_n": 64,
            "block_k": 32,
            "dtype_str": "fp16",
            "num_warps": 4
        },
        "ms": 0.0134,
        "min_ms": 0.0135,
        "max_ms": 0.0133,
        "GB/s": 11.04,
        "TFLOPS": 1.26
    },
    {
        "params": {
            "M": 128,
            "N": 1024,
            "K": 32,
            "block_m": 128,
            "block_n": 128,
            "block_k": 32,
            "dtype_str": "fp16",
            "num_warps": 4
        },
        "ms": 0.0131,
        "min_ms": 0.0132,
        "max_ms": 0.013,
        "GB/s": 11.25,
        "TFLOPS": 1.28
    },
    {
        "params": {
            "M": 128,
            "N": 2048,
            "K": 32,
            "block_m": 32,
            "block_n": 32,
            "block_k": 32,
            "dtype_str": "fp16",
            "num_warps": 4
        },
        "ms": 0.0294,
        "min_ms": 0.0296,
        "max_ms": 0.0292,
        "GB/s": 9.48,
        "TFLOPS": 1.14
    },
    {
        "params": {
            "M": 128,
            "N": 2048,
            "K": 32,
            "block_m": 32,
            "block_n": 64,
            "block_k": 32,
            "dtype_str": "fp16",
            "num_warps": 4
        },
        "ms": 0.022,
        "min_ms": 0.0222,
        "max_ms": 0.0219,
        "GB/s": 12.65,
        "TFLOPS": 1.52
    },
    {
        "params": {
            "M": 128,
            "N": 2048,
            "K": 32,
            "block_m": 32,
            "block_n": 128,
            "block_k": 32,
            "dtype_str": "fp16",
            "num_warps": 4
        },
        "ms": 0.0209,
        "min_ms": 0.0211,
        "max_ms": 0.0208,
        "GB/s": 13.33,
        "TFLOPS": 1.61
    },
    {
        "params": {
            "M": 128,
            "N": 2048,
            "K": 32,
            "block_m": 64,
            "block_n": 32,
            "block_k": 32,
            "dtype_str": "fp16",
            "num_warps": 4
        },
        "ms": 0.0295,
        "min_ms": 0.0296,
        "max_ms": 0.0293,
        "GB/s": 9.45,
        "TFLOPS": 1.14
    },
    {
        "params": {
            "M": 128,
            "N": 2048,
            "K": 32,
            "block_m": 64,
            "block_n": 64,
            "block_k": 32,
            "dtype_str": "fp16",
            "num_warps": 4
        },
        "ms": 0.0223,
        "min_ms": 0.0224,
        "max_ms": 0.0221,
        "GB/s": 12.52,
        "TFLOPS": 1.51
    },
    {
        "params": {
            "M": 128,
            "N": 2048,
            "K": 32,
            "block_m": 64,
            "block_n": 128,
            "block_k": 32,
            "dtype_str": "fp16",
            "num_warps": 4
        },
        "ms": 0.0214,
        "min_ms": 0.022,
        "max_ms": 0.0213,
        "GB/s": 13.01,
        "TFLOPS": 1.57
    },
    {
        "params": {
            "M": 128,
            "N": 2048,
            "K": 32,
            "block_m": 128,
            "block_n": 32,
            "block_k": 32,
            "dtype_str": "fp16",
            "num_warps": 4
        },
        "ms": 0.0292,
        "min_ms": 0.0294,
        "max_ms": 0.029,
        "GB/s": 9.53,
        "TFLOPS": 1.15
    },
    {
        "params": {
            "M": 128,
            "N": 2048,
            "K": 32,
            "block_m": 128,
            "block_n": 64,
            "block_k": 32,
            "dtype_str": "fp16",
            "num_warps": 4
        },
        "ms": 0.022,
        "min_ms": 0.0224,
        "max_ms": 0.0219,
        "GB/s": 12.67,
        "TFLOPS": 1.53
    },
    {
        "params": {
            "M": 128,
            "N": 2048,
            "K": 32,
            "block_m": 128,
            "block_n": 128,
            "block_k": 32,
            "dtype_str": "fp16",
            "num_warps": 4
        },
        "ms": 0.0213,
        "min_ms": 0.0215,
        "max_ms": 0.0212,
        "GB/s": 13.06,
        "TFLOPS": 1.57
    },
    {
        "params": {
            "M": 128,
            "N": 4096,
            "K": 32,
            "block_m": 32,
            "block_n": 32,
            "block_k": 32,
            "dtype_str": "fp16",
            "num_warps": 4
        },
        "ms": 0.0548,
        "min_ms": 0.0552,
        "max_ms": 0.0546,
        "GB/s": 9.86,
        "TFLOPS": 1.22
    },
    {
        "params": {
            "M": 128,
            "N": 4096,
            "K": 32,
            "block_m": 32,
            "block_n": 64,
            "block_k": 32,
            "dtype_str": "fp16",
            "num_warps": 4
        },
        "ms": 0.0395,
        "min_ms": 0.0396,
        "max_ms": 0.0394,
        "GB/s": 13.71,
        "TFLOPS": 1.7
    },
    {
        "params": {
            "M": 128,
            "N": 4096,
            "K": 32,
            "block_m": 32,
            "block_n": 128,
            "block_k": 32,
            "dtype_str": "fp16",
            "num_warps": 4
        },
        "ms": 0.0368,
        "min_ms": 0.0369,
        "max_ms": 0.0367,
        "GB/s": 14.69,
        "TFLOPS": 1.82
    },
    {
        "params": {
            "M": 128,
            "N": 4096,
            "K": 32,
            "block_m": 64,
            "block_n": 32,
            "block_k": 32,
            "dtype_str": "fp16",
            "num_warps": 4
        },
        "ms": 0.0548,
        "min_ms": 0.055,
        "max_ms": 0.0546,
        "GB/s": 9.87,
        "TFLOPS": 1.22
    },
    {
        "params": {
            "M": 128,
            "N": 4096,
            "K": 32,
            "block_m": 64,
            "block_n": 64,
            "block_k": 32,
            "dtype_str": "fp16",
            "num_warps": 4
        },
        "ms": 0.0397,
        "min_ms": 0.0398,
        "max_ms": 0.0396,
        "GB/s": 13.62,
        "TFLOPS": 1.69
    },
    {
        "params": {
            "M": 128,
            "N": 4096,
            "K": 32,
            "block_m": 64,
            "block_n": 128,
            "block_k": 32,
            "dtype_str": "fp16",
            "num_warps": 4
        },
        "ms": 0.0376,
        "min_ms": 0.0378,
        "max_ms": 0.0376,
        "GB/s": 14.36,
        "TFLOPS": 1.78
    },
    {
        "params": {
            "M": 128,
            "N": 4096,
            "K": 32,
            "block_m": 128,
            "block_n": 32,
            "block_k": 32,
            "dtype_str": "fp16",
            "num_warps": 4
        },
        "ms": 0.0542,
        "min_ms": 0.0548,
        "max_ms": 0.0537,
        "GB/s": 9.97,
        "TFLOPS": 1.24
    },
    {
        "params": {
            "M": 128,
            "N": 4096,
            "K": 32,
            "block_m": 128,
            "block_n": 64,
            "block_k": 32,
            "dtype_str": "fp16",
            "num_warps": 4
        },
        "ms": 0.039,
        "min_ms": 0.0391,
        "max_ms": 0.0389,
        "GB/s": 13.86,
        "TFLOPS": 1.72
    },
    {
        "params": {
            "M": 128,
            "N": 4096,
            "K": 32,
            "block_m": 128,
            "block_n": 128,
            "block_k": 32,
            "dtype_str": "fp16",
            "num_warps": 4
        },
        "ms": 0.0376,
        "min_ms": 0.0377,
        "max_ms": 0.0375,
        "GB/s": 14.38,
        "TFLOPS": 1.78
    },
    {
        "params": {
            "M": 256,
            "N": 128,
            "K": 32,
            "block_m": 32,
            "block_n": 32,
            "block_k": 32,
            "dtype_str": "fp16",
            "num_warps": 4
        },
        "ms": 0.0064,
        "min_ms": 0.0065,
        "max_ms": 0.0063,
        "GB/s": 7.71,
        "TFLOPS": 0.66
    },
    {
        "params": {
            "M": 256,
            "N": 128,
            "K": 32,
            "block_m": 32,
            "block_n": 64,
            "block_k": 32,
            "dtype_str": "fp16",
            "num_warps": 4
        },
        "ms": 0.0061,
        "min_ms": 0.0062,
        "max_ms": 0.0061,
        "GB/s": 8.01,
        "TFLOPS": 0.68
    },
    {
        "params": {
            "M": 256,
            "N": 128,
            "K": 32,
            "block_m": 32,
            "block_n": 128,
            "block_k": 32,
            "dtype_str": "fp16",
            "num_warps": 4
        },
        "ms": 0.0061,
        "min_ms": 0.0063,
        "max_ms": 0.0061,
        "GB/s": 8.01,
        "TFLOPS": 0.68
    },
    {
        "params": {
            "M": 256,
            "N": 128,
            "K": 32,
            "block_m": 64,
            "block_n": 32,
            "block_k": 32,
            "dtype_str": "fp16",
            "num_warps": 4
        },
        "ms": 0.0062,
        "min_ms": 0.0063,
        "max_ms": 0.0061,
        "GB/s": 7.96,
        "TFLOPS": 0.68
    },
    {
        "params": {
            "M": 256,
            "N": 128,
            "K": 32,
            "block_m": 64,
            "block_n": 64,
            "block_k": 32,
            "dtype_str": "fp16",
            "num_warps": 4
        },
        "ms": 0.0061,
        "min_ms": 0.0062,
        "max_ms": 0.0061,
        "GB/s": 8.07,
        "TFLOPS": 0.69
    },
    {
        "params": {
            "M": 256,
            "N": 128,
            "K": 32,
            "block_m": 64,
            "block_n": 128,
            "block_k": 32,
            "dtype_str": "fp16",
            "num_warps": 4
        },
        "ms": 0.0061,
        "min_ms": 0.0062,
        "max_ms": 0.006,
        "GB/s": 8.07,
        "TFLOPS": 0.69
    },
    {
        "params": {
            "M": 256,
            "N": 128,
            "K": 32,
            "block_m": 128,
            "block_n": 32,
            "block_k": 32,
            "dtype_str": "fp16",
            "num_warps": 4
        },
        "ms": 0.0063,
        "min_ms": 0.0065,
        "max_ms": 0.0063,
        "GB/s": 7.76,
        "TFLOPS": 0.66
    },
    {
        "params": {
            "M": 256,
            "N": 128,
            "K": 32,
            "block_m": 128,
            "block_n": 64,
            "block_k": 32,
            "dtype_str": "fp16",
            "num_warps": 4
        },
        "ms": 0.006,
        "min_ms": 0.0061,
        "max_ms": 0.0059,
        "GB/s": 8.23,
        "TFLOPS": 0.7
    },
    {
        "params": {
            "M": 256,
            "N": 128,
            "K": 32,
            "block_m": 128,
            "block_n": 128,
            "block_k": 32,
            "dtype_str": "fp16",
            "num_warps": 4
        },
        "ms": 0.006,
        "min_ms": 0.0061,
        "max_ms": 0.0059,
        "GB/s": 8.23,
        "TFLOPS": 0.7
    },
    {
        "params": {
            "M": 256,
            "N": 256,
            "K": 32,
            "block_m": 32,
            "block_n": 32,
            "block_k": 32,
            "dtype_str": "fp16",
            "num_warps": 4
        },
        "ms": 0.0079,
        "min_ms": 0.008,
        "max_ms": 0.0078,
        "GB/s": 8.3,
        "TFLOPS": 1.06
    },
    {
        "params": {
            "M": 256,
            "N": 256,
            "K": 32,
            "block_m": 32,
            "block_n": 64,
            "block_k": 32,
            "dtype_str": "fp16",
            "num_warps": 4
        },
        "ms": 0.0069,
        "min_ms": 0.0071,
        "max_ms": 0.0068,
        "GB/s": 9.45,
        "TFLOPS": 1.21
    },
    {
        "params": {
            "M": 256,
            "N": 256,
            "K": 32,
            "block_m": 32,
            "block_n": 128,
            "block_k": 32,
            "dtype_str": "fp16",
            "num_warps": 4
        },
        "ms": 0.0072,
        "min_ms": 0.0073,
        "max_ms": 0.0071,
        "GB/s": 9.13,
        "TFLOPS": 1.17
    },
    {
        "params": {
            "M": 256,
            "N": 256,
            "K": 32,
            "block_m": 64,
            "block_n": 32,
            "block_k": 32,
            "dtype_str": "fp16",
            "num_warps": 4
        },
        "ms": 0.0077,
        "min_ms": 0.0078,
        "max_ms": 0.0076,
        "GB/s": 8.56,
        "TFLOPS": 1.1
    },
    {
        "params": {
            "M": 256,
            "N": 256,
            "K": 32,
            "block_m": 64,
            "block_n": 64,
            "block_k": 32,
            "dtype_str": "fp16",
            "num_warps": 4
        },
        "ms": 0.0068,
        "min_ms": 0.0069,
        "max_ms": 0.0067,
        "GB/s": 9.62,
        "TFLOPS": 1.23
    },
    {
        "params": {
            "M": 256,
            "N": 256,
            "K": 32,
            "block_m": 64,
            "block_n": 128,
            "block_k": 32,
            "dtype_str": "fp16",
            "num_warps": 4
        },
        "ms": 0.007,
        "min_ms": 0.0071,
        "max_ms": 0.007,
        "GB/s": 9.34,
        "TFLOPS": 1.2
    },
    {
        "params": {
            "M": 256,
            "N": 256,
            "K": 32,
            "block_m": 128,
            "block_n": 32,
            "block_k": 32,
            "dtype_str": "fp16",
            "num_warps": 4
        },
        "ms": 0.0079,
        "min_ms": 0.008,
        "max_ms": 0.0078,
        "GB/s": 8.34,
        "TFLOPS": 1.07
    },
    {
        "params": {
            "M": 256,
            "N": 256,
            "K": 32,
            "block_m": 128,
            "block_n": 64,
            "block_k": 32,
            "dtype_str": "fp16",
            "num_warps": 4
        },
        "ms": 0.007,
        "min_ms": 0.0071,
        "max_ms": 0.0069,
        "GB/s": 9.39,
        "TFLOPS": 1.2
    },
    {
        "params": {
            "M": 256,
            "N": 256,
            "K": 32,
            "block_m": 128,
            "block_n": 128,
            "block_k": 32,
            "dtype_str": "fp16",
            "num_warps": 4
        },
        "ms": 0.007,
        "min_ms": 0.0072,
        "max_ms": 0.0069,
        "GB/s": 9.34,
        "TFLOPS": 1.2
    },
    {
        "params": {
            "M": 256,
            "N": 512,
            "K": 32,
            "block_m": 32,
            "block_n": 32,
            "block_k": 32,
            "dtype_str": "fp16",
            "num_warps": 4
        },
        "ms": 0.0109,
        "min_ms": 0.0111,
        "max_ms": 0.0108,
        "GB/s": 8.98,
        "TFLOPS": 1.53
    },
    {
        "params": {
            "M": 256,
            "N": 512,
            "K": 32,
            "block_m": 32,
            "block_n": 64,
            "block_k": 32,
            "dtype_str": "fp16",
            "num_warps": 4
        },
        "ms": 0.0091,
        "min_ms": 0.0093,
        "max_ms": 0.009,
        "GB/s": 10.8,
        "TFLOPS": 1.84
    },
    {
        "params": {
            "M": 256,
            "N": 512,
            "K": 32,
            "block_m": 32,
            "block_n": 128,
            "block_k": 32,
            "dtype_str": "fp16",
            "num_warps": 4
        },
        "ms": 0.0091,
        "min_ms": 0.0093,
        "max_ms": 0.009,
        "GB/s": 10.75,
        "TFLOPS": 1.84
    },
    {
        "params": {
            "M": 256,
            "N": 512,
            "K": 32,
            "block_m": 64,
            "block_n": 32,
            "block_k": 32,
            "dtype_str": "fp16",
            "num_warps": 4
        },
        "ms": 0.0107,
        "min_ms": 0.0108,
        "max_ms": 0.0106,
        "GB/s": 9.18,
        "TFLOPS": 1.57
    },
    {
        "params": {
            "M": 256,
            "N": 512,
            "K": 32,
            "block_m": 64,
            "block_n": 64,
            "block_k": 32,
            "dtype_str": "fp16",
            "num_warps": 4
        },
        "ms": 0.009,
        "min_ms": 0.0091,
        "max_ms": 0.0089,
        "GB/s": 10.95,
        "TFLOPS": 1.87
    },
    {
        "params": {
            "M": 256,
            "N": 512,
            "K": 32,
            "block_m": 64,
            "block_n": 128,
            "block_k": 32,
            "dtype_str": "fp16",
            "num_warps": 4
        },
        "ms": 0.009,
        "min_ms": 0.0091,
        "max_ms": 0.009,
        "GB/s": 10.9,
        "TFLOPS": 1.86
    },
    {
        "params": {
            "M": 256,
            "N": 512,
            "K": 32,
            "block_m": 128,
            "block_n": 32,
            "block_k": 32,
            "dtype_str": "fp16",
            "num_warps": 4
        },
        "ms": 0.0109,
        "min_ms": 0.011,
        "max_ms": 0.0107,
        "GB/s": 9.05,
        "TFLOPS": 1.54
    },
    {
        "params": {
            "M": 256,
            "N": 512,
            "K": 32,
            "block_m": 128,
            "block_n": 64,
            "block_k": 32,
            "dtype_str": "fp16",
            "num_warps": 4
        },
        "ms": 0.0091,
        "min_ms": 0.0092,
        "max_ms": 0.009,
        "GB/s": 10.83,
        "TFLOPS": 1.85
    },
    {
        "params": {
            "M": 256,
            "N": 512,
            "K": 32,
            "block_m": 128,
            "block_n": 128,
            "block_k": 32,
            "dtype_str": "fp16",
            "num_warps": 4
        },
        "ms": 0.009,
        "min_ms": 0.0092,
        "max_ms": 0.0089,
        "GB/s": 10.9,
        "TFLOPS": 1.86
    },
    {
        "params": {
            "M": 256,
            "N": 1024,
            "K": 32,
            "block_m": 32,
            "block_n": 32,
            "block_k": 32,
            "dtype_str": "fp16",
            "num_warps": 4
        },
        "ms": 0.0172,
        "min_ms": 0.0174,
        "max_ms": 0.0171,
        "GB/s": 9.53,
        "TFLOPS": 1.95
    },
    {
        "params": {
            "M": 256,
            "N": 1024,
            "K": 32,
            "block_m": 32,
            "block_n": 64,
            "block_k": 32,
            "dtype_str": "fp16",
            "num_warps": 4
        },
        "ms": 0.0134,
        "min_ms": 0.0136,
        "max_ms": 0.0133,
        "GB/s": 12.2,
        "TFLOPS": 2.5
    },
    {
        "params": {
            "M": 256,
            "N": 1024,
            "K": 32,
            "block_m": 32,
            "block_n": 128,
            "block_k": 32,
            "dtype_str": "fp16",
            "num_warps": 4
        },
        "ms": 0.0131,
        "min_ms": 0.0132,
        "max_ms": 0.013,
        "GB/s": 12.5,
        "TFLOPS": 2.56
    },
    {
        "params": {
            "M": 256,
            "N": 1024,
            "K": 32,
            "block_m": 64,
            "block_n": 32,
            "block_k": 32,
            "dtype_str": "fp16",
            "num_warps": 4
        },
        "ms": 0.0169,
        "min_ms": 0.017,
        "max_ms": 0.0168,
        "GB/s": 9.68,
        "TFLOPS": 1.98
    },
    {
        "params": {
            "M": 256,
            "N": 1024,
            "K": 32,
            "block_m": 64,
            "block_n": 64,
            "block_k": 32,
            "dtype_str": "fp16",
            "num_warps": 4
        },
        "ms": 0.0133,
        "min_ms": 0.0134,
        "max_ms": 0.0133,
        "GB/s": 12.31,
        "TFLOPS": 2.52
    },
    {
        "params": {
            "M": 256,
            "N": 1024,
            "K": 32,
            "block_m": 64,
            "block_n": 128,
            "block_k": 32,
            "dtype_str": "fp16",
            "num_warps": 4
        },
        "ms": 0.0131,
        "min_ms": 0.0132,
        "max_ms": 0.013,
        "GB/s": 12.54,
        "TFLOPS": 2.57
    },
    {
        "params": {
            "M": 256,
            "N": 1024,
            "K": 32,
            "block_m": 128,
            "block_n": 32,
            "block_k": 32,
            "dtype_str": "fp16",
            "num_warps": 4
        },
        "ms": 0.0169,
        "min_ms": 0.017,
        "max_ms": 0.0168,
        "GB/s": 9.68,
        "TFLOPS": 1.98
    },
    {
        "params": {
            "M": 256,
            "N": 1024,
            "K": 32,
            "block_m": 128,
            "block_n": 64,
            "block_k": 32,
            "dtype_str": "fp16",
            "num_warps": 4
        },
        "ms": 0.0133,
        "min_ms": 0.0135,
        "max_ms": 0.0132,
        "GB/s": 12.27,
        "TFLOPS": 2.51
    },
    {
        "params": {
            "M": 256,
            "N": 1024,
            "K": 32,
            "block_m": 128,
            "block_n": 128,
            "block_k": 32,
            "dtype_str": "fp16",
            "num_warps": 4
        },
        "ms": 0.0131,
        "min_ms": 0.0132,
        "max_ms": 0.013,
        "GB/s": 12.5,
        "TFLOPS": 2.56
    },
    {
        "params": {
            "M": 256,
            "N": 2048,
            "K": 32,
            "block_m": 32,
            "block_n": 32,
            "block_k": 32,
            "dtype_str": "fp16",
            "num_warps": 4
        },
        "ms": 0.0297,
        "min_ms": 0.0299,
        "max_ms": 0.0296,
        "GB/s": 9.91,
        "TFLOPS": 2.26
    },
    {
        "params": {
            "M": 256,
            "N": 2048,
            "K": 32,
            "block_m": 32,
            "block_n": 64,
            "block_k": 32,
            "dtype_str": "fp16",
            "num_warps": 4
        },
        "ms": 0.0222,
        "min_ms": 0.0225,
        "max_ms": 0.0221,
        "GB/s": 13.28,
        "TFLOPS": 3.02
    },
    {
        "params": {
            "M": 256,
            "N": 2048,
            "K": 32,
            "block_m": 32,
            "block_n": 128,
            "block_k": 32,
            "dtype_str": "fp16",
            "num_warps": 4
        },
        "ms": 0.0211,
        "min_ms": 0.0214,
        "max_ms": 0.021,
        "GB/s": 13.96,
        "TFLOPS": 3.18
    },
    {
        "params": {
            "M": 256,
            "N": 2048,
            "K": 32,
            "block_m": 64,
            "block_n": 32,
            "block_k": 32,
            "dtype_str": "fp16",
            "num_warps": 4
        },
        "ms": 0.0294,
        "min_ms": 0.0296,
        "max_ms": 0.0293,
        "GB/s": 10.02,
        "TFLOPS": 2.28
    },
    {
        "params": {
            "M": 256,
            "N": 2048,
            "K": 32,
            "block_m": 64,
            "block_n": 64,
            "block_k": 32,
            "dtype_str": "fp16",
            "num_warps": 4
        },
        "ms": 0.0221,
        "min_ms": 0.0225,
        "max_ms": 0.022,
        "GB/s": 13.33,
        "TFLOPS": 3.03
    },
    {
        "params": {
            "M": 256,
            "N": 2048,
            "K": 32,
            "block_m": 64,
            "block_n": 128,
            "block_k": 32,
            "dtype_str": "fp16",
            "num_warps": 4
        },
        "ms": 0.0212,
        "min_ms": 0.0214,
        "max_ms": 0.0211,
        "GB/s": 13.88,
        "TFLOPS": 3.16
    },
    {
        "params": {
            "M": 256,
            "N": 2048,
            "K": 32,
            "block_m": 128,
            "block_n": 32,
            "block_k": 32,
            "dtype_str": "fp16",
            "num_warps": 4
        },
        "ms": 0.0292,
        "min_ms": 0.0293,
        "max_ms": 0.0291,
        "GB/s": 10.09,
        "TFLOPS": 2.3
    },
    {
        "params": {
            "M": 256,
            "N": 2048,
            "K": 32,
            "block_m": 128,
            "block_n": 64,
            "block_k": 32,
            "dtype_str": "fp16",
            "num_warps": 4
        },
        "ms": 0.022,
        "min_ms": 0.0225,
        "max_ms": 0.0218,
        "GB/s": 13.42,
        "TFLOPS": 3.05
    },
    {
        "params": {
            "M": 256,
            "N": 2048,
            "K": 32,
            "block_m": 128,
            "block_n": 128,
            "block_k": 32,
            "dtype_str": "fp16",
            "num_warps": 4
        },
        "ms": 0.0213,
        "min_ms": 0.0215,
        "max_ms": 0.0212,
        "GB/s": 13.83,
        "TFLOPS": 3.15
    },
    {
        "params": {
            "M": 256,
            "N": 4096,
            "K": 32,
            "block_m": 32,
            "block_n": 32,
            "block_k": 32,
            "dtype_str": "fp16",
            "num_warps": 4
        },
        "ms": 0.0552,
        "min_ms": 0.0554,
        "max_ms": 0.0551,
        "GB/s": 10.08,
        "TFLOPS": 2.43
    },
    {
        "params": {
            "M": 256,
            "N": 4096,
            "K": 32,
            "block_m": 32,
            "block_n": 64,
            "block_k": 32,
            "dtype_str": "fp16",
            "num_warps": 4
        },
        "ms": 0.0397,
        "min_ms": 0.0398,
        "max_ms": 0.0395,
        "GB/s": 14.05,
        "TFLOPS": 3.39
    },
    {
        "params": {
            "M": 256,
            "N": 4096,
            "K": 32,
            "block_m": 32,
            "block_n": 128,
            "block_k": 32,
            "dtype_str": "fp16",
            "num_warps": 4
        },
        "ms": 0.037,
        "min_ms": 0.0372,
        "max_ms": 0.0369,
        "GB/s": 15.04,
        "TFLOPS": 3.62
    },
    {
        "params": {
            "M": 256,
            "N": 4096,
            "K": 32,
            "block_m": 64,
            "block_n": 32,
            "block_k": 32,
            "dtype_str": "fp16",
            "num_warps": 4
        },
        "ms": 0.0548,
        "min_ms": 0.0551,
        "max_ms": 0.0546,
        "GB/s": 10.16,
        "TFLOPS": 2.45
    },
    {
        "params": {
            "M": 256,
            "N": 4096,
            "K": 32,
            "block_m": 64,
            "block_n": 64,
            "block_k": 32,
            "dtype_str": "fp16",
            "num_warps": 4
        },
        "ms": 0.0396,
        "min_ms": 0.0397,
        "max_ms": 0.0395,
        "GB/s": 14.08,
        "TFLOPS": 3.39
    },
    {
        "params": {
            "M": 256,
            "N": 4096,
            "K": 32,
            "block_m": 64,
            "block_n": 128,
            "block_k": 32,
            "dtype_str": "fp16",
            "num_warps": 4
        },
        "ms": 0.0375,
        "min_ms": 0.0376,
        "max_ms": 0.0374,
        "GB/s": 14.84,
        "TFLOPS": 3.58
    },
    {
        "params": {
            "M": 256,
            "N": 4096,
            "K": 32,
            "block_m": 128,
            "block_n": 32,
            "block_k": 32,
            "dtype_str": "fp16",
            "num_warps": 4
        },
        "ms": 0.0541,
        "min_ms": 0.0543,
        "max_ms": 0.0538,
        "GB/s": 10.3,
        "TFLOPS": 2.48
    },
    {
        "params": {
            "M": 256,
            "N": 4096,
            "K": 32,
            "block_m": 128,
            "block_n": 64,
            "block_k": 32,
            "dtype_str": "fp16",
            "num_warps": 4
        },
        "ms": 0.039,
        "min_ms": 0.0391,
        "max_ms": 0.0389,
        "GB/s": 14.29,
        "TFLOPS": 3.44
    },
    {
        "params": {
            "M": 256,
            "N": 4096,
            "K": 32,
            "block_m": 128,
            "block_n": 128,
            "block_k": 32,
            "dtype_str": "fp16",
            "num_warps": 4
        },
        "ms": 0.0376,
        "min_ms": 0.0377,
        "max_ms": 0.0375,
        "GB/s": 14.83,
        "TFLOPS": 3.57
    },
    {
        "params": {
            "M": 512,
            "N": 128,
            "K": 32,
            "block_m": 32,
            "block_n": 32,
            "block_k": 32,
            "dtype_str": "fp16",
            "num_warps": 4
        },
        "ms": 0.0063,
        "min_ms": 0.0065,
        "max_ms": 0.0063,
        "GB/s": 12.93,
        "TFLOPS": 1.32
    },
    {
        "params": {
            "M": 512,
            "N": 128,
            "K": 32,
            "block_m": 32,
            "block_n": 64,
            "block_k": 32,
            "dtype_str": "fp16",
            "num_warps": 4
        },
        "ms": 0.0061,
        "min_ms": 0.0062,
        "max_ms": 0.0061,
        "GB/s": 13.36,
        "TFLOPS": 1.37
    },
    {
        "params": {
            "M": 512,
            "N": 128,
            "K": 32,
            "block_m": 32,
            "block_n": 128,
            "block_k": 32,
            "dtype_str": "fp16",
            "num_warps": 4
        },
        "ms": 0.0062,
        "min_ms": 0.0063,
        "max_ms": 0.0061,
        "GB/s": 13.27,
        "TFLOPS": 1.36
    },
    {
        "params": {
            "M": 512,
            "N": 128,
            "K": 32,
            "block_m": 64,
            "block_n": 32,
            "block_k": 32,
            "dtype_str": "fp16",
            "num_warps": 4
        },
        "ms": 0.0065,
        "min_ms": 0.0066,
        "max_ms": 0.0063,
        "GB/s": 12.69,
        "TFLOPS": 1.3
    },
    {
        "params": {
            "M": 512,
            "N": 128,
            "K": 32,
            "block_m": 64,
            "block_n": 64,
            "block_k": 32,
            "dtype_str": "fp16",
            "num_warps": 4
        },
        "ms": 0.0061,
        "min_ms": 0.0062,
        "max_ms": 0.0061,
        "GB/s": 13.44,
        "TFLOPS": 1.38
    },
    {
        "params": {
            "M": 512,
            "N": 128,
            "K": 32,
            "block_m": 64,
            "block_n": 128,
            "block_k": 32,
            "dtype_str": "fp16",
            "num_warps": 4
        },
        "ms": 0.0061,
        "min_ms": 0.0063,
        "max_ms": 0.0061,
        "GB/s": 13.36,
        "TFLOPS": 1.37
    },
    {
        "params": {
            "M": 512,
            "N": 128,
            "K": 32,
            "block_m": 128,
            "block_n": 32,
            "block_k": 32,
            "dtype_str": "fp16",
            "num_warps": 4
        },
        "ms": 0.0063,
        "min_ms": 0.0065,
        "max_ms": 0.0063,
        "GB/s": 12.93,
        "TFLOPS": 1.32
    },
    {
        "params": {
            "M": 512,
            "N": 128,
            "K": 32,
            "block_m": 128,
            "block_n": 64,
            "block_k": 32,
            "dtype_str": "fp16",
            "num_warps": 4
        },
        "ms": 0.0061,
        "min_ms": 0.0062,
        "max_ms": 0.0061,
        "GB/s": 13.36,
        "TFLOPS": 1.37
    },
    {
        "params": {
            "M": 512,
            "N": 128,
            "K": 32,
            "block_m": 128,
            "block_n": 128,
            "block_k": 32,
            "dtype_str": "fp16",
            "num_warps": 4
        },
        "ms": 0.0061,
        "min_ms": 0.0062,
        "max_ms": 0.0061,
        "GB/s": 13.36,
        "TFLOPS": 1.37
    },
    {
        "params": {
            "M": 512,
            "N": 256,
            "K": 32,
            "block_m": 32,
            "block_n": 32,
            "block_k": 32,
            "dtype_str": "fp16",
            "num_warps": 4
        },
        "ms": 0.0079,
        "min_ms": 0.0081,
        "max_ms": 0.0078,
        "GB/s": 12.45,
        "TFLOPS": 2.12
    },
    {
        "params": {
            "M": 512,
            "N": 256,
            "K": 32,
            "block_m": 32,
            "block_n": 64,
            "block_k": 32,
            "dtype_str": "fp16",
            "num_warps": 4
        },
        "ms": 0.0069,
        "min_ms": 0.0071,
        "max_ms": 0.0068,
        "GB/s": 14.17,
        "TFLOPS": 2.42
    },
    {
        "params": {
            "M": 512,
            "N": 256,
            "K": 32,
            "block_m": 32,
            "block_n": 128,
            "block_k": 32,
            "dtype_str": "fp16",
            "num_warps": 4
        },
        "ms": 0.0072,
        "min_ms": 0.0074,
        "max_ms": 0.0071,
        "GB/s": 13.62,
        "TFLOPS": 2.33
    },
    {
        "params": {
            "M": 512,
            "N": 256,
            "K": 32,
            "block_m": 64,
            "block_n": 32,
            "block_k": 32,
            "dtype_str": "fp16",
            "num_warps": 4
        },
        "ms": 0.008,
        "min_ms": 0.0081,
        "max_ms": 0.0079,
        "GB/s": 12.26,
        "TFLOPS": 2.09
    },
    {
        "params": {
            "M": 512,
            "N": 256,
            "K": 32,
            "block_m": 64,
            "block_n": 64,
            "block_k": 32,
            "dtype_str": "fp16",
            "num_warps": 4
        },
        "ms": 0.0071,
        "min_ms": 0.0072,
        "max_ms": 0.0069,
        "GB/s": 13.93,
        "TFLOPS": 2.38
    },
    {
        "params": {
            "M": 512,
            "N": 256,
            "K": 32,
            "block_m": 64,
            "block_n": 128,
            "block_k": 32,
            "dtype_str": "fp16",
            "num_warps": 4
        },
        "ms": 0.0072,
        "min_ms": 0.0074,
        "max_ms": 0.0071,
        "GB/s": 13.62,
        "TFLOPS": 2.33
    },
    {
        "params": {
            "M": 512,
            "N": 256,
            "K": 32,
            "block_m": 128,
            "block_n": 32,
            "block_k": 32,
            "dtype_str": "fp16",
            "num_warps": 4
        },
        "ms": 0.0078,
        "min_ms": 0.0079,
        "max_ms": 0.0078,
        "GB/s": 12.57,
        "TFLOPS": 2.15
    },
    {
        "params": {
            "M": 512,
            "N": 256,
            "K": 32,
            "block_m": 128,
            "block_n": 64,
            "block_k": 32,
            "dtype_str": "fp16",
            "num_warps": 4
        },
        "ms": 0.007,
        "min_ms": 0.0071,
        "max_ms": 0.0069,
        "GB/s": 14.09,
        "TFLOPS": 2.41
    },
    {
        "params": {
            "M": 512,
            "N": 256,
            "K": 32,
            "block_m": 128,
            "block_n": 128,
            "block_k": 32,
            "dtype_str": "fp16",
            "num_warps": 4
        },
        "ms": 0.007,
        "min_ms": 0.0072,
        "max_ms": 0.007,
        "GB/s": 14.01,
        "TFLOPS": 2.39
    },
    {
        "params": {
            "M": 512,
            "N": 512,
            "K": 32,
            "block_m": 32,
            "block_n": 32,
            "block_k": 32,
            "dtype_str": "fp16",
            "num_warps": 4
        },
        "ms": 0.011,
        "min_ms": 0.0111,
        "max_ms": 0.0109,
        "GB/s": 11.93,
        "TFLOPS": 3.05
    },
    {
        "params": {
            "M": 512,
            "N": 512,
            "K": 32,
            "block_m": 32,
            "block_n": 64,
            "block_k": 32,
            "dtype_str": "fp16",
            "num_warps": 4
        },
        "ms": 0.0092,
        "min_ms": 0.0094,
        "max_ms": 0.0091,
        "GB/s": 14.28,
        "TFLOPS": 3.65
    },
    {
        "params": {
            "M": 512,
            "N": 512,
            "K": 32,
            "block_m": 32,
            "block_n": 128,
            "block_k": 32,
            "dtype_str": "fp16",
            "num_warps": 4
        },
        "ms": 0.0092,
        "min_ms": 0.0094,
        "max_ms": 0.0091,
        "GB/s": 14.21,
        "TFLOPS": 3.64
    },
    {
        "params": {
            "M": 512,
            "N": 512,
            "K": 32,
            "block_m": 64,
            "block_n": 32,
            "block_k": 32,
            "dtype_str": "fp16",
            "num_warps": 4
        },
        "ms": 0.0111,
        "min_ms": 0.0112,
        "max_ms": 0.011,
        "GB/s": 11.8,
        "TFLOPS": 3.02
    },
    {
        "params": {
            "M": 512,
            "N": 512,
            "K": 32,
            "block_m": 64,
            "block_n": 64,
            "block_k": 32,
            "dtype_str": "fp16",
            "num_warps": 4
        },
        "ms": 0.0092,
        "min_ms": 0.0094,
        "max_ms": 0.0091,
        "GB/s": 14.18,
        "TFLOPS": 3.63
    },
    {
        "params": {
            "M": 512,
            "N": 512,
            "K": 32,
            "block_m": 64,
            "block_n": 128,
            "block_k": 32,
            "dtype_str": "fp16",
            "num_warps": 4
        },
        "ms": 0.0093,
        "min_ms": 0.0095,
        "max_ms": 0.0092,
        "GB/s": 14.15,
        "TFLOPS": 3.62
    },
    {
        "params": {
            "M": 512,
            "N": 512,
            "K": 32,
            "block_m": 128,
            "block_n": 32,
            "block_k": 32,
            "dtype_str": "fp16",
            "num_warps": 4
        },
        "ms": 0.0109,
        "min_ms": 0.011,
        "max_ms": 0.0108,
        "GB/s": 12.06,
        "TFLOPS": 3.09
    },
    {
        "params": {
            "M": 512,
            "N": 512,
            "K": 32,
            "block_m": 128,
            "block_n": 64,
            "block_k": 32,
            "dtype_str": "fp16",
            "num_warps": 4
        },
        "ms": 0.0091,
        "min_ms": 0.0093,
        "max_ms": 0.0091,
        "GB/s": 14.4,
        "TFLOPS": 3.69
    },
    {
        "params": {
            "M": 512,
            "N": 512,
            "K": 32,
            "block_m": 128,
            "block_n": 128,
            "block_k": 32,
            "dtype_str": "fp16",
            "num_warps": 4
        },
        "ms": 0.0091,
        "min_ms": 0.0092,
        "max_ms": 0.009,
        "GB/s": 14.47,
        "TFLOPS": 3.7
    },
    {
        "params": {
            "M": 512,
            "N": 1024,
            "K": 32,
            "block_m": 32,
            "block_n": 32,
            "block_k": 32,
            "dtype_str": "fp16",
            "num_warps": 4
        },
        "ms": 0.0172,
        "min_ms": 0.0174,
        "max_ms": 0.0171,
        "GB/s": 11.4,
        "TFLOPS": 3.89
    },
    {
        "params": {
            "M": 512,
            "N": 1024,
            "K": 32,
            "block_m": 32,
            "block_n": 64,
            "block_k": 32,
            "dtype_str": "fp16",
            "num_warps": 4
        },
        "ms": 0.0135,
        "min_ms": 0.0137,
        "max_ms": 0.0134,
        "GB/s": 14.55,
        "TFLOPS": 4.97
    },
    {
        "params": {
            "M": 512,
            "N": 1024,
            "K": 32,
            "block_m": 32,
            "block_n": 128,
            "block_k": 32,
            "dtype_str": "fp16",
            "num_warps": 4
        },
        "ms": 0.0131,
        "min_ms": 0.0133,
        "max_ms": 0.013,
        "GB/s": 15.0,
        "TFLOPS": 5.12
    },
    {
        "params": {
            "M": 512,
            "N": 1024,
            "K": 32,
            "block_m": 64,
            "block_n": 32,
            "block_k": 32,
            "dtype_str": "fp16",
            "num_warps": 4
        },
        "ms": 0.0174,
        "min_ms": 0.0175,
        "max_ms": 0.0172,
        "GB/s": 11.33,
        "TFLOPS": 3.87
    },
    {
        "params": {
            "M": 512,
            "N": 1024,
            "K": 32,
            "block_m": 64,
            "block_n": 64,
            "block_k": 32,
            "dtype_str": "fp16",
            "num_warps": 4
        },
        "ms": 0.0136,
        "min_ms": 0.0138,
        "max_ms": 0.0135,
        "GB/s": 14.47,
        "TFLOPS": 4.94
    },
    {
        "params": {
            "M": 512,
            "N": 1024,
            "K": 32,
            "block_m": 64,
            "block_n": 128,
            "block_k": 32,
            "dtype_str": "fp16",
            "num_warps": 4
        },
        "ms": 0.0133,
        "min_ms": 0.0135,
        "max_ms": 0.0132,
        "GB/s": 14.77,
        "TFLOPS": 5.04
    },
    {
        "params": {
            "M": 512,
            "N": 1024,
            "K": 32,
            "block_m": 128,
            "block_n": 32,
            "block_k": 32,
            "dtype_str": "fp16",
            "num_warps": 4
        },
        "ms": 0.017,
        "min_ms": 0.0171,
        "max_ms": 0.0169,
        "GB/s": 11.59,
        "TFLOPS": 3.96
    },
    {
        "params": {
            "M": 512,
            "N": 1024,
            "K": 32,
            "block_m": 128,
            "block_n": 64,
            "block_k": 32,
            "dtype_str": "fp16",
            "num_warps": 4
        },
        "ms": 0.0133,
        "min_ms": 0.0134,
        "max_ms": 0.0133,
        "GB/s": 14.73,
        "TFLOPS": 5.03
    },
    {
        "params": {
            "M": 512,
            "N": 1024,
            "K": 32,
            "block_m": 128,
            "block_n": 128,
            "block_k": 32,
            "dtype_str": "fp16",
            "num_warps": 4
        },
        "ms": 0.0131,
        "min_ms": 0.0132,
        "max_ms": 0.0131,
        "GB/s": 15.0,
        "TFLOPS": 5.12
    },
    {
        "params": {
            "M": 512,
            "N": 2048,
            "K": 32,
            "block_m": 32,
            "block_n": 32,
            "block_k": 32,
            "dtype_str": "fp16",
            "num_warps": 4
        },
        "ms": 0.0297,
        "min_ms": 0.0299,
        "max_ms": 0.0296,
        "GB/s": 11.03,
        "TFLOPS": 4.52
    },
    {
        "params": {
            "M": 512,
            "N": 2048,
            "K": 32,
            "block_m": 32,
            "block_n": 64,
            "block_k": 32,
            "dtype_str": "fp16",
            "num_warps": 4
        },
        "ms": 0.0223,
        "min_ms": 0.0225,
        "max_ms": 0.0222,
        "GB/s": 14.7,
        "TFLOPS": 6.02
    },
    {
        "params": {
            "M": 512,
            "N": 2048,
            "K": 32,
            "block_m": 32,
            "block_n": 128,
            "block_k": 32,
            "dtype_str": "fp16",
            "num_warps": 4
        },
        "ms": 0.0212,
        "min_ms": 0.0213,
        "max_ms": 0.021,
        "GB/s": 15.48,
        "TFLOPS": 6.34
    },
    {
        "params": {
            "M": 512,
            "N": 2048,
            "K": 32,
            "block_m": 64,
            "block_n": 32,
            "block_k": 32,
            "dtype_str": "fp16",
            "num_warps": 4
        },
        "ms": 0.0299,
        "min_ms": 0.0301,
        "max_ms": 0.0298,
        "GB/s": 10.94,
        "TFLOPS": 4.48
    },
    {
        "params": {
            "M": 512,
            "N": 2048,
            "K": 32,
            "block_m": 64,
            "block_n": 64,
            "block_k": 32,
            "dtype_str": "fp16",
            "num_warps": 4
        },
        "ms": 0.0224,
        "min_ms": 0.0227,
        "max_ms": 0.0223,
        "GB/s": 14.62,
        "TFLOPS": 5.99
    },
    {
        "params": {
            "M": 512,
            "N": 2048,
            "K": 32,
            "block_m": 64,
            "block_n": 128,
            "block_k": 32,
            "dtype_str": "fp16",
            "num_warps": 4
        },
        "ms": 0.0215,
        "min_ms": 0.0217,
        "max_ms": 0.0214,
        "GB/s": 15.22,
        "TFLOPS": 6.23
    },
    {
        "params": {
            "M": 512,
            "N": 2048,
            "K": 32,
            "block_m": 128,
            "block_n": 32,
            "block_k": 32,
            "dtype_str": "fp16",
            "num_warps": 4
        },
        "ms": 0.0293,
        "min_ms": 0.0294,
        "max_ms": 0.0291,
        "GB/s": 11.2,
        "TFLOPS": 4.59
    },
    {
        "params": {
            "M": 512,
            "N": 2048,
            "K": 32,
            "block_m": 128,
            "block_n": 64,
            "block_k": 32,
            "dtype_str": "fp16",
            "num_warps": 4
        },
        "ms": 0.0219,
        "min_ms": 0.0221,
        "max_ms": 0.0218,
        "GB/s": 14.94,
        "TFLOPS": 6.12
    },
    {
        "params": {
            "M": 512,
            "N": 2048,
            "K": 32,
            "block_m": 128,
            "block_n": 128,
            "block_k": 32,
            "dtype_str": "fp16",
            "num_warps": 4
        },
        "ms": 0.0213,
        "min_ms": 0.0216,
        "max_ms": 0.0212,
        "GB/s": 15.36,
        "TFLOPS": 6.29
    },
    {
        "params": {
            "M": 512,
            "N": 4096,
            "K": 32,
            "block_m": 32,
            "block_n": 32,
            "block_k": 32,
            "dtype_str": "fp16",
            "num_warps": 4
        },
        "ms": 0.055,
        "min_ms": 0.0551,
        "max_ms": 0.0548,
        "GB/s": 10.73,
        "TFLOPS": 4.88
    },
    {
        "params": {
            "M": 512,
            "N": 4096,
            "K": 32,
            "block_m": 32,
            "block_n": 64,
            "block_k": 32,
            "dtype_str": "fp16",
            "num_warps": 4
        },
        "ms": 0.0398,
        "min_ms": 0.0399,
        "max_ms": 0.0397,
        "GB/s": 14.83,
        "TFLOPS": 6.75
    },
    {
        "params": {
            "M": 512,
            "N": 4096,
            "K": 32,
            "block_m": 32,
            "block_n": 128,
            "block_k": 32,
            "dtype_str": "fp16",
            "num_warps": 4
        },
        "ms": 0.0371,
        "min_ms": 0.0372,
        "max_ms": 0.037,
        "GB/s": 15.91,
        "TFLOPS": 7.24
    },
    {
        "params": {
            "M": 512,
            "N": 4096,
            "K": 32,
            "block_m": 64,
            "block_n": 32,
            "block_k": 32,
            "dtype_str": "fp16",
            "num_warps": 4
        },
        "ms": 0.0554,
        "min_ms": 0.0556,
        "max_ms": 0.0552,
        "GB/s": 10.65,
        "TFLOPS": 4.85
    },
    {
        "params": {
            "M": 512,
            "N": 4096,
            "K": 32,
            "block_m": 64,
            "block_n": 64,
            "block_k": 32,
            "dtype_str": "fp16",
            "num_warps": 4
        },
        "ms": 0.0399,
        "min_ms": 0.04,
        "max_ms": 0.0398,
        "GB/s": 14.79,
        "TFLOPS": 6.73
    },
    {
        "params": {
            "M": 512,
            "N": 4096,
            "K": 32,
            "block_m": 64,
            "block_n": 128,
            "block_k": 32,
            "dtype_str": "fp16",
            "num_warps": 4
        },
        "ms": 0.0378,
        "min_ms": 0.0379,
        "max_ms": 0.0377,
        "GB/s": 15.6,
        "TFLOPS": 7.1
    },
    {
        "params": {
            "M": 512,
            "N": 4096,
            "K": 32,
            "block_m": 128,
            "block_n": 32,
            "block_k": 32,
            "dtype_str": "fp16",
            "num_warps": 4
        },
        "ms": 0.0542,
        "min_ms": 0.0544,
        "max_ms": 0.054,
        "GB/s": 10.89,
        "TFLOPS": 4.96
    },
    {
        "params": {
            "M": 512,
            "N": 4096,
            "K": 32,
            "block_m": 128,
            "block_n": 64,
            "block_k": 32,
            "dtype_str": "fp16",
            "num_warps": 4
        },
        "ms": 0.039,
        "min_ms": 0.0391,
        "max_ms": 0.0389,
        "GB/s": 15.12,
        "TFLOPS": 6.88
    },
    {
        "params": {
            "M": 512,
            "N": 4096,
            "K": 32,
            "block_m": 128,
            "block_n": 128,
            "block_k": 32,
            "dtype_str": "fp16",
            "num_warps": 4
        },
        "ms": 0.0376,
        "min_ms": 0.0377,
        "max_ms": 0.0375,
        "GB/s": 15.68,
        "TFLOPS": 7.14
    },
    {
        "params": {
            "M": 1024,
            "N": 128,
            "K": 32,
            "block_m": 32,
            "block_n": 32,
            "block_k": 32,
            "dtype_str": "fp16",
            "num_warps": 4
        },
        "ms": 0.0063,
        "min_ms": 0.0065,
        "max_ms": 0.0063,
        "GB/s": 23.28,
        "TFLOPS": 2.65
    },
    {
        "params": {
            "M": 1024,
            "N": 128,
            "K": 32,
            "block_m": 32,
            "block_n": 64,
            "block_k": 32,
            "dtype_str": "fp16",
            "num_warps": 4
        },
        "ms": 0.0061,
        "min_ms": 0.0062,
        "max_ms": 0.0061,
        "GB/s": 24.04,
        "TFLOPS": 2.74
    },
    {
        "params": {
            "M": 1024,
            "N": 128,
            "K": 32,
            "block_m": 32,
            "block_n": 128,
            "block_k": 32,
            "dtype_str": "fp16",
            "num_warps": 4
        },
        "ms": 0.0062,
        "min_ms": 0.0063,
        "max_ms": 0.0061,
        "GB/s": 23.88,
        "TFLOPS": 2.72
    },
    {
        "params": {
            "M": 1024,
            "N": 128,
            "K": 32,
            "block_m": 64,
            "block_n": 32,
            "block_k": 32,
            "dtype_str": "fp16",
            "num_warps": 4
        },
        "ms": 0.0065,
        "min_ms": 0.0066,
        "max_ms": 0.0064,
        "GB/s": 22.84,
        "TFLOPS": 2.6
    },
    {
        "params": {
            "M": 1024,
            "N": 128,
            "K": 32,
            "block_m": 64,
            "block_n": 64,
            "block_k": 32,
            "dtype_str": "fp16",
            "num_warps": 4
        },
        "ms": 0.0061,
        "min_ms": 0.0062,
        "max_ms": 0.0061,
        "GB/s": 24.2,
        "TFLOPS": 2.75
    },
    {
        "params": {
            "M": 1024,
            "N": 128,
            "K": 32,
            "block_m": 64,
            "block_n": 128,
            "block_k": 32,
            "dtype_str": "fp16",
            "num_warps": 4
        },
        "ms": 0.0061,
        "min_ms": 0.0063,
        "max_ms": 0.0061,
        "GB/s": 24.04,
        "TFLOPS": 2.74
    },
    {
        "params": {
            "M": 1024,
            "N": 128,
            "K": 32,
            "block_m": 128,
            "block_n": 32,
            "block_k": 32,
            "dtype_str": "fp16",
            "num_warps": 4
        },
        "ms": 0.0065,
        "min_ms": 0.0066,
        "max_ms": 0.0064,
        "GB/s": 22.84,
        "TFLOPS": 2.6
    },
    {
        "params": {
            "M": 1024,
            "N": 128,
            "K": 32,
            "block_m": 128,
            "block_n": 64,
            "block_k": 32,
            "dtype_str": "fp16",
            "num_warps": 4
        },
        "ms": 0.0061,
        "min_ms": 0.0063,
        "max_ms": 0.0061,
        "GB/s": 24.04,
        "TFLOPS": 2.74
    },
    {
        "params": {
            "M": 1024,
            "N": 128,
            "K": 32,
            "block_m": 128,
            "block_n": 128,
            "block_k": 32,
            "dtype_str": "fp16",
            "num_warps": 4
        },
        "ms": 0.0061,
        "min_ms": 0.0063,
        "max_ms": 0.0061,
        "GB/s": 24.04,
        "TFLOPS": 2.74
    },
    {
        "params": {
            "M": 1024,
            "N": 256,
            "K": 32,
            "block_m": 32,
            "block_n": 32,
            "block_k": 32,
            "dtype_str": "fp16",
            "num_warps": 4
        },
        "ms": 0.0079,
        "min_ms": 0.008,
        "max_ms": 0.0078,
        "GB/s": 20.85,
        "TFLOPS": 4.27
    },
    {
        "params": {
            "M": 1024,
            "N": 256,
            "K": 32,
            "block_m": 32,
            "block_n": 64,
            "block_k": 32,
            "dtype_str": "fp16",
            "num_warps": 4
        },
        "ms": 0.007,
        "min_ms": 0.0072,
        "max_ms": 0.0069,
        "GB/s": 23.49,
        "TFLOPS": 4.81
    },
    {
        "params": {
            "M": 1024,
            "N": 256,
            "K": 32,
            "block_m": 32,
            "block_n": 128,
            "block_k": 32,
            "dtype_str": "fp16",
            "num_warps": 4
        },
        "ms": 0.0072,
        "min_ms": 0.0074,
        "max_ms": 0.0071,
        "GB/s": 22.71,
        "TFLOPS": 4.65
    },
    {
        "params": {
            "M": 1024,
            "N": 256,
            "K": 32,
            "block_m": 64,
            "block_n": 32,
            "block_k": 32,
            "dtype_str": "fp16",
            "num_warps": 4
        },
        "ms": 0.008,
        "min_ms": 0.0082,
        "max_ms": 0.0079,
        "GB/s": 20.43,
        "TFLOPS": 4.18
    },
    {
        "params": {
            "M": 1024,
            "N": 256,
            "K": 32,
            "block_m": 64,
            "block_n": 64,
            "block_k": 32,
            "dtype_str": "fp16",
            "num_warps": 4
        },
        "ms": 0.0071,
        "min_ms": 0.0073,
        "max_ms": 0.007,
        "GB/s": 23.09,
        "TFLOPS": 4.73
    },
    {
        "params": {
            "M": 1024,
            "N": 256,
            "K": 32,
            "block_m": 64,
            "block_n": 128,
            "block_k": 32,
            "dtype_str": "fp16",
            "num_warps": 4
        },
        "ms": 0.0073,
        "min_ms": 0.0075,
        "max_ms": 0.0072,
        "GB/s": 22.46,
        "TFLOPS": 4.6
    },
    {
        "params": {
            "M": 1024,
            "N": 256,
            "K": 32,
            "block_m": 128,
            "block_n": 32,
            "block_k": 32,
            "dtype_str": "fp16",
            "num_warps": 4
        },
        "ms": 0.008,
        "min_ms": 0.0081,
        "max_ms": 0.0079,
        "GB/s": 20.54,
        "TFLOPS": 4.21
    },
    {
        "params": {
            "M": 1024,
            "N": 256,
            "K": 32,
            "block_m": 128,
            "block_n": 64,
            "block_k": 32,
            "dtype_str": "fp16",
            "num_warps": 4
        },
        "ms": 0.0071,
        "min_ms": 0.0073,
        "max_ms": 0.007,
        "GB/s": 23.09,
        "TFLOPS": 4.73
    },
    {
        "params": {
            "M": 1024,
            "N": 256,
            "K": 32,
            "block_m": 128,
            "block_n": 128,
            "block_k": 32,
            "dtype_str": "fp16",
            "num_warps": 4
        },
        "ms": 0.0071,
        "min_ms": 0.0073,
        "max_ms": 0.0071,
        "GB/s": 22.96,
        "TFLOPS": 4.7
    },
    {
        "params": {
            "M": 1024,
            "N": 512,
            "K": 32,
            "block_m": 32,
            "block_n": 32,
            "block_k": 32,
            "dtype_str": "fp16",
            "num_warps": 4
        },
        "ms": 0.0109,
        "min_ms": 0.0111,
        "max_ms": 0.0109,
        "GB/s": 17.96,
        "TFLOPS": 6.13
    },
    {
        "params": {
            "M": 1024,
            "N": 512,
            "K": 32,
            "block_m": 32,
            "block_n": 64,
            "block_k": 32,
            "dtype_str": "fp16",
            "num_warps": 4
        },
        "ms": 0.0092,
        "min_ms": 0.0093,
        "max_ms": 0.0091,
        "GB/s": 21.41,
        "TFLOPS": 7.31
    },
    {
        "params": {
            "M": 1024,
            "N": 512,
            "K": 32,
            "block_m": 32,
            "block_n": 128,
            "block_k": 32,
            "dtype_str": "fp16",
            "num_warps": 4
        },
        "ms": 0.0092,
        "min_ms": 0.0094,
        "max_ms": 0.0091,
        "GB/s": 21.32,
        "TFLOPS": 7.28
    },
    {
        "params": {
            "M": 1024,
            "N": 512,
            "K": 32,
            "block_m": 64,
            "block_n": 32,
            "block_k": 32,
            "dtype_str": "fp16",
            "num_warps": 4
        },
        "ms": 0.0111,
        "min_ms": 0.0112,
        "max_ms": 0.011,
        "GB/s": 17.77,
        "TFLOPS": 6.06
    },
    {
        "params": {
            "M": 1024,
            "N": 512,
            "K": 32,
            "block_m": 64,
            "block_n": 64,
            "block_k": 32,
            "dtype_str": "fp16",
            "num_warps": 4
        },
        "ms": 0.0093,
        "min_ms": 0.0097,
        "max_ms": 0.0091,
        "GB/s": 21.14,
        "TFLOPS": 7.22
    },
    {
        "params": {
            "M": 1024,
            "N": 512,
            "K": 32,
            "block_m": 64,
            "block_n": 128,
            "block_k": 32,
            "dtype_str": "fp16",
            "num_warps": 4
        },
        "ms": 0.0093,
        "min_ms": 0.0095,
        "max_ms": 0.0092,
        "GB/s": 21.14,
        "TFLOPS": 7.22
    },
    {
        "params": {
            "M": 1024,
            "N": 512,
            "K": 32,
            "block_m": 128,
            "block_n": 32,
            "block_k": 32,
            "dtype_str": "fp16",
            "num_warps": 4
        },
        "ms": 0.011,
        "min_ms": 0.0112,
        "max_ms": 0.0109,
        "GB/s": 17.83,
        "TFLOPS": 6.09
    },
    {
        "params": {
            "M": 1024,
            "N": 512,
            "K": 32,
            "block_m": 128,
            "block_n": 64,
            "block_k": 32,
            "dtype_str": "fp16",
            "num_warps": 4
        },
        "ms": 0.0092,
        "min_ms": 0.0094,
        "max_ms": 0.0091,
        "GB/s": 21.32,
        "TFLOPS": 7.28
    },
    {
        "params": {
            "M": 1024,
            "N": 512,
            "K": 32,
            "block_m": 128,
            "block_n": 128,
            "block_k": 32,
            "dtype_str": "fp16",
            "num_warps": 4
        },
        "ms": 0.0092,
        "min_ms": 0.0094,
        "max_ms": 0.0091,
        "GB/s": 21.41,
        "TFLOPS": 7.31
    },
    {
        "params": {
            "M": 1024,
            "N": 1024,
            "K": 32,
            "block_m": 32,
            "block_n": 32,
            "block_k": 32,
            "dtype_str": "fp16",
            "num_warps": 4
        },
        "ms": 0.0172,
        "min_ms": 0.0174,
        "max_ms": 0.0171,
        "GB/s": 15.24,
        "TFLOPS": 7.8
    },
    {
        "params": {
            "M": 1024,
            "N": 1024,
            "K": 32,
            "block_m": 32,
            "block_n": 64,
            "block_k": 32,
            "dtype_str": "fp16",
            "num_warps": 4
        },
        "ms": 0.0135,
        "min_ms": 0.0137,
        "max_ms": 0.0134,
        "GB/s": 19.4,
        "TFLOPS": 9.93
    },
    {
        "params": {
            "M": 1024,
            "N": 1024,
            "K": 32,
            "block_m": 32,
            "block_n": 128,
            "block_k": 32,
            "dtype_str": "fp16",
            "num_warps": 4
        },
        "ms": 0.0132,
        "min_ms": 0.0133,
        "max_ms": 0.0131,
        "GB/s": 19.87,
        "TFLOPS": 10.18
    },
    {
        "params": {
            "M": 1024,
            "N": 1024,
            "K": 32,
            "block_m": 64,
            "block_n": 32,
            "block_k": 32,
            "dtype_str": "fp16",
            "num_warps": 4
        },
        "ms": 0.0173,
        "min_ms": 0.0175,
        "max_ms": 0.0172,
        "GB/s": 15.14,
        "TFLOPS": 7.75
    },
    {
        "params": {
            "M": 1024,
            "N": 1024,
            "K": 32,
            "block_m": 64,
            "block_n": 64,
            "block_k": 32,
            "dtype_str": "fp16",
            "num_warps": 4
        },
        "ms": 0.0136,
        "min_ms": 0.0138,
        "max_ms": 0.0135,
        "GB/s": 19.23,
        "TFLOPS": 9.85
    },
    {
        "params": {
            "M": 1024,
            "N": 1024,
            "K": 32,
            "block_m": 64,
            "block_n": 128,
            "block_k": 32,
            "dtype_str": "fp16",
            "num_warps": 4
        },
        "ms": 0.0133,
        "min_ms": 0.0135,
        "max_ms": 0.0132,
        "GB/s": 19.64,
        "TFLOPS": 10.05
    },
    {
        "params": {
            "M": 1024,
            "N": 1024,
            "K": 32,
            "block_m": 128,
            "block_n": 32,
            "block_k": 32,
            "dtype_str": "fp16",
            "num_warps": 4
        },
        "ms": 0.0172,
        "min_ms": 0.0174,
        "max_ms": 0.0171,
        "GB/s": 15.24,
        "TFLOPS": 7.8
    },
    {
        "params": {
            "M": 1024,
            "N": 1024,
            "K": 32,
            "block_m": 128,
            "block_n": 64,
            "block_k": 32,
            "dtype_str": "fp16",
            "num_warps": 4
        },
        "ms": 0.0135,
        "min_ms": 0.0136,
        "max_ms": 0.0134,
        "GB/s": 19.46,
        "TFLOPS": 9.96
    },
    {
        "params": {
            "M": 1024,
            "N": 1024,
            "K": 32,
            "block_m": 128,
            "block_n": 128,
            "block_k": 32,
            "dtype_str": "fp16",
            "num_warps": 4
        },
        "ms": 0.0132,
        "min_ms": 0.0134,
        "max_ms": 0.0131,
        "GB/s": 19.81,
        "TFLOPS": 10.14
    },
    {
        "params": {
            "M": 1024,
            "N": 2048,
            "K": 32,
            "block_m": 32,
            "block_n": 32,
            "block_k": 32,
            "dtype_str": "fp16",
            "num_warps": 4
        },
        "ms": 0.0297,
        "min_ms": 0.0298,
        "max_ms": 0.0296,
        "GB/s": 13.22,
        "TFLOPS": 9.02
    },
    {
        "params": {
            "M": 1024,
            "N": 2048,
            "K": 32,
            "block_m": 32,
            "block_n": 64,
            "block_k": 32,
            "dtype_str": "fp16",
            "num_warps": 4
        },
        "ms": 0.0223,
        "min_ms": 0.0225,
        "max_ms": 0.0223,
        "GB/s": 17.61,
        "TFLOPS": 12.02
    },
    {
        "params": {
            "M": 1024,
            "N": 2048,
            "K": 32,
            "block_m": 32,
            "block_n": 128,
            "block_k": 32,
            "dtype_str": "fp16",
            "num_warps": 4
        },
        "ms": 0.0213,
        "min_ms": 0.0217,
        "max_ms": 0.0211,
        "GB/s": 18.47,
        "TFLOPS": 12.61
    },
    {
        "params": {
            "M": 1024,
            "N": 2048,
            "K": 32,
            "block_m": 64,
            "block_n": 32,
            "block_k": 32,
            "dtype_str": "fp16",
            "num_warps": 4
        },
        "ms": 0.03,
        "min_ms": 0.0301,
        "max_ms": 0.0299,
        "GB/s": 13.11,
        "TFLOPS": 8.95
    },
    {
        "params": {
            "M": 1024,
            "N": 2048,
            "K": 32,
            "block_m": 64,
            "block_n": 64,
            "block_k": 32,
            "dtype_str": "fp16",
            "num_warps": 4
        },
        "ms": 0.0225,
        "min_ms": 0.0227,
        "max_ms": 0.0224,
        "GB/s": 17.48,
        "TFLOPS": 11.94
    },
    {
        "params": {
            "M": 1024,
            "N": 2048,
            "K": 32,
            "block_m": 64,
            "block_n": 128,
            "block_k": 32,
            "dtype_str": "fp16",
            "num_warps": 4
        },
        "ms": 0.0216,
        "min_ms": 0.0217,
        "max_ms": 0.0215,
        "GB/s": 18.23,
        "TFLOPS": 12.45
    },
    {
        "params": {
            "M": 1024,
            "N": 2048,
            "K": 32,
            "block_m": 128,
            "block_n": 32,
            "block_k": 32,
            "dtype_str": "fp16",
            "num_warps": 4
        },
        "ms": 0.0296,
        "min_ms": 0.0298,
        "max_ms": 0.0295,
        "GB/s": 13.27,
        "TFLOPS": 9.06
    },
    {
        "params": {
            "M": 1024,
            "N": 2048,
            "K": 32,
            "block_m": 128,
            "block_n": 64,
            "block_k": 32,
            "dtype_str": "fp16",
            "num_warps": 4
        },
        "ms": 0.0221,
        "min_ms": 0.0223,
        "max_ms": 0.0219,
        "GB/s": 17.83,
        "TFLOPS": 12.17
    },
    {
        "params": {
            "M": 1024,
            "N": 2048,
            "K": 32,
            "block_m": 128,
            "block_n": 128,
            "block_k": 32,
            "dtype_str": "fp16",
            "num_warps": 4
        },
        "ms": 0.0214,
        "min_ms": 0.0216,
        "max_ms": 0.0213,
        "GB/s": 18.37,
        "TFLOPS": 12.54
    },
    {
        "params": {
            "M": 1024,
            "N": 4096,
            "K": 32,
            "block_m": 32,
            "block_n": 32,
            "block_k": 32,
            "dtype_str": "fp16",
            "num_warps": 4
        },
        "ms": 0.0549,
        "min_ms": 0.055,
        "max_ms": 0.0548,
        "GB/s": 11.94,
        "TFLOPS": 9.78
    },
    {
        "params": {
            "M": 1024,
            "N": 4096,
            "K": 32,
            "block_m": 32,
            "block_n": 64,
            "block_k": 32,
            "dtype_str": "fp16",
            "num_warps": 4
        },
        "ms": 0.0399,
        "min_ms": 0.04,
        "max_ms": 0.0398,
        "GB/s": 16.43,
        "TFLOPS": 13.46
    },
    {
        "params": {
            "M": 1024,
            "N": 4096,
            "K": 32,
            "block_m": 32,
            "block_n": 128,
            "block_k": 32,
            "dtype_str": "fp16",
            "num_warps": 4
        },
        "ms": 0.0372,
        "min_ms": 0.0374,
        "max_ms": 0.0371,
        "GB/s": 17.6,
        "TFLOPS": 14.41
    },
    {
        "params": {
            "M": 1024,
            "N": 4096,
            "K": 32,
            "block_m": 64,
            "block_n": 32,
            "block_k": 32,
            "dtype_str": "fp16",
            "num_warps": 4
        },
        "ms": 0.0553,
        "min_ms": 0.0554,
        "max_ms": 0.0551,
        "GB/s": 11.85,
        "TFLOPS": 9.71
    },
    {
        "params": {
            "M": 1024,
            "N": 4096,
            "K": 32,
            "block_m": 64,
            "block_n": 64,
            "block_k": 32,
            "dtype_str": "fp16",
            "num_warps": 4
        },
        "ms": 0.04,
        "min_ms": 0.0401,
        "max_ms": 0.0399,
        "GB/s": 16.38,
        "TFLOPS": 13.42
    },
    {
        "params": {
            "M": 1024,
            "N": 4096,
            "K": 32,
            "block_m": 64,
            "block_n": 128,
            "block_k": 32,
            "dtype_str": "fp16",
            "num_warps": 4
        },
        "ms": 0.0379,
        "min_ms": 0.038,
        "max_ms": 0.0378,
        "GB/s": 17.28,
        "TFLOPS": 14.16
    },
    {
        "params": {
            "M": 1024,
            "N": 4096,
            "K": 32,
            "block_m": 128,
            "block_n": 32,
            "block_k": 32,
            "dtype_str": "fp16",
            "num_warps": 4
        },
        "ms": 0.0546,
        "min_ms": 0.0548,
        "max_ms": 0.0545,
        "GB/s": 12.0,
        "TFLOPS": 9.83
    },
    {
        "params": {
            "M": 1024,
            "N": 4096,
            "K": 32,
            "block_m": 128,
            "block_n": 64,
            "block_k": 32,
            "dtype_str": "fp16",
            "num_warps": 4
        },
        "ms": 0.0391,
        "min_ms": 0.0392,
        "max_ms": 0.039,
        "GB/s": 16.77,
        "TFLOPS": 13.73
    },
    {
        "params": {
            "M": 1024,
            "N": 4096,
            "K": 32,
            "block_m": 128,
            "block_n": 128,
            "block_k": 32,
            "dtype_str": "fp16",
            "num_warps": 4
        },
        "ms": 0.0377,
        "min_ms": 0.0378,
        "max_ms": 0.0376,
        "GB/s": 17.39,
        "TFLOPS": 14.25
    },
    {
        "params": {
            "M": 2048,
            "N": 128,
            "K": 32,
            "block_m": 32,
            "block_n": 32,
            "block_k": 32,
            "dtype_str": "fp16",
            "num_warps": 4
        },
        "ms": 0.0064,
        "min_ms": 0.0065,
        "max_ms": 0.0063,
        "GB/s": 43.7,
        "TFLOPS": 5.26
    },
    {
        "params": {
            "M": 2048,
            "N": 128,
            "K": 32,
            "block_m": 32,
            "block_n": 64,
            "block_k": 32,
            "dtype_str": "fp16",
            "num_warps": 4
        },
        "ms": 0.0061,
        "min_ms": 0.0062,
        "max_ms": 0.0061,
        "GB/s": 45.41,
        "TFLOPS": 5.47
    },
    {
        "params": {
            "M": 2048,
            "N": 128,
            "K": 32,
            "block_m": 32,
            "block_n": 128,
            "block_k": 32,
            "dtype_str": "fp16",
            "num_warps": 4
        },
        "ms": 0.0062,
        "min_ms": 0.0063,
        "max_ms": 0.0061,
        "GB/s": 45.11,
        "TFLOPS": 5.43
    },
    {
        "params": {
            "M": 2048,
            "N": 128,
            "K": 32,
            "block_m": 64,
            "block_n": 32,
            "block_k": 32,
            "dtype_str": "fp16",
            "num_warps": 4
        },
        "ms": 0.0065,
        "min_ms": 0.0067,
        "max_ms": 0.0064,
        "GB/s": 42.88,
        "TFLOPS": 5.17
    },
    {
        "params": {
            "M": 2048,
            "N": 128,
            "K": 32,
            "block_m": 64,
            "block_n": 64,
            "block_k": 32,
            "dtype_str": "fp16",
            "num_warps": 4
        },
        "ms": 0.0061,
        "min_ms": 0.0062,
        "max_ms": 0.0061,
        "GB/s": 45.71,
        "TFLOPS": 5.51
    },
    {
        "params": {
            "M": 2048,
            "N": 128,
            "K": 32,
            "block_m": 64,
            "block_n": 128,
            "block_k": 32,
            "dtype_str": "fp16",
            "num_warps": 4
        },
        "ms": 0.0062,
        "min_ms": 0.0064,
        "max_ms": 0.0061,
        "GB/s": 45.11,
        "TFLOPS": 5.43
    },
    {
        "params": {
            "M": 2048,
            "N": 128,
            "K": 32,
            "block_m": 128,
            "block_n": 32,
            "block_k": 32,
            "dtype_str": "fp16",
            "num_warps": 4
        },
        "ms": 0.0065,
        "min_ms": 0.0067,
        "max_ms": 0.0064,
        "GB/s": 42.88,
        "TFLOPS": 5.17
    },
    {
        "params": {
            "M": 2048,
            "N": 128,
            "K": 32,
            "block_m": 128,
            "block_n": 64,
            "block_k": 32,
            "dtype_str": "fp16",
            "num_warps": 4
        },
        "ms": 0.0061,
        "min_ms": 0.0063,
        "max_ms": 0.0061,
        "GB/s": 45.41,
        "TFLOPS": 5.47
    },
    {
        "params": {
            "M": 2048,
            "N": 128,
            "K": 32,
            "block_m": 128,
            "block_n": 128,
            "block_k": 32,
            "dtype_str": "fp16",
            "num_warps": 4
        },
        "ms": 0.0061,
        "min_ms": 0.0063,
        "max_ms": 0.0061,
        "GB/s": 45.41,
        "TFLOPS": 5.47
    },
    {
        "params": {
            "M": 2048,
            "N": 256,
            "K": 32,
            "block_m": 32,
            "block_n": 32,
            "block_k": 32,
            "dtype_str": "fp16",
            "num_warps": 4
        },
        "ms": 0.0079,
        "min_ms": 0.0081,
        "max_ms": 0.0078,
        "GB/s": 37.15,
        "TFLOPS": 8.45
    },
    {
        "params": {
            "M": 2048,
            "N": 256,
            "K": 32,
            "block_m": 32,
            "block_n": 64,
            "block_k": 32,
            "dtype_str": "fp16",
            "num_warps": 4
        },
        "ms": 0.0071,
        "min_ms": 0.0072,
        "max_ms": 0.0069,
        "GB/s": 41.8,
        "TFLOPS": 9.51
    },
    {
        "params": {
            "M": 2048,
            "N": 256,
            "K": 32,
            "block_m": 32,
            "block_n": 128,
            "block_k": 32,
            "dtype_str": "fp16",
            "num_warps": 4
        },
        "ms": 0.0073,
        "min_ms": 0.0074,
        "max_ms": 0.0071,
        "GB/s": 40.64,
        "TFLOPS": 9.25
    },
    {
        "params": {
            "M": 2048,
            "N": 256,
            "K": 32,
            "block_m": 64,
            "block_n": 32,
            "block_k": 32,
            "dtype_str": "fp16",
            "num_warps": 4
        },
        "ms": 0.0081,
        "min_ms": 0.0082,
        "max_ms": 0.008,
        "GB/s": 36.6,
        "TFLOPS": 8.33
    },
    {
        "params": {
            "M": 2048,
            "N": 256,
            "K": 32,
            "block_m": 64,
            "block_n": 64,
            "block_k": 32,
            "dtype_str": "fp16",
            "num_warps": 4
        },
        "ms": 0.0071,
        "min_ms": 0.0073,
        "max_ms": 0.007,
        "GB/s": 41.33,
        "TFLOPS": 9.4
    },
    {
        "params": {
            "M": 2048,
            "N": 256,
            "K": 32,
            "block_m": 64,
            "block_n": 128,
            "block_k": 32,
            "dtype_str": "fp16",
            "num_warps": 4
        },
        "ms": 0.0073,
        "min_ms": 0.0075,
        "max_ms": 0.0072,
        "GB/s": 40.2,
        "TFLOPS": 9.15
    },
    {
        "params": {
            "M": 2048,
            "N": 256,
            "K": 32,
            "block_m": 128,
            "block_n": 32,
            "block_k": 32,
            "dtype_str": "fp16",
            "num_warps": 4
        },
        "ms": 0.008,
        "min_ms": 0.0082,
        "max_ms": 0.0079,
        "GB/s": 36.78,
        "TFLOPS": 8.37
    },
    {
        "params": {
            "M": 2048,
            "N": 256,
            "K": 32,
            "block_m": 128,
            "block_n": 64,
            "block_k": 32,
            "dtype_str": "fp16",
            "num_warps": 4
        },
        "ms": 0.0072,
        "min_ms": 0.0073,
        "max_ms": 0.0071,
        "GB/s": 41.1,
        "TFLOPS": 9.35
    },
    {
        "params": {
            "M": 2048,
            "N": 256,
            "K": 32,
            "block_m": 128,
            "block_n": 128,
            "block_k": 32,
            "dtype_str": "fp16",
            "num_warps": 4
        },
        "ms": 0.0072,
        "min_ms": 0.0074,
        "max_ms": 0.0071,
        "GB/s": 40.87,
        "TFLOPS": 9.3
    },
    {
        "params": {
            "M": 2048,
            "N": 512,
            "K": 32,
            "block_m": 32,
            "block_n": 32,
            "block_k": 32,
            "dtype_str": "fp16",
            "num_warps": 4
        },
        "ms": 0.011,
        "min_ms": 0.0112,
        "max_ms": 0.0109,
        "GB/s": 29.72,
        "TFLOPS": 12.17
    },
    {
        "params": {
            "M": 2048,
            "N": 512,
            "K": 32,
            "block_m": 32,
            "block_n": 64,
            "block_k": 32,
            "dtype_str": "fp16",
            "num_warps": 4
        },
        "ms": 0.0093,
        "min_ms": 0.0095,
        "max_ms": 0.0091,
        "GB/s": 35.38,
        "TFLOPS": 14.49
    },
    {
        "params": {
            "M": 2048,
            "N": 512,
            "K": 32,
            "block_m": 32,
            "block_n": 128,
            "block_k": 32,
            "dtype_str": "fp16",
            "num_warps": 4
        },
        "ms": 0.0093,
        "min_ms": 0.0095,
        "max_ms": 0.0092,
        "GB/s": 35.23,
        "TFLOPS": 14.43
    },
    {
        "params": {
            "M": 2048,
            "N": 512,
            "K": 32,
            "block_m": 64,
            "block_n": 32,
            "block_k": 32,
            "dtype_str": "fp16",
            "num_warps": 4
        },
        "ms": 0.0111,
        "min_ms": 0.0113,
        "max_ms": 0.0111,
        "GB/s": 29.4,
        "TFLOPS": 12.04
    },
    {
        "params": {
            "M": 2048,
            "N": 512,
            "K": 32,
            "block_m": 64,
            "block_n": 64,
            "block_k": 32,
            "dtype_str": "fp16",
            "num_warps": 4
        },
        "ms": 0.0093,
        "min_ms": 0.0095,
        "max_ms": 0.0092,
        "GB/s": 35.08,
        "TFLOPS": 14.37
    },
    {
        "params": {
            "M": 2048,
            "N": 512,
            "K": 32,
            "block_m": 64,
            "block_n": 128,
            "block_k": 32,
            "dtype_str": "fp16",
            "num_warps": 4
        },
        "ms": 0.0094,
        "min_ms": 0.0096,
        "max_ms": 0.0093,
        "GB/s": 34.93,
        "TFLOPS": 14.31
    },
    {
        "params": {
            "M": 2048,
            "N": 512,
            "K": 32,
            "block_m": 128,
            "block_n": 32,
            "block_k": 32,
            "dtype_str": "fp16",
            "num_warps": 4
        },
        "ms": 0.0111,
        "min_ms": 0.0112,
        "max_ms": 0.011,
        "GB/s": 29.61,
        "TFLOPS": 12.13
    },
    {
        "params": {
            "M": 2048,
            "N": 512,
            "K": 32,
            "block_m": 128,
            "block_n": 64,
            "block_k": 32,
            "dtype_str": "fp16",
            "num_warps": 4
        },
        "ms": 0.0093,
        "min_ms": 0.0095,
        "max_ms": 0.0092,
        "GB/s": 35.23,
        "TFLOPS": 14.43
    },
    {
        "params": {
            "M": 2048,
            "N": 512,
            "K": 32,
            "block_m": 128,
            "block_n": 128,
            "block_k": 32,
            "dtype_str": "fp16",
            "num_warps": 4
        },
        "ms": 0.0093,
        "min_ms": 0.0094,
        "max_ms": 0.0091,
        "GB/s": 35.38,
        "TFLOPS": 14.49
    },
    {
        "params": {
            "M": 2048,
            "N": 1024,
            "K": 32,
            "block_m": 32,
            "block_n": 32,
            "block_k": 32,
            "dtype_str": "fp16",
            "num_warps": 4
        },
        "ms": 0.0173,
        "min_ms": 0.0174,
        "max_ms": 0.0172,
        "GB/s": 22.76,
        "TFLOPS": 15.53
    },
    {
        "params": {
            "M": 2048,
            "N": 1024,
            "K": 32,
            "block_m": 32,
            "block_n": 64,
            "block_k": 32,
            "dtype_str": "fp16",
            "num_warps": 4
        },
        "ms": 0.0137,
        "min_ms": 0.014,
        "max_ms": 0.0136,
        "GB/s": 28.68,
        "TFLOPS": 19.58
    },
    {
        "params": {
            "M": 2048,
            "N": 1024,
            "K": 32,
            "block_m": 32,
            "block_n": 128,
            "block_k": 32,
            "dtype_str": "fp16",
            "num_warps": 4
        },
        "ms": 0.0134,
        "min_ms": 0.0136,
        "max_ms": 0.0133,
        "GB/s": 29.45,
        "TFLOPS": 20.11
    },
    {
        "params": {
            "M": 2048,
            "N": 1024,
            "K": 32,
            "block_m": 64,
            "block_n": 32,
            "block_k": 32,
            "dtype_str": "fp16",
            "num_warps": 4
        },
        "ms": 0.0174,
        "min_ms": 0.0175,
        "max_ms": 0.0173,
        "GB/s": 22.6,
        "TFLOPS": 15.43
    },
    {
        "params": {
            "M": 2048,
            "N": 1024,
            "K": 32,
            "block_m": 64,
            "block_n": 64,
            "block_k": 32,
            "dtype_str": "fp16",
            "num_warps": 4
        },
        "ms": 0.0138,
        "min_ms": 0.014,
        "max_ms": 0.0136,
        "GB/s": 28.6,
        "TFLOPS": 19.52
    },
    {
        "params": {
            "M": 2048,
            "N": 1024,
            "K": 32,
            "block_m": 64,
            "block_n": 128,
            "block_k": 32,
            "dtype_str": "fp16",
            "num_warps": 4
        },
        "ms": 0.0135,
        "min_ms": 0.0136,
        "max_ms": 0.0134,
        "GB/s": 29.19,
        "TFLOPS": 19.93
    },
    {
        "params": {
            "M": 2048,
            "N": 1024,
            "K": 32,
            "block_m": 128,
            "block_n": 32,
            "block_k": 32,
            "dtype_str": "fp16",
            "num_warps": 4
        },
        "ms": 0.0172,
        "min_ms": 0.0174,
        "max_ms": 0.0172,
        "GB/s": 22.81,
        "TFLOPS": 15.57
    },
    {
        "params": {
            "M": 2048,
            "N": 1024,
            "K": 32,
            "block_m": 128,
            "block_n": 64,
            "block_k": 32,
            "dtype_str": "fp16",
            "num_warps": 4
        },
        "ms": 0.0136,
        "min_ms": 0.0137,
        "max_ms": 0.0135,
        "GB/s": 29.02,
        "TFLOPS": 19.81
    },
    {
        "params": {
            "M": 2048,
            "N": 1024,
            "K": 32,
            "block_m": 128,
            "block_n": 128,
            "block_k": 32,
            "dtype_str": "fp16",
            "num_warps": 4
        },
        "ms": 0.0133,
        "min_ms": 0.0135,
        "max_ms": 0.0132,
        "GB/s": 29.54,
        "TFLOPS": 20.17
    },
    {
        "params": {
            "M": 2048,
            "N": 2048,
            "K": 32,
            "block_m": 32,
            "block_n": 32,
            "block_k": 32,
            "dtype_str": "fp16",
            "num_warps": 4
        },
        "ms": 0.0299,
        "min_ms": 0.03,
        "max_ms": 0.0298,
        "GB/s": 17.55,
        "TFLOPS": 17.97
    },
    {
        "params": {
            "M": 2048,
            "N": 2048,
            "K": 32,
            "block_m": 32,
            "block_n": 64,
            "block_k": 32,
            "dtype_str": "fp16",
            "num_warps": 4
        },
        "ms": 0.0225,
        "min_ms": 0.0227,
        "max_ms": 0.0224,
        "GB/s": 23.27,
        "TFLOPS": 23.83
    },
    {
        "params": {
            "M": 2048,
            "N": 2048,
            "K": 32,
            "block_m": 32,
            "block_n": 128,
            "block_k": 32,
            "dtype_str": "fp16",
            "num_warps": 4
        },
        "ms": 0.0214,
        "min_ms": 0.0217,
        "max_ms": 0.0213,
        "GB/s": 24.44,
        "TFLOPS": 25.03
    },
    {
        "params": {
            "M": 2048,
            "N": 2048,
            "K": 32,
            "block_m": 64,
            "block_n": 32,
            "block_k": 32,
            "dtype_str": "fp16",
            "num_warps": 4
        },
        "ms": 0.0299,
        "min_ms": 0.0301,
        "max_ms": 0.0298,
        "GB/s": 17.51,
        "TFLOPS": 17.93
    },
    {
        "params": {
            "M": 2048,
            "N": 2048,
            "K": 32,
            "block_m": 64,
            "block_n": 64,
            "block_k": 32,
            "dtype_str": "fp16",
            "num_warps": 4
        },
        "ms": 0.0225,
        "min_ms": 0.0227,
        "max_ms": 0.0224,
        "GB/s": 23.27,
        "TFLOPS": 23.83
    },
    {
        "params": {
            "M": 2048,
            "N": 2048,
            "K": 32,
            "block_m": 64,
            "block_n": 128,
            "block_k": 32,
            "dtype_str": "fp16",
            "num_warps": 4
        },
        "ms": 0.0217,
        "min_ms": 0.0219,
        "max_ms": 0.0216,
        "GB/s": 24.17,
        "TFLOPS": 24.75
    },
    {
        "params": {
            "M": 2048,
            "N": 2048,
            "K": 32,
            "block_m": 128,
            "block_n": 32,
            "block_k": 32,
            "dtype_str": "fp16",
            "num_warps": 4
        },
        "ms": 0.0297,
        "min_ms": 0.0298,
        "max_ms": 0.0295,
        "GB/s": 17.67,
        "TFLOPS": 18.1
    },
    {
        "params": {
            "M": 2048,
            "N": 2048,
            "K": 32,
            "block_m": 128,
            "block_n": 64,
            "block_k": 32,
            "dtype_str": "fp16",
            "num_warps": 4
        },
        "ms": 0.0221,
        "min_ms": 0.0223,
        "max_ms": 0.022,
        "GB/s": 23.69,
        "TFLOPS": 24.26
    },
    {
        "params": {
            "M": 2048,
            "N": 2048,
            "K": 32,
            "block_m": 128,
            "block_n": 128,
            "block_k": 32,
            "dtype_str": "fp16",
            "num_warps": 4
        },
        "ms": 0.0215,
        "min_ms": 0.0219,
        "max_ms": 0.0214,
        "GB/s": 24.4,
        "TFLOPS": 24.98
    },
    {
        "params": {
            "M": 2048,
            "N": 4096,
            "K": 32,
            "block_m": 32,
            "block_n": 32,
            "block_k": 32,
            "dtype_str": "fp16",
            "num_warps": 4
        },
        "ms": 0.0551,
        "min_ms": 0.0553,
        "max_ms": 0.055,
        "GB/s": 14.27,
        "TFLOPS": 19.48
    },
    {
        "params": {
            "M": 2048,
            "N": 4096,
            "K": 32,
            "block_m": 32,
            "block_n": 64,
            "block_k": 32,
            "dtype_str": "fp16",
            "num_warps": 4
        },
        "ms": 0.0402,
        "min_ms": 0.0403,
        "max_ms": 0.0401,
        "GB/s": 19.56,
        "TFLOPS": 26.7
    },
    {
        "params": {
            "M": 2048,
            "N": 4096,
            "K": 32,
            "block_m": 32,
            "block_n": 128,
            "block_k": 32,
            "dtype_str": "fp16",
            "num_warps": 4
        },
        "ms": 0.0376,
        "min_ms": 0.0377,
        "max_ms": 0.0375,
        "GB/s": 20.93,
        "TFLOPS": 28.58
    },
    {
        "params": {
            "M": 2048,
            "N": 4096,
            "K": 32,
            "block_m": 64,
            "block_n": 32,
            "block_k": 32,
            "dtype_str": "fp16",
            "num_warps": 4
        },
        "ms": 0.0551,
        "min_ms": 0.0552,
        "max_ms": 0.055,
        "GB/s": 14.27,
        "TFLOPS": 19.48
    },
    {
        "params": {
            "M": 2048,
            "N": 4096,
            "K": 32,
            "block_m": 64,
            "block_n": 64,
            "block_k": 32,
            "dtype_str": "fp16",
            "num_warps": 4
        },
        "ms": 0.0401,
        "min_ms": 0.0402,
        "max_ms": 0.04,
        "GB/s": 19.62,
        "TFLOPS": 26.78
    },
    {
        "params": {
            "M": 2048,
            "N": 4096,
            "K": 32,
            "block_m": 64,
            "block_n": 128,
            "block_k": 32,
            "dtype_str": "fp16",
            "num_warps": 4
        },
        "ms": 0.038,
        "min_ms": 0.0381,
        "max_ms": 0.0379,
        "GB/s": 20.69,
        "TFLOPS": 28.25
    },
    {
        "params": {
            "M": 2048,
            "N": 4096,
            "K": 32,
            "block_m": 128,
            "block_n": 32,
            "block_k": 32,
            "dtype_str": "fp16",
            "num_warps": 4
        },
        "ms": 0.0544,
        "min_ms": 0.0546,
        "max_ms": 0.0543,
        "GB/s": 14.46,
        "TFLOPS": 19.74
    },
    {
        "params": {
            "M": 2048,
            "N": 4096,
            "K": 32,
            "block_m": 128,
            "block_n": 64,
            "block_k": 32,
            "dtype_str": "fp16",
            "num_warps": 4
        },
        "ms": 0.0392,
        "min_ms": 0.0394,
        "max_ms": 0.0391,
        "GB/s": 20.06,
        "TFLOPS": 27.39
    },
    {
        "params": {
            "M": 2048,
            "N": 4096,
            "K": 32,
            "block_m": 128,
            "block_n": 128,
            "block_k": 32,
            "dtype_str": "fp16",
            "num_warps": 4
        },
        "ms": 0.0378,
        "min_ms": 0.0379,
        "max_ms": 0.0377,
        "GB/s": 20.8,
        "TFLOPS": 28.4
    },
    {
        "params": {
            "M": 4096,
            "N": 128,
            "K": 32,
            "block_m": 32,
            "block_n": 32,
            "block_k": 32,
            "dtype_str": "fp16",
            "num_warps": 4
        },
        "ms": 0.0065,
        "min_ms": 0.0067,
        "max_ms": 0.0064,
        "GB/s": 83.24,
        "TFLOPS": 10.33
    },
    {
        "params": {
            "M": 4096,
            "N": 128,
            "K": 32,
            "block_m": 32,
            "block_n": 64,
            "block_k": 32,
            "dtype_str": "fp16",
            "num_warps": 4
        },
        "ms": 0.0062,
        "min_ms": 0.0063,
        "max_ms": 0.0062,
        "GB/s": 87.01,
        "TFLOPS": 10.8
    },
    {
        "params": {
            "M": 4096,
            "N": 128,
            "K": 32,
            "block_m": 32,
            "block_n": 128,
            "block_k": 32,
            "dtype_str": "fp16",
            "num_warps": 4
        },
        "ms": 0.0063,
        "min_ms": 0.0065,
        "max_ms": 0.0062,
        "GB/s": 85.89,
        "TFLOPS": 10.66
    },
    {
        "params": {
            "M": 4096,
            "N": 128,
            "K": 32,
            "block_m": 64,
            "block_n": 32,
            "block_k": 32,
            "dtype_str": "fp16",
            "num_warps": 4
        },
        "ms": 0.0066,
        "min_ms": 0.0068,
        "max_ms": 0.0065,
        "GB/s": 81.73,
        "TFLOPS": 10.14
    },
    {
        "params": {
            "M": 4096,
            "N": 128,
            "K": 32,
            "block_m": 64,
            "block_n": 64,
            "block_k": 32,
            "dtype_str": "fp16",
            "num_warps": 4
        },
        "ms": 0.0062,
        "min_ms": 0.0063,
        "max_ms": 0.0061,
        "GB/s": 87.57,
        "TFLOPS": 10.87
    },
    {
        "params": {
            "M": 4096,
            "N": 128,
            "K": 32,
            "block_m": 64,
            "block_n": 128,
            "block_k": 32,
            "dtype_str": "fp16",
            "num_warps": 4
        },
        "ms": 0.0063,
        "min_ms": 0.0065,
        "max_ms": 0.0062,
        "GB/s": 85.9,
        "TFLOPS": 10.66
    },
    {
        "params": {
            "M": 4096,
            "N": 128,
            "K": 32,
            "block_m": 128,
            "block_n": 32,
            "block_k": 32,
            "dtype_str": "fp16",
            "num_warps": 4
        },
        "ms": 0.0066,
        "min_ms": 0.0068,
        "max_ms": 0.0065,
        "GB/s": 81.73,
        "TFLOPS": 10.14
    },
    {
        "params": {
            "M": 4096,
            "N": 128,
            "K": 32,
            "block_m": 128,
            "block_n": 64,
            "block_k": 32,
            "dtype_str": "fp16",
            "num_warps": 4
        },
        "ms": 0.0062,
        "min_ms": 0.0064,
        "max_ms": 0.0061,
        "GB/s": 87.01,
        "TFLOPS": 10.8
    },
    {
        "params": {
            "M": 4096,
            "N": 128,
            "K": 32,
            "block_m": 128,
            "block_n": 128,
            "block_k": 32,
            "dtype_str": "fp16",
            "num_warps": 4
        },
        "ms": 0.0063,
        "min_ms": 0.0065,
        "max_ms": 0.0062,
        "GB/s": 86.45,
        "TFLOPS": 10.73
    },
    {
        "params": {
            "M": 4096,
            "N": 256,
            "K": 32,
            "block_m": 32,
            "block_n": 32,
            "block_k": 32,
            "dtype_str": "fp16",
            "num_warps": 4
        },
        "ms": 0.0081,
        "min_ms": 0.0082,
        "max_ms": 0.008,
        "GB/s": 68.79,
        "TFLOPS": 16.57
    },
    {
        "params": {
            "M": 4096,
            "N": 256,
            "K": 32,
            "block_m": 32,
            "block_n": 64,
            "block_k": 32,
            "dtype_str": "fp16",
            "num_warps": 4
        },
        "ms": 0.0072,
        "min_ms": 0.0074,
        "max_ms": 0.0071,
        "GB/s": 77.2,
        "TFLOPS": 18.6
    },
    {
        "params": {
            "M": 4096,
            "N": 256,
            "K": 32,
            "block_m": 32,
            "block_n": 128,
            "block_k": 32,
            "dtype_str": "fp16",
            "num_warps": 4
        },
        "ms": 0.0074,
        "min_ms": 0.0076,
        "max_ms": 0.0073,
        "GB/s": 75.11,
        "TFLOPS": 18.1
    },
    {
        "params": {
            "M": 4096,
            "N": 256,
            "K": 32,
            "block_m": 64,
            "block_n": 32,
            "block_k": 32,
            "dtype_str": "fp16",
            "num_warps": 4
        },
        "ms": 0.0082,
        "min_ms": 0.0084,
        "max_ms": 0.0081,
        "GB/s": 68.12,
        "TFLOPS": 16.41
    },
    {
        "params": {
            "M": 4096,
            "N": 256,
            "K": 32,
            "block_m": 64,
            "block_n": 64,
            "block_k": 32,
            "dtype_str": "fp16",
            "num_warps": 4
        },
        "ms": 0.0073,
        "min_ms": 0.0075,
        "max_ms": 0.0071,
        "GB/s": 76.76,
        "TFLOPS": 18.49
    },
    {
        "params": {
            "M": 4096,
            "N": 256,
            "K": 32,
            "block_m": 64,
            "block_n": 128,
            "block_k": 32,
            "dtype_str": "fp16",
            "num_warps": 4
        },
        "ms": 0.0075,
        "min_ms": 0.0076,
        "max_ms": 0.0073,
        "GB/s": 74.7,
        "TFLOPS": 18.0
    },
    {
        "params": {
            "M": 4096,
            "N": 256,
            "K": 32,
            "block_m": 128,
            "block_n": 32,
            "block_k": 32,
            "dtype_str": "fp16",
            "num_warps": 4
        },
        "ms": 0.0081,
        "min_ms": 0.0083,
        "max_ms": 0.008,
        "GB/s": 68.78,
        "TFLOPS": 16.57
    },
    {
        "params": {
            "M": 4096,
            "N": 256,
            "K": 32,
            "block_m": 128,
            "block_n": 64,
            "block_k": 32,
            "dtype_str": "fp16",
            "num_warps": 4
        },
        "ms": 0.0072,
        "min_ms": 0.0074,
        "max_ms": 0.0071,
        "GB/s": 77.19,
        "TFLOPS": 18.6
    },
    {
        "params": {
            "M": 4096,
            "N": 256,
            "K": 32,
            "block_m": 128,
            "block_n": 128,
            "block_k": 32,
            "dtype_str": "fp16",
            "num_warps": 4
        },
        "ms": 0.0073,
        "min_ms": 0.0075,
        "max_ms": 0.0072,
        "GB/s": 76.34,
        "TFLOPS": 18.39
    },
    {
        "params": {
            "M": 4096,
            "N": 512,
            "K": 32,
            "block_m": 32,
            "block_n": 32,
            "block_k": 32,
            "dtype_str": "fp16",
            "num_warps": 4
        },
        "ms": 0.0113,
        "min_ms": 0.0115,
        "max_ms": 0.0112,
        "GB/s": 52.17,
        "TFLOPS": 23.74
    },
    {
        "params": {
            "M": 4096,
            "N": 512,
            "K": 32,
            "block_m": 32,
            "block_n": 64,
            "block_k": 32,
            "dtype_str": "fp16",
            "num_warps": 4
        },
        "ms": 0.0095,
        "min_ms": 0.0097,
        "max_ms": 0.0094,
        "GB/s": 61.82,
        "TFLOPS": 28.13
    },
    {
        "params": {
            "M": 4096,
            "N": 512,
            "K": 32,
            "block_m": 32,
            "block_n": 128,
            "block_k": 32,
            "dtype_str": "fp16",
            "num_warps": 4
        },
        "ms": 0.0096,
        "min_ms": 0.0099,
        "max_ms": 0.0095,
        "GB/s": 61.56,
        "TFLOPS": 28.01
    },
    {
        "params": {
            "M": 4096,
            "N": 512,
            "K": 32,
            "block_m": 64,
            "block_n": 32,
            "block_k": 32,
            "dtype_str": "fp16",
            "num_warps": 4
        },
        "ms": 0.0113,
        "min_ms": 0.0114,
        "max_ms": 0.0111,
        "GB/s": 52.36,
        "TFLOPS": 23.83
    },
    {
        "params": {
            "M": 4096,
            "N": 512,
            "K": 32,
            "block_m": 64,
            "block_n": 64,
            "block_k": 32,
            "dtype_str": "fp16",
            "num_warps": 4
        },
        "ms": 0.0095,
        "min_ms": 0.0097,
        "max_ms": 0.0094,
        "GB/s": 62.08,
        "TFLOPS": 28.25
    },
    {
        "params": {
            "M": 4096,
            "N": 512,
            "K": 32,
            "block_m": 64,
            "block_n": 128,
            "block_k": 32,
            "dtype_str": "fp16",
            "num_warps": 4
        },
        "ms": 0.0095,
        "min_ms": 0.0097,
        "max_ms": 0.0094,
        "GB/s": 61.81,
        "TFLOPS": 28.13
    },
    {
        "params": {
            "M": 4096,
            "N": 512,
            "K": 32,
            "block_m": 128,
            "block_n": 32,
            "block_k": 32,
            "dtype_str": "fp16",
            "num_warps": 4
        },
        "ms": 0.0111,
        "min_ms": 0.0113,
        "max_ms": 0.011,
        "GB/s": 52.92,
        "TFLOPS": 24.09
    },
    {
        "params": {
            "M": 4096,
            "N": 512,
            "K": 32,
            "block_m": 128,
            "block_n": 64,
            "block_k": 32,
            "dtype_str": "fp16",
            "num_warps": 4
        },
        "ms": 0.0094,
        "min_ms": 0.0096,
        "max_ms": 0.0093,
        "GB/s": 62.87,
        "TFLOPS": 28.61
    },
    {
        "params": {
            "M": 4096,
            "N": 512,
            "K": 32,
            "block_m": 128,
            "block_n": 128,
            "block_k": 32,
            "dtype_str": "fp16",
            "num_warps": 4
        },
        "ms": 0.0094,
        "min_ms": 0.0096,
        "max_ms": 0.0093,
        "GB/s": 62.87,
        "TFLOPS": 28.61
    },
    {
        "params": {
            "M": 4096,
            "N": 1024,
            "K": 32,
            "block_m": 32,
            "block_n": 32,
            "block_k": 32,
            "dtype_str": "fp16",
            "num_warps": 4
        },
        "ms": 0.0176,
        "min_ms": 0.0178,
        "max_ms": 0.0175,
        "GB/s": 37.24,
        "TFLOPS": 30.5
    },
    {
        "params": {
            "M": 4096,
            "N": 1024,
            "K": 32,
            "block_m": 32,
            "block_n": 64,
            "block_k": 32,
            "dtype_str": "fp16",
            "num_warps": 4
        },
        "ms": 0.0142,
        "min_ms": 0.0144,
        "max_ms": 0.014,
        "GB/s": 46.31,
        "TFLOPS": 37.94
    },
    {
        "params": {
            "M": 4096,
            "N": 1024,
            "K": 32,
            "block_m": 32,
            "block_n": 128,
            "block_k": 32,
            "dtype_str": "fp16",
            "num_warps": 4
        },
        "ms": 0.0138,
        "min_ms": 0.0142,
        "max_ms": 0.0137,
        "GB/s": 47.38,
        "TFLOPS": 38.81
    },
    {
        "params": {
            "M": 4096,
            "N": 1024,
            "K": 32,
            "block_m": 64,
            "block_n": 32,
            "block_k": 32,
            "dtype_str": "fp16",
            "num_warps": 4
        },
        "ms": 0.0175,
        "min_ms": 0.0176,
        "max_ms": 0.0174,
        "GB/s": 37.49,
        "TFLOPS": 30.71
    },
    {
        "params": {
            "M": 4096,
            "N": 1024,
            "K": 32,
            "block_m": 64,
            "block_n": 64,
            "block_k": 32,
            "dtype_str": "fp16",
            "num_warps": 4
        },
        "ms": 0.0139,
        "min_ms": 0.0142,
        "max_ms": 0.0138,
        "GB/s": 47.11,
        "TFLOPS": 38.59
    },
    {
        "params": {
            "M": 4096,
            "N": 1024,
            "K": 32,
            "block_m": 64,
            "block_n": 128,
            "block_k": 32,
            "dtype_str": "fp16",
            "num_warps": 4
        },
        "ms": 0.0137,
        "min_ms": 0.0139,
        "max_ms": 0.0136,
        "GB/s": 47.94,
        "TFLOPS": 39.27
    },
    {
        "params": {
            "M": 4096,
            "N": 1024,
            "K": 32,
            "block_m": 128,
            "block_n": 32,
            "block_k": 32,
            "dtype_str": "fp16",
            "num_warps": 4
        },
        "ms": 0.0173,
        "min_ms": 0.0175,
        "max_ms": 0.0172,
        "GB/s": 37.84,
        "TFLOPS": 31.0
    },
    {
        "params": {
            "M": 4096,
            "N": 1024,
            "K": 32,
            "block_m": 128,
            "block_n": 64,
            "block_k": 32,
            "dtype_str": "fp16",
            "num_warps": 4
        },
        "ms": 0.0137,
        "min_ms": 0.0139,
        "max_ms": 0.0136,
        "GB/s": 47.94,
        "TFLOPS": 39.27
    },
    {
        "params": {
            "M": 4096,
            "N": 1024,
            "K": 32,
            "block_m": 128,
            "block_n": 128,
            "block_k": 32,
            "dtype_str": "fp16",
            "num_warps": 4
        },
        "ms": 0.0134,
        "min_ms": 0.0137,
        "max_ms": 0.0133,
        "GB/s": 48.79,
        "TFLOPS": 39.97
    },
    {
        "params": {
            "M": 4096,
            "N": 2048,
            "K": 32,
            "block_m": 32,
            "block_n": 32,
            "block_k": 32,
            "dtype_str": "fp16",
            "num_warps": 4
        },
        "ms": 0.0302,
        "min_ms": 0.0304,
        "max_ms": 0.0301,
        "GB/s": 26.02,
        "TFLOPS": 35.52
    },
    {
        "params": {
            "M": 4096,
            "N": 2048,
            "K": 32,
            "block_m": 32,
            "block_n": 64,
            "block_k": 32,
            "dtype_str": "fp16",
            "num_warps": 4
        },
        "ms": 0.0234,
        "min_ms": 0.0238,
        "max_ms": 0.0232,
        "GB/s": 33.59,
        "TFLOPS": 45.86
    },
    {
        "params": {
            "M": 4096,
            "N": 2048,
            "K": 32,
            "block_m": 32,
            "block_n": 128,
            "block_k": 32,
            "dtype_str": "fp16",
            "num_warps": 4
        },
        "ms": 0.0227,
        "min_ms": 0.023,
        "max_ms": 0.0222,
        "GB/s": 34.72,
        "TFLOPS": 47.4
    },
    {
        "params": {
            "M": 4096,
            "N": 2048,
            "K": 32,
            "block_m": 64,
            "block_n": 32,
            "block_k": 32,
            "dtype_str": "fp16",
            "num_warps": 4
        },
        "ms": 0.03,
        "min_ms": 0.0301,
        "max_ms": 0.0299,
        "GB/s": 26.22,
        "TFLOPS": 35.81
    },
    {
        "params": {
            "M": 4096,
            "N": 2048,
            "K": 32,
            "block_m": 64,
            "block_n": 64,
            "block_k": 32,
            "dtype_str": "fp16",
            "num_warps": 4
        },
        "ms": 0.0229,
        "min_ms": 0.0231,
        "max_ms": 0.0227,
        "GB/s": 34.41,
        "TFLOPS": 46.99
    },
    {
        "params": {
            "M": 4096,
            "N": 2048,
            "K": 32,
            "block_m": 64,
            "block_n": 128,
            "block_k": 32,
            "dtype_str": "fp16",
            "num_warps": 4
        },
        "ms": 0.022,
        "min_ms": 0.0222,
        "max_ms": 0.0218,
        "GB/s": 35.8,
        "TFLOPS": 48.87
    },
    {
        "params": {
            "M": 4096,
            "N": 2048,
            "K": 32,
            "block_m": 128,
            "block_n": 32,
            "block_k": 32,
            "dtype_str": "fp16",
            "num_warps": 4
        },
        "ms": 0.0295,
        "min_ms": 0.0297,
        "max_ms": 0.0294,
        "GB/s": 26.63,
        "TFLOPS": 36.36
    },
    {
        "params": {
            "M": 4096,
            "N": 2048,
            "K": 32,
            "block_m": 128,
            "block_n": 64,
            "block_k": 32,
            "dtype_str": "fp16",
            "num_warps": 4
        },
        "ms": 0.0223,
        "min_ms": 0.0225,
        "max_ms": 0.0222,
        "GB/s": 35.28,
        "TFLOPS": 48.17
    },
    {
        "params": {
            "M": 4096,
            "N": 2048,
            "K": 32,
            "block_m": 128,
            "block_n": 128,
            "block_k": 32,
            "dtype_str": "fp16",
            "num_warps": 4
        },
        "ms": 0.0217,
        "min_ms": 0.0221,
        "max_ms": 0.0215,
        "GB/s": 36.26,
        "TFLOPS": 49.51
    },
    {
        "params": {
            "M": 4096,
            "N": 4096,
            "K": 32,
            "block_m": 32,
            "block_n": 32,
            "block_k": 32,
            "dtype_str": "fp16",
            "num_warps": 4
        },
        "ms": 0.0561,
        "min_ms": 0.0563,
        "max_ms": 0.056,
        "GB/s": 18.68,
        "TFLOPS": 38.26
    },
    {
        "params": {
            "M": 4096,
            "N": 4096,
            "K": 32,
            "block_m": 32,
            "block_n": 64,
            "block_k": 32,
            "dtype_str": "fp16",
            "num_warps": 4
        },
        "ms": 0.0415,
        "min_ms": 0.0422,
        "max_ms": 0.0411,
        "GB/s": 25.27,
        "TFLOPS": 51.75
    },
    {
        "params": {
            "M": 4096,
            "N": 4096,
            "K": 32,
            "block_m": 32,
            "block_n": 128,
            "block_k": 32,
            "dtype_str": "fp16",
            "num_warps": 4
        },
        "ms": 0.0396,
        "min_ms": 0.0401,
        "max_ms": 0.0392,
        "GB/s": 26.47,
        "TFLOPS": 54.22
    },
    {
        "params": {
            "M": 4096,
            "N": 4096,
            "K": 32,
            "block_m": 64,
            "block_n": 32,
            "block_k": 32,
            "dtype_str": "fp16",
            "num_warps": 4
        },
        "ms": 0.0555,
        "min_ms": 0.0557,
        "max_ms": 0.0554,
        "GB/s": 18.88,
        "TFLOPS": 38.68
    },
    {
        "params": {
            "M": 4096,
            "N": 4096,
            "K": 32,
            "block_m": 64,
            "block_n": 64,
            "block_k": 32,
            "dtype_str": "fp16",
            "num_warps": 4
        },
        "ms": 0.0405,
        "min_ms": 0.0407,
        "max_ms": 0.0404,
        "GB/s": 25.87,
        "TFLOPS": 52.98
    },
    {
        "params": {
            "M": 4096,
            "N": 4096,
            "K": 32,
            "block_m": 64,
            "block_n": 128,
            "block_k": 32,
            "dtype_str": "fp16",
            "num_warps": 4
        },
        "ms": 0.0384,
        "min_ms": 0.0386,
        "max_ms": 0.0383,
        "GB/s": 27.27,
        "TFLOPS": 55.86
    },
    {
        "params": {
            "M": 4096,
            "N": 4096,
            "K": 32,
            "block_m": 128,
            "block_n": 32,
            "block_k": 32,
            "dtype_str": "fp16",
            "num_warps": 4
        },
        "ms": 0.0546,
        "min_ms": 0.0548,
        "max_ms": 0.0544,
        "GB/s": 19.22,
        "TFLOPS": 39.36
    },
    {
        "params": {
            "M": 4096,
            "N": 4096,
            "K": 32,
            "block_m": 128,
            "block_n": 64,
            "block_k": 32,
            "dtype_str": "fp16",
            "num_warps": 4
        },
        "ms": 0.0394,
        "min_ms": 0.0396,
        "max_ms": 0.0393,
        "GB/s": 26.61,
        "TFLOPS": 54.49
    },
    {
        "params": {
            "M": 4096,
            "N": 4096,
            "K": 32,
            "block_m": 128,
            "block_n": 128,
            "block_k": 32,
            "dtype_str": "fp16",
            "num_warps": 4
        },
        "ms": 0.038,
        "min_ms": 0.0382,
        "max_ms": 0.0379,
        "GB/s": 27.59,
        "TFLOPS": 56.5
    },
    {
        "params": {
            "M": 128,
            "N": 128,
            "K": 64,
            "block_m": 32,
            "block_n": 32,
            "block_k": 64,
            "dtype_str": "fp16",
            "num_warps": 4
        },
        "ms": 0.0069,
        "min_ms": 0.007,
        "max_ms": 0.0069,
        "GB/s": 9.45,
        "TFLOPS": 0.6
    },
    {
        "params": {
            "M": 128,
            "N": 128,
            "K": 64,
            "block_m": 32,
            "block_n": 64,
            "block_k": 64,
            "dtype_str": "fp16",
            "num_warps": 4
        },
        "ms": 0.0072,
        "min_ms": 0.0073,
        "max_ms": 0.0071,
        "GB/s": 9.13,
        "TFLOPS": 0.58
    },
    {
        "params": {
            "M": 128,
            "N": 128,
            "K": 64,
            "block_m": 64,
            "block_n": 32,
            "block_k": 64,
            "dtype_str": "fp16",
            "num_warps": 4
        },
        "ms": 0.0075,
        "min_ms": 0.0076,
        "max_ms": 0.0074,
        "GB/s": 8.74,
        "TFLOPS": 0.56
    },
    {
        "params": {
            "M": 128,
            "N": 128,
            "K": 64,
            "block_m": 64,
            "block_n": 64,
            "block_k": 64,
            "dtype_str": "fp16",
            "num_warps": 4
        },
        "ms": 0.0075,
        "min_ms": 0.0076,
        "max_ms": 0.0074,
        "GB/s": 8.79,
        "TFLOPS": 0.56
    },
    {
        "params": {
            "M": 128,
            "N": 128,
            "K": 64,
            "block_m": 128,
            "block_n": 32,
            "block_k": 64,
            "dtype_str": "fp16",
            "num_warps": 4
        },
        "ms": 0.0079,
        "min_ms": 0.0081,
        "max_ms": 0.0079,
        "GB/s": 8.25,
        "TFLOPS": 0.53
    },
    {
        "params": {
            "M": 128,
            "N": 128,
            "K": 64,
            "block_m": 128,
            "block_n": 64,
            "block_k": 64,
            "dtype_str": "fp16",
            "num_warps": 4
        },
        "ms": 0.008,
        "min_ms": 0.0081,
        "max_ms": 0.0079,
        "GB/s": 8.21,
        "TFLOPS": 0.53
    },
    {
        "params": {
            "M": 128,
            "N": 256,
            "K": 64,
            "block_m": 32,
            "block_n": 32,
            "block_k": 64,
            "dtype_str": "fp16",
            "num_warps": 4
        },
        "ms": 0.0089,
        "min_ms": 0.009,
        "max_ms": 0.0088,
        "GB/s": 11.1,
        "TFLOPS": 0.95
    },
    {
        "params": {
            "M": 128,
            "N": 256,
            "K": 64,
            "block_m": 32,
            "block_n": 64,
            "block_k": 64,
            "dtype_str": "fp16",
            "num_warps": 4
        },
        "ms": 0.0093,
        "min_ms": 0.0094,
        "max_ms": 0.0092,
        "GB/s": 10.61,
        "TFLOPS": 0.91
    },
    {
        "params": {
            "M": 128,
            "N": 256,
            "K": 64,
            "block_m": 64,
            "block_n": 32,
            "block_k": 64,
            "dtype_str": "fp16",
            "num_warps": 4
        },
        "ms": 0.0096,
        "min_ms": 0.0098,
        "max_ms": 0.0095,
        "GB/s": 10.22,
        "TFLOPS": 0.87
    },
    {
        "params": {
            "M": 128,
            "N": 256,
            "K": 64,
            "block_m": 64,
            "block_n": 64,
            "block_k": 64,
            "dtype_str": "fp16",
            "num_warps": 4
        },
        "ms": 0.0096,
        "min_ms": 0.0097,
        "max_ms": 0.0095,
        "GB/s": 10.26,
        "TFLOPS": 0.88
    },
    {
        "params": {
            "M": 128,
            "N": 256,
            "K": 64,
            "block_m": 128,
            "block_n": 32,
            "block_k": 64,
            "dtype_str": "fp16",
            "num_warps": 4
        },
        "ms": 0.0102,
        "min_ms": 0.0104,
        "max_ms": 0.0101,
        "GB/s": 9.62,
        "TFLOPS": 0.82
    },
    {
        "params": {
            "M": 128,
            "N": 256,
            "K": 64,
            "block_m": 128,
            "block_n": 64,
            "block_k": 64,
            "dtype_str": "fp16",
            "num_warps": 4
        },
        "ms": 0.0101,
        "min_ms": 0.0102,
        "max_ms": 0.0099,
        "GB/s": 9.77,
        "TFLOPS": 0.83
    },
    {
        "params": {
            "M": 128,
            "N": 512,
            "K": 64,
            "block_m": 32,
            "block_n": 32,
            "block_k": 64,
            "dtype_str": "fp16",
            "num_warps": 4
        },
        "ms": 0.0128,
        "min_ms": 0.0129,
        "max_ms": 0.0127,
        "GB/s": 12.81,
        "TFLOPS": 1.31
    },
    {
        "params": {
            "M": 128,
            "N": 512,
            "K": 64,
            "block_m": 32,
            "block_n": 64,
            "block_k": 64,
            "dtype_str": "fp16",
            "num_warps": 4
        },
        "ms": 0.0135,
        "min_ms": 0.0136,
        "max_ms": 0.0135,
        "GB/s": 12.13,
        "TFLOPS": 1.24
    },
    {
        "params": {
            "M": 128,
            "N": 512,
            "K": 64,
            "block_m": 64,
            "block_n": 32,
            "block_k": 64,
            "dtype_str": "fp16",
            "num_warps": 4
        },
        "ms": 0.014,
        "min_ms": 0.0141,
        "max_ms": 0.0139,
        "GB/s": 11.71,
        "TFLOPS": 1.2
    },
    {
        "params": {
            "M": 128,
            "N": 512,
            "K": 64,
            "block_m": 64,
            "block_n": 64,
            "block_k": 64,
            "dtype_str": "fp16",
            "num_warps": 4
        },
        "ms": 0.0138,
        "min_ms": 0.014,
        "max_ms": 0.0137,
        "GB/s": 11.85,
        "TFLOPS": 1.21
    },
    {
        "params": {
            "M": 128,
            "N": 512,
            "K": 64,
            "block_m": 128,
            "block_n": 32,
            "block_k": 64,
            "dtype_str": "fp16",
            "num_warps": 4
        },
        "ms": 0.0146,
        "min_ms": 0.0148,
        "max_ms": 0.0145,
        "GB/s": 11.2,
        "TFLOPS": 1.15
    },
    {
        "params": {
            "M": 128,
            "N": 512,
            "K": 64,
            "block_m": 128,
            "block_n": 64,
            "block_k": 64,
            "dtype_str": "fp16",
            "num_warps": 4
        },
        "ms": 0.0143,
        "min_ms": 0.0144,
        "max_ms": 0.0142,
        "GB/s": 11.45,
        "TFLOPS": 1.17
    },
    {
        "params": {
            "M": 128,
            "N": 1024,
            "K": 64,
            "block_m": 32,
            "block_n": 32,
            "block_k": 64,
            "dtype_str": "fp16",
            "num_warps": 4
        },
        "ms": 0.0208,
        "min_ms": 0.0208,
        "max_ms": 0.0206,
        "GB/s": 14.2,
        "TFLOPS": 1.62
    },
    {
        "params": {
            "M": 128,
            "N": 1024,
            "K": 64,
            "block_m": 32,
            "block_n": 64,
            "block_k": 64,
            "dtype_str": "fp16",
            "num_warps": 4
        },
        "ms": 0.022,
        "min_ms": 0.0222,
        "max_ms": 0.0219,
        "GB/s": 13.4,
        "TFLOPS": 1.52
    },
    {
        "params": {
            "M": 128,
            "N": 1024,
            "K": 64,
            "block_m": 64,
            "block_n": 32,
            "block_k": 64,
            "dtype_str": "fp16",
            "num_warps": 4
        },
        "ms": 0.0228,
        "min_ms": 0.023,
        "max_ms": 0.0227,
        "GB/s": 12.93,
        "TFLOPS": 1.47
    },
    {
        "params": {
            "M": 128,
            "N": 1024,
            "K": 64,
            "block_m": 64,
            "block_n": 64,
            "block_k": 64,
            "dtype_str": "fp16",
            "num_warps": 4
        },
        "ms": 0.0225,
        "min_ms": 0.0226,
        "max_ms": 0.0223,
        "GB/s": 13.14,
        "TFLOPS": 1.49
    },
    {
        "params": {
            "M": 128,
            "N": 1024,
            "K": 64,
            "block_m": 128,
            "block_n": 32,
            "block_k": 64,
            "dtype_str": "fp16",
            "num_warps": 4
        },
        "ms": 0.0239,
        "min_ms": 0.024,
        "max_ms": 0.0237,
        "GB/s": 12.36,
        "TFLOPS": 1.41
    },
    {
        "params": {
            "M": 128,
            "N": 1024,
            "K": 64,
            "block_m": 128,
            "block_n": 64,
            "block_k": 64,
            "dtype_str": "fp16",
            "num_warps": 4
        },
        "ms": 0.0229,
        "min_ms": 0.0231,
        "max_ms": 0.0228,
        "GB/s": 12.88,
        "TFLOPS": 1.47
    },
    {
        "params": {
            "M": 256,
            "N": 128,
            "K": 64,
            "block_m": 32,
            "block_n": 32,
            "block_k": 64,
            "dtype_str": "fp16",
            "num_warps": 4
        },
        "ms": 0.0072,
        "min_ms": 0.0073,
        "max_ms": 0.0071,
        "GB/s": 13.7,
        "TFLOPS": 1.17
    },
    {
        "params": {
            "M": 256,
            "N": 128,
            "K": 64,
            "block_m": 32,
            "block_n": 64,
            "block_k": 64,
            "dtype_str": "fp16",
            "num_warps": 4
        },
        "ms": 0.0074,
        "min_ms": 0.0075,
        "max_ms": 0.0073,
        "GB/s": 13.33,
        "TFLOPS": 1.14
    },
    {
        "params": {
            "M": 256,
            "N": 128,
            "K": 64,
            "block_m": 64,
            "block_n": 32,
            "block_k": 64,
            "dtype_str": "fp16",
            "num_warps": 4
        },
        "ms": 0.0075,
        "min_ms": 0.0076,
        "max_ms": 0.0075,
        "GB/s": 13.11,
        "TFLOPS": 1.12
    },
    {
        "params": {
            "M": 256,
            "N": 128,
            "K": 64,
            "block_m": 64,
            "block_n": 64,
            "block_k": 64,
            "dtype_str": "fp16",
            "num_warps": 4
        },
        "ms": 0.0075,
        "min_ms": 0.0076,
        "max_ms": 0.0075,
        "GB/s": 13.04,
        "TFLOPS": 1.11
    },
    {
        "params": {
            "M": 256,
            "N": 128,
            "K": 64,
            "block_m": 128,
            "block_n": 32,
            "block_k": 64,
            "dtype_str": "fp16",
            "num_warps": 4
        },
        "ms": 0.0079,
        "min_ms": 0.0082,
        "max_ms": 0.0079,
        "GB/s": 12.38,
        "TFLOPS": 1.06
    },
    {
        "params": {
            "M": 256,
            "N": 128,
            "K": 64,
            "block_m": 128,
            "block_n": 64,
            "block_k": 64,
            "dtype_str": "fp16",
            "num_warps": 4
        },
        "ms": 0.0079,
        "min_ms": 0.0081,
        "max_ms": 0.0078,
        "GB/s": 12.38,
        "TFLOPS": 1.06
    },
    {
        "params": {
            "M": 256,
            "N": 256,
            "K": 64,
            "block_m": 32,
            "block_n": 32,
            "block_k": 64,
            "dtype_str": "fp16",
            "num_warps": 4
        },
        "ms": 0.0091,
        "min_ms": 0.0093,
        "max_ms": 0.0091,
        "GB/s": 14.34,
        "TFLOPS": 1.84
    },
    {
        "params": {
            "M": 256,
            "N": 256,
            "K": 64,
            "block_m": 32,
            "block_n": 64,
            "block_k": 64,
            "dtype_str": "fp16",
            "num_warps": 4
        },
        "ms": 0.0095,
        "min_ms": 0.0097,
        "max_ms": 0.0094,
        "GB/s": 13.74,
        "TFLOPS": 1.76
    },
    {
        "params": {
            "M": 256,
            "N": 256,
            "K": 64,
            "block_m": 64,
            "block_n": 32,
            "block_k": 64,
            "dtype_str": "fp16",
            "num_warps": 4
        },
        "ms": 0.0097,
        "min_ms": 0.0097,
        "max_ms": 0.0096,
        "GB/s": 13.57,
        "TFLOPS": 1.74
    },
    {
        "params": {
            "M": 256,
            "N": 256,
            "K": 64,
            "block_m": 64,
            "block_n": 64,
            "block_k": 64,
            "dtype_str": "fp16",
            "num_warps": 4
        },
        "ms": 0.0097,
        "min_ms": 0.0098,
        "max_ms": 0.0096,
        "GB/s": 13.57,
        "TFLOPS": 1.74
    },
    {
        "params": {
            "M": 256,
            "N": 256,
            "K": 64,
            "block_m": 128,
            "block_n": 32,
            "block_k": 64,
            "dtype_str": "fp16",
            "num_warps": 4
        },
        "ms": 0.0101,
        "min_ms": 0.0103,
        "max_ms": 0.0101,
        "GB/s": 12.92,
        "TFLOPS": 1.65
    },
    {
        "params": {
            "M": 256,
            "N": 256,
            "K": 64,
            "block_m": 128,
            "block_n": 64,
            "block_k": 64,
            "dtype_str": "fp16",
            "num_warps": 4
        },
        "ms": 0.0101,
        "min_ms": 0.0102,
        "max_ms": 0.01,
        "GB/s": 13.03,
        "TFLOPS": 1.67
    },
    {
        "params": {
            "M": 256,
            "N": 512,
            "K": 64,
            "block_m": 32,
            "block_n": 32,
            "block_k": 64,
            "dtype_str": "fp16",
            "num_warps": 4
        },
        "ms": 0.0131,
        "min_ms": 0.0132,
        "max_ms": 0.013,
        "GB/s": 15.04,
        "TFLOPS": 2.57
    },
    {
        "params": {
            "M": 256,
            "N": 512,
            "K": 64,
            "block_m": 32,
            "block_n": 64,
            "block_k": 64,
            "dtype_str": "fp16",
            "num_warps": 4
        },
        "ms": 0.0137,
        "min_ms": 0.0139,
        "max_ms": 0.0136,
        "GB/s": 14.34,
        "TFLOPS": 2.45
    },
    {
        "params": {
            "M": 256,
            "N": 512,
            "K": 64,
            "block_m": 64,
            "block_n": 32,
            "block_k": 64,
            "dtype_str": "fp16",
            "num_warps": 4
        },
        "ms": 0.014,
        "min_ms": 0.0141,
        "max_ms": 0.014,
        "GB/s": 14.01,
        "TFLOPS": 2.39
    },
    {
        "params": {
            "M": 256,
            "N": 512,
            "K": 64,
            "block_m": 64,
            "block_n": 64,
            "block_k": 64,
            "dtype_str": "fp16",
            "num_warps": 4
        },
        "ms": 0.0139,
        "min_ms": 0.014,
        "max_ms": 0.0139,
        "GB/s": 14.13,
        "TFLOPS": 2.41
    },
    {
        "params": {
            "M": 256,
            "N": 512,
            "K": 64,
            "block_m": 128,
            "block_n": 32,
            "block_k": 64,
            "dtype_str": "fp16",
            "num_warps": 4
        },
        "ms": 0.0146,
        "min_ms": 0.0147,
        "max_ms": 0.0145,
        "GB/s": 13.51,
        "TFLOPS": 2.31
    },
    {
        "params": {
            "M": 256,
            "N": 512,
            "K": 64,
            "block_m": 128,
            "block_n": 64,
            "block_k": 64,
            "dtype_str": "fp16",
            "num_warps": 4
        },
        "ms": 0.0143,
        "min_ms": 0.0144,
        "max_ms": 0.0142,
        "GB/s": 13.74,
        "TFLOPS": 2.34
    },
    {
        "params": {
            "M": 256,
            "N": 1024,
            "K": 64,
            "block_m": 32,
            "block_n": 32,
            "block_k": 64,
            "dtype_str": "fp16",
            "num_warps": 4
        },
        "ms": 0.021,
        "min_ms": 0.0212,
        "max_ms": 0.0209,
        "GB/s": 15.57,
        "TFLOPS": 3.19
    },
    {
        "params": {
            "M": 256,
            "N": 1024,
            "K": 64,
            "block_m": 32,
            "block_n": 64,
            "block_k": 64,
            "dtype_str": "fp16",
            "num_warps": 4
        },
        "ms": 0.0223,
        "min_ms": 0.0225,
        "max_ms": 0.0222,
        "GB/s": 14.7,
        "TFLOPS": 3.01
    },
    {
        "params": {
            "M": 256,
            "N": 1024,
            "K": 64,
            "block_m": 64,
            "block_n": 32,
            "block_k": 64,
            "dtype_str": "fp16",
            "num_warps": 4
        },
        "ms": 0.0228,
        "min_ms": 0.023,
        "max_ms": 0.0227,
        "GB/s": 14.39,
        "TFLOPS": 2.95
    },
    {
        "params": {
            "M": 256,
            "N": 1024,
            "K": 64,
            "block_m": 64,
            "block_n": 64,
            "block_k": 64,
            "dtype_str": "fp16",
            "num_warps": 4
        },
        "ms": 0.0225,
        "min_ms": 0.0226,
        "max_ms": 0.0223,
        "GB/s": 14.6,
        "TFLOPS": 2.99
    },
    {
        "params": {
            "M": 256,
            "N": 1024,
            "K": 64,
            "block_m": 128,
            "block_n": 32,
            "block_k": 64,
            "dtype_str": "fp16",
            "num_warps": 4
        },
        "ms": 0.0235,
        "min_ms": 0.0236,
        "max_ms": 0.0234,
        "GB/s": 13.95,
        "TFLOPS": 2.86
    },
    {
        "params": {
            "M": 256,
            "N": 1024,
            "K": 64,
            "block_m": 128,
            "block_n": 64,
            "block_k": 64,
            "dtype_str": "fp16",
            "num_warps": 4
        },
        "ms": 0.0229,
        "min_ms": 0.0231,
        "max_ms": 0.0228,
        "GB/s": 14.29,
        "TFLOPS": 2.93
    },
    {
        "params": {
            "M": 512,
            "N": 128,
            "K": 64,
            "block_m": 32,
            "block_n": 32,
            "block_k": 64,
            "dtype_str": "fp16",
            "num_warps": 4
        },
        "ms": 0.0072,
        "min_ms": 0.0074,
        "max_ms": 0.0071,
        "GB/s": 22.71,
        "TFLOPS": 2.33
    },
    {
        "params": {
            "M": 512,
            "N": 128,
            "K": 64,
            "block_m": 32,
            "block_n": 64,
            "block_k": 64,
            "dtype_str": "fp16",
            "num_warps": 4
        },
        "ms": 0.0074,
        "min_ms": 0.0076,
        "max_ms": 0.0073,
        "GB/s": 22.09,
        "TFLOPS": 2.26
    },
    {
        "params": {
            "M": 512,
            "N": 128,
            "K": 64,
            "block_m": 64,
            "block_n": 32,
            "block_k": 64,
            "dtype_str": "fp16",
            "num_warps": 4
        },
        "ms": 0.0076,
        "min_ms": 0.0078,
        "max_ms": 0.0075,
        "GB/s": 21.51,
        "TFLOPS": 2.2
    },
    {
        "params": {
            "M": 512,
            "N": 128,
            "K": 64,
            "block_m": 64,
            "block_n": 64,
            "block_k": 64,
            "dtype_str": "fp16",
            "num_warps": 4
        },
        "ms": 0.0077,
        "min_ms": 0.0078,
        "max_ms": 0.0076,
        "GB/s": 21.39,
        "TFLOPS": 2.19
    },
    {
        "params": {
            "M": 512,
            "N": 128,
            "K": 64,
            "block_m": 128,
            "block_n": 32,
            "block_k": 64,
            "dtype_str": "fp16",
            "num_warps": 4
        },
        "ms": 0.008,
        "min_ms": 0.0081,
        "max_ms": 0.008,
        "GB/s": 20.43,
        "TFLOPS": 2.09
    },
    {
        "params": {
            "M": 512,
            "N": 128,
            "K": 64,
            "block_m": 128,
            "block_n": 64,
            "block_k": 64,
            "dtype_str": "fp16",
            "num_warps": 4
        },
        "ms": 0.008,
        "min_ms": 0.0081,
        "max_ms": 0.0079,
        "GB/s": 20.54,
        "TFLOPS": 2.1
    },
    {
        "params": {
            "M": 512,
            "N": 256,
            "K": 64,
            "block_m": 32,
            "block_n": 32,
            "block_k": 64,
            "dtype_str": "fp16",
            "num_warps": 4
        },
        "ms": 0.0092,
        "min_ms": 0.0094,
        "max_ms": 0.0091,
        "GB/s": 21.32,
        "TFLOPS": 3.64
    },
    {
        "params": {
            "M": 512,
            "N": 256,
            "K": 64,
            "block_m": 32,
            "block_n": 64,
            "block_k": 64,
            "dtype_str": "fp16",
            "num_warps": 4
        },
        "ms": 0.0095,
        "min_ms": 0.0097,
        "max_ms": 0.0094,
        "GB/s": 20.61,
        "TFLOPS": 3.52
    },
    {
        "params": {
            "M": 512,
            "N": 256,
            "K": 64,
            "block_m": 64,
            "block_n": 32,
            "block_k": 64,
            "dtype_str": "fp16",
            "num_warps": 4
        },
        "ms": 0.0098,
        "min_ms": 0.01,
        "max_ms": 0.0097,
        "GB/s": 20.02,
        "TFLOPS": 3.42
    },
    {
        "params": {
            "M": 512,
            "N": 256,
            "K": 64,
            "block_m": 64,
            "block_n": 64,
            "block_k": 64,
            "dtype_str": "fp16",
            "num_warps": 4
        },
        "ms": 0.0098,
        "min_ms": 0.01,
        "max_ms": 0.0097,
        "GB/s": 20.02,
        "TFLOPS": 3.42
    },
    {
        "params": {
            "M": 512,
            "N": 256,
            "K": 64,
            "block_m": 128,
            "block_n": 32,
            "block_k": 64,
            "dtype_str": "fp16",
            "num_warps": 4
        },
        "ms": 0.0102,
        "min_ms": 0.0103,
        "max_ms": 0.0101,
        "GB/s": 19.31,
        "TFLOPS": 3.29
    },
    {
        "params": {
            "M": 512,
            "N": 256,
            "K": 64,
            "block_m": 128,
            "block_n": 64,
            "block_k": 64,
            "dtype_str": "fp16",
            "num_warps": 4
        },
        "ms": 0.0101,
        "min_ms": 0.0102,
        "max_ms": 0.0101,
        "GB/s": 19.46,
        "TFLOPS": 3.32
    },
    {
        "params": {
            "M": 512,
            "N": 512,
            "K": 64,
            "block_m": 32,
            "block_n": 32,
            "block_k": 64,
            "dtype_str": "fp16",
            "num_warps": 4
        },
        "ms": 0.0131,
        "min_ms": 0.0132,
        "max_ms": 0.013,
        "GB/s": 20.0,
        "TFLOPS": 5.12
    },
    {
        "params": {
            "M": 512,
            "N": 512,
            "K": 64,
            "block_m": 32,
            "block_n": 64,
            "block_k": 64,
            "dtype_str": "fp16",
            "num_warps": 4
        },
        "ms": 0.0138,
        "min_ms": 0.014,
        "max_ms": 0.0136,
        "GB/s": 19.06,
        "TFLOPS": 4.88
    },
    {
        "params": {
            "M": 512,
            "N": 512,
            "K": 64,
            "block_m": 64,
            "block_n": 32,
            "block_k": 64,
            "dtype_str": "fp16",
            "num_warps": 4
        },
        "ms": 0.0142,
        "min_ms": 0.0143,
        "max_ms": 0.014,
        "GB/s": 18.52,
        "TFLOPS": 4.74
    },
    {
        "params": {
            "M": 512,
            "N": 512,
            "K": 64,
            "block_m": 64,
            "block_n": 64,
            "block_k": 64,
            "dtype_str": "fp16",
            "num_warps": 4
        },
        "ms": 0.014,
        "min_ms": 0.0142,
        "max_ms": 0.014,
        "GB/s": 18.68,
        "TFLOPS": 4.78
    },
    {
        "params": {
            "M": 512,
            "N": 512,
            "K": 64,
            "block_m": 128,
            "block_n": 32,
            "block_k": 64,
            "dtype_str": "fp16",
            "num_warps": 4
        },
        "ms": 0.0146,
        "min_ms": 0.0147,
        "max_ms": 0.0146,
        "GB/s": 17.96,
        "TFLOPS": 4.6
    },
    {
        "params": {
            "M": 512,
            "N": 512,
            "K": 64,
            "block_m": 128,
            "block_n": 64,
            "block_k": 64,
            "dtype_str": "fp16",
            "num_warps": 4
        },
        "ms": 0.0144,
        "min_ms": 0.0144,
        "max_ms": 0.0143,
        "GB/s": 18.27,
        "TFLOPS": 4.68
    },
    {
        "params": {
            "M": 512,
            "N": 1024,
            "K": 64,
            "block_m": 32,
            "block_n": 32,
            "block_k": 64,
            "dtype_str": "fp16",
            "num_warps": 4
        },
        "ms": 0.021,
        "min_ms": 0.0212,
        "max_ms": 0.021,
        "GB/s": 18.68,
        "TFLOPS": 6.38
    },
    {
        "params": {
            "M": 512,
            "N": 1024,
            "K": 64,
            "block_m": 32,
            "block_n": 64,
            "block_k": 64,
            "dtype_str": "fp16",
            "num_warps": 4
        },
        "ms": 0.0223,
        "min_ms": 0.0225,
        "max_ms": 0.0222,
        "GB/s": 17.64,
        "TFLOPS": 6.02
    },
    {
        "params": {
            "M": 512,
            "N": 1024,
            "K": 64,
            "block_m": 64,
            "block_n": 32,
            "block_k": 64,
            "dtype_str": "fp16",
            "num_warps": 4
        },
        "ms": 0.023,
        "min_ms": 0.0232,
        "max_ms": 0.0229,
        "GB/s": 17.12,
        "TFLOPS": 5.84
    },
    {
        "params": {
            "M": 512,
            "N": 1024,
            "K": 64,
            "block_m": 64,
            "block_n": 64,
            "block_k": 64,
            "dtype_str": "fp16",
            "num_warps": 4
        },
        "ms": 0.0226,
        "min_ms": 0.0228,
        "max_ms": 0.0225,
        "GB/s": 17.39,
        "TFLOPS": 5.94
    },
    {
        "params": {
            "M": 512,
            "N": 1024,
            "K": 64,
            "block_m": 128,
            "block_n": 32,
            "block_k": 64,
            "dtype_str": "fp16",
            "num_warps": 4
        },
        "ms": 0.0235,
        "min_ms": 0.0236,
        "max_ms": 0.0233,
        "GB/s": 16.77,
        "TFLOPS": 5.72
    },
    {
        "params": {
            "M": 512,
            "N": 1024,
            "K": 64,
            "block_m": 128,
            "block_n": 64,
            "block_k": 64,
            "dtype_str": "fp16",
            "num_warps": 4
        },
        "ms": 0.0229,
        "min_ms": 0.023,
        "max_ms": 0.0228,
        "GB/s": 17.21,
        "TFLOPS": 5.87
    },
    {
        "params": {
            "M": 1024,
            "N": 128,
            "K": 64,
            "block_m": 32,
            "block_n": 32,
            "block_k": 64,
            "dtype_str": "fp16",
            "num_warps": 4
        },
        "ms": 0.0072,
        "min_ms": 0.0074,
        "max_ms": 0.0071,
        "GB/s": 40.86,
        "TFLOPS": 4.65
    },
    {
        "params": {
            "M": 1024,
            "N": 128,
            "K": 64,
            "block_m": 32,
            "block_n": 64,
            "block_k": 64,
            "dtype_str": "fp16",
            "num_warps": 4
        },
        "ms": 0.0075,
        "min_ms": 0.0076,
        "max_ms": 0.0073,
        "GB/s": 39.55,
        "TFLOPS": 4.5
    },
    {
        "params": {
            "M": 1024,
            "N": 128,
            "K": 64,
            "block_m": 64,
            "block_n": 32,
            "block_k": 64,
            "dtype_str": "fp16",
            "num_warps": 4
        },
        "ms": 0.0077,
        "min_ms": 0.0078,
        "max_ms": 0.0075,
        "GB/s": 38.51,
        "TFLOPS": 4.38
    },
    {
        "params": {
            "M": 1024,
            "N": 128,
            "K": 64,
            "block_m": 64,
            "block_n": 64,
            "block_k": 64,
            "dtype_str": "fp16",
            "num_warps": 4
        },
        "ms": 0.0078,
        "min_ms": 0.0079,
        "max_ms": 0.0077,
        "GB/s": 37.92,
        "TFLOPS": 4.31
    },
    {
        "params": {
            "M": 1024,
            "N": 128,
            "K": 64,
            "block_m": 128,
            "block_n": 32,
            "block_k": 64,
            "dtype_str": "fp16",
            "num_warps": 4
        },
        "ms": 0.0082,
        "min_ms": 0.0084,
        "max_ms": 0.0081,
        "GB/s": 36.06,
        "TFLOPS": 4.1
    },
    {
        "params": {
            "M": 1024,
            "N": 128,
            "K": 64,
            "block_m": 128,
            "block_n": 64,
            "block_k": 64,
            "dtype_str": "fp16",
            "num_warps": 4
        },
        "ms": 0.0082,
        "min_ms": 0.0083,
        "max_ms": 0.0081,
        "GB/s": 36.06,
        "TFLOPS": 4.1
    },
    {
        "params": {
            "M": 1024,
            "N": 256,
            "K": 64,
            "block_m": 32,
            "block_n": 32,
            "block_k": 64,
            "dtype_str": "fp16",
            "num_warps": 4
        },
        "ms": 0.0093,
        "min_ms": 0.0094,
        "max_ms": 0.0091,
        "GB/s": 35.38,
        "TFLOPS": 7.25
    },
    {
        "params": {
            "M": 1024,
            "N": 256,
            "K": 64,
            "block_m": 32,
            "block_n": 64,
            "block_k": 64,
            "dtype_str": "fp16",
            "num_warps": 4
        },
        "ms": 0.0096,
        "min_ms": 0.0098,
        "max_ms": 0.0095,
        "GB/s": 34.06,
        "TFLOPS": 6.97
    },
    {
        "params": {
            "M": 1024,
            "N": 256,
            "K": 64,
            "block_m": 64,
            "block_n": 32,
            "block_k": 64,
            "dtype_str": "fp16",
            "num_warps": 4
        },
        "ms": 0.0099,
        "min_ms": 0.01,
        "max_ms": 0.0097,
        "GB/s": 33.23,
        "TFLOPS": 6.8
    },
    {
        "params": {
            "M": 1024,
            "N": 256,
            "K": 64,
            "block_m": 64,
            "block_n": 64,
            "block_k": 64,
            "dtype_str": "fp16",
            "num_warps": 4
        },
        "ms": 0.0099,
        "min_ms": 0.0101,
        "max_ms": 0.0098,
        "GB/s": 33.09,
        "TFLOPS": 6.78
    },
    {
        "params": {
            "M": 1024,
            "N": 256,
            "K": 64,
            "block_m": 128,
            "block_n": 32,
            "block_k": 64,
            "dtype_str": "fp16",
            "num_warps": 4
        },
        "ms": 0.0104,
        "min_ms": 0.0106,
        "max_ms": 0.0103,
        "GB/s": 31.44,
        "TFLOPS": 6.44
    },
    {
        "params": {
            "M": 1024,
            "N": 256,
            "K": 64,
            "block_m": 128,
            "block_n": 64,
            "block_k": 64,
            "dtype_str": "fp16",
            "num_warps": 4
        },
        "ms": 0.0103,
        "min_ms": 0.0105,
        "max_ms": 0.0102,
        "GB/s": 31.8,
        "TFLOPS": 6.51
    },
    {
        "params": {
            "M": 1024,
            "N": 512,
            "K": 64,
            "block_m": 32,
            "block_n": 32,
            "block_k": 64,
            "dtype_str": "fp16",
            "num_warps": 4
        },
        "ms": 0.0132,
        "min_ms": 0.0134,
        "max_ms": 0.0131,
        "GB/s": 29.72,
        "TFLOPS": 10.14
    },
    {
        "params": {
            "M": 1024,
            "N": 512,
            "K": 64,
            "block_m": 32,
            "block_n": 64,
            "block_k": 64,
            "dtype_str": "fp16",
            "num_warps": 4
        },
        "ms": 0.0139,
        "min_ms": 0.014,
        "max_ms": 0.0138,
        "GB/s": 28.35,
        "TFLOPS": 9.68
    },
    {
        "params": {
            "M": 1024,
            "N": 512,
            "K": 64,
            "block_m": 64,
            "block_n": 32,
            "block_k": 64,
            "dtype_str": "fp16",
            "num_warps": 4
        },
        "ms": 0.0142,
        "min_ms": 0.0144,
        "max_ms": 0.0141,
        "GB/s": 27.63,
        "TFLOPS": 9.43
    },
    {
        "params": {
            "M": 1024,
            "N": 512,
            "K": 64,
            "block_m": 64,
            "block_n": 64,
            "block_k": 64,
            "dtype_str": "fp16",
            "num_warps": 4
        },
        "ms": 0.0142,
        "min_ms": 0.0144,
        "max_ms": 0.014,
        "GB/s": 27.78,
        "TFLOPS": 9.48
    },
    {
        "params": {
            "M": 1024,
            "N": 512,
            "K": 64,
            "block_m": 128,
            "block_n": 32,
            "block_k": 64,
            "dtype_str": "fp16",
            "num_warps": 4
        },
        "ms": 0.0148,
        "min_ms": 0.015,
        "max_ms": 0.0147,
        "GB/s": 26.51,
        "TFLOPS": 9.05
    },
    {
        "params": {
            "M": 1024,
            "N": 512,
            "K": 64,
            "block_m": 128,
            "block_n": 64,
            "block_k": 64,
            "dtype_str": "fp16",
            "num_warps": 4
        },
        "ms": 0.0146,
        "min_ms": 0.0147,
        "max_ms": 0.0144,
        "GB/s": 27.02,
        "TFLOPS": 9.22
    },
    {
        "params": {
            "M": 1024,
            "N": 1024,
            "K": 64,
            "block_m": 32,
            "block_n": 32,
            "block_k": 64,
            "dtype_str": "fp16",
            "num_warps": 4
        },
        "ms": 0.0212,
        "min_ms": 0.0215,
        "max_ms": 0.0211,
        "GB/s": 24.72,
        "TFLOPS": 12.66
    },
    {
        "params": {
            "M": 1024,
            "N": 1024,
            "K": 64,
            "block_m": 32,
            "block_n": 64,
            "block_k": 64,
            "dtype_str": "fp16",
            "num_warps": 4
        },
        "ms": 0.0224,
        "min_ms": 0.0226,
        "max_ms": 0.0223,
        "GB/s": 23.39,
        "TFLOPS": 11.98
    },
    {
        "params": {
            "M": 1024,
            "N": 1024,
            "K": 64,
            "block_m": 64,
            "block_n": 32,
            "block_k": 64,
            "dtype_str": "fp16",
            "num_warps": 4
        },
        "ms": 0.0229,
        "min_ms": 0.0231,
        "max_ms": 0.0229,
        "GB/s": 22.86,
        "TFLOPS": 11.71
    },
    {
        "params": {
            "M": 1024,
            "N": 1024,
            "K": 64,
            "block_m": 64,
            "block_n": 64,
            "block_k": 64,
            "dtype_str": "fp16",
            "num_warps": 4
        },
        "ms": 0.0227,
        "min_ms": 0.0229,
        "max_ms": 0.0226,
        "GB/s": 23.11,
        "TFLOPS": 11.83
    },
    {
        "params": {
            "M": 1024,
            "N": 1024,
            "K": 64,
            "block_m": 128,
            "block_n": 32,
            "block_k": 64,
            "dtype_str": "fp16",
            "num_warps": 4
        },
        "ms": 0.0237,
        "min_ms": 0.0238,
        "max_ms": 0.0236,
        "GB/s": 22.09,
        "TFLOPS": 11.31
    },
    {
        "params": {
            "M": 1024,
            "N": 1024,
            "K": 64,
            "block_m": 128,
            "block_n": 64,
            "block_k": 64,
            "dtype_str": "fp16",
            "num_warps": 4
        },
        "ms": 0.0231,
        "min_ms": 0.0233,
        "max_ms": 0.023,
        "GB/s": 22.7,
        "TFLOPS": 11.62
    },
    {
        "params": {
            "M": 2048,
            "N": 128,
            "K": 64,
            "block_m": 32,
            "block_n": 32,
            "block_k": 64,
            "dtype_str": "fp16",
            "num_warps": 4
        },
        "ms": 0.0073,
        "min_ms": 0.0075,
        "max_ms": 0.0072,
        "GB/s": 75.93,
        "TFLOPS": 9.15
    },
    {
        "params": {
            "M": 2048,
            "N": 128,
            "K": 64,
            "block_m": 32,
            "block_n": 64,
            "block_k": 64,
            "dtype_str": "fp16",
            "num_warps": 4
        },
        "ms": 0.0076,
        "min_ms": 0.0077,
        "max_ms": 0.0075,
        "GB/s": 73.52,
        "TFLOPS": 8.86
    },
    {
        "params": {
            "M": 2048,
            "N": 128,
            "K": 64,
            "block_m": 64,
            "block_n": 32,
            "block_k": 64,
            "dtype_str": "fp16",
            "num_warps": 4
        },
        "ms": 0.0077,
        "min_ms": 0.0078,
        "max_ms": 0.0076,
        "GB/s": 72.74,
        "TFLOPS": 8.76
    },
    {
        "params": {
            "M": 2048,
            "N": 128,
            "K": 64,
            "block_m": 64,
            "block_n": 64,
            "block_k": 64,
            "dtype_str": "fp16",
            "num_warps": 4
        },
        "ms": 0.0078,
        "min_ms": 0.0079,
        "max_ms": 0.0077,
        "GB/s": 71.63,
        "TFLOPS": 8.63
    },
    {
        "params": {
            "M": 2048,
            "N": 128,
            "K": 64,
            "block_m": 128,
            "block_n": 32,
            "block_k": 64,
            "dtype_str": "fp16",
            "num_warps": 4
        },
        "ms": 0.0082,
        "min_ms": 0.0084,
        "max_ms": 0.0081,
        "GB/s": 67.78,
        "TFLOPS": 8.17
    },
    {
        "params": {
            "M": 2048,
            "N": 128,
            "K": 64,
            "block_m": 128,
            "block_n": 64,
            "block_k": 64,
            "dtype_str": "fp16",
            "num_warps": 4
        },
        "ms": 0.0082,
        "min_ms": 0.0083,
        "max_ms": 0.0081,
        "GB/s": 68.11,
        "TFLOPS": 8.21
    },
    {
        "params": {
            "M": 2048,
            "N": 256,
            "K": 64,
            "block_m": 32,
            "block_n": 32,
            "block_k": 64,
            "dtype_str": "fp16",
            "num_warps": 4
        },
        "ms": 0.0093,
        "min_ms": 0.0095,
        "max_ms": 0.0092,
        "GB/s": 63.41,
        "TFLOPS": 14.43
    },
    {
        "params": {
            "M": 2048,
            "N": 256,
            "K": 64,
            "block_m": 32,
            "block_n": 64,
            "block_k": 64,
            "dtype_str": "fp16",
            "num_warps": 4
        },
        "ms": 0.0097,
        "min_ms": 0.0099,
        "max_ms": 0.0096,
        "GB/s": 60.79,
        "TFLOPS": 13.83
    },
    {
        "params": {
            "M": 2048,
            "N": 256,
            "K": 64,
            "block_m": 64,
            "block_n": 32,
            "block_k": 64,
            "dtype_str": "fp16",
            "num_warps": 4
        },
        "ms": 0.0099,
        "min_ms": 0.01,
        "max_ms": 0.0097,
        "GB/s": 59.81,
        "TFLOPS": 13.61
    },
    {
        "params": {
            "M": 2048,
            "N": 256,
            "K": 64,
            "block_m": 64,
            "block_n": 64,
            "block_k": 64,
            "dtype_str": "fp16",
            "num_warps": 4
        },
        "ms": 0.0099,
        "min_ms": 0.0101,
        "max_ms": 0.0098,
        "GB/s": 59.33,
        "TFLOPS": 13.5
    },
    {
        "params": {
            "M": 2048,
            "N": 256,
            "K": 64,
            "block_m": 128,
            "block_n": 32,
            "block_k": 64,
            "dtype_str": "fp16",
            "num_warps": 4
        },
        "ms": 0.0104,
        "min_ms": 0.0107,
        "max_ms": 0.0103,
        "GB/s": 56.58,
        "TFLOPS": 12.88
    },
    {
        "params": {
            "M": 2048,
            "N": 256,
            "K": 64,
            "block_m": 128,
            "block_n": 64,
            "block_k": 64,
            "dtype_str": "fp16",
            "num_warps": 4
        },
        "ms": 0.0103,
        "min_ms": 0.0105,
        "max_ms": 0.0102,
        "GB/s": 57.03,
        "TFLOPS": 12.98
    },
    {
        "params": {
            "M": 2048,
            "N": 512,
            "K": 64,
            "block_m": 32,
            "block_n": 32,
            "block_k": 64,
            "dtype_str": "fp16",
            "num_warps": 4
        },
        "ms": 0.0133,
        "min_ms": 0.0135,
        "max_ms": 0.0133,
        "GB/s": 49.09,
        "TFLOPS": 20.11
    },
    {
        "params": {
            "M": 2048,
            "N": 512,
            "K": 64,
            "block_m": 32,
            "block_n": 64,
            "block_k": 64,
            "dtype_str": "fp16",
            "num_warps": 4
        },
        "ms": 0.014,
        "min_ms": 0.0143,
        "max_ms": 0.0139,
        "GB/s": 46.7,
        "TFLOPS": 19.13
    },
    {
        "params": {
            "M": 2048,
            "N": 512,
            "K": 64,
            "block_m": 64,
            "block_n": 32,
            "block_k": 64,
            "dtype_str": "fp16",
            "num_warps": 4
        },
        "ms": 0.0142,
        "min_ms": 0.0144,
        "max_ms": 0.0141,
        "GB/s": 46.05,
        "TFLOPS": 18.86
    },
    {
        "params": {
            "M": 2048,
            "N": 512,
            "K": 64,
            "block_m": 64,
            "block_n": 64,
            "block_k": 64,
            "dtype_str": "fp16",
            "num_warps": 4
        },
        "ms": 0.0142,
        "min_ms": 0.0144,
        "max_ms": 0.0141,
        "GB/s": 46.18,
        "TFLOPS": 18.91
    },
    {
        "params": {
            "M": 2048,
            "N": 512,
            "K": 64,
            "block_m": 128,
            "block_n": 32,
            "block_k": 64,
            "dtype_str": "fp16",
            "num_warps": 4
        },
        "ms": 0.0148,
        "min_ms": 0.015,
        "max_ms": 0.0148,
        "GB/s": 44.18,
        "TFLOPS": 18.1
    },
    {
        "params": {
            "M": 2048,
            "N": 512,
            "K": 64,
            "block_m": 128,
            "block_n": 64,
            "block_k": 64,
            "dtype_str": "fp16",
            "num_warps": 4
        },
        "ms": 0.0146,
        "min_ms": 0.0147,
        "max_ms": 0.0145,
        "GB/s": 45.03,
        "TFLOPS": 18.44
    },
    {
        "params": {
            "M": 2048,
            "N": 1024,
            "K": 64,
            "block_m": 32,
            "block_n": 32,
            "block_k": 64,
            "dtype_str": "fp16",
            "num_warps": 4
        },
        "ms": 0.0214,
        "min_ms": 0.0216,
        "max_ms": 0.0213,
        "GB/s": 36.67,
        "TFLOPS": 25.03
    },
    {
        "params": {
            "M": 2048,
            "N": 1024,
            "K": 64,
            "block_m": 32,
            "block_n": 64,
            "block_k": 64,
            "dtype_str": "fp16",
            "num_warps": 4
        },
        "ms": 0.0226,
        "min_ms": 0.0228,
        "max_ms": 0.0225,
        "GB/s": 34.78,
        "TFLOPS": 23.74
    },
    {
        "params": {
            "M": 2048,
            "N": 1024,
            "K": 64,
            "block_m": 64,
            "block_n": 32,
            "block_k": 64,
            "dtype_str": "fp16",
            "num_warps": 4
        },
        "ms": 0.023,
        "min_ms": 0.0232,
        "max_ms": 0.0229,
        "GB/s": 34.17,
        "TFLOPS": 23.33
    },
    {
        "params": {
            "M": 2048,
            "N": 1024,
            "K": 64,
            "block_m": 64,
            "block_n": 64,
            "block_k": 64,
            "dtype_str": "fp16",
            "num_warps": 4
        },
        "ms": 0.0228,
        "min_ms": 0.0229,
        "max_ms": 0.0227,
        "GB/s": 34.54,
        "TFLOPS": 23.58
    },
    {
        "params": {
            "M": 2048,
            "N": 1024,
            "K": 64,
            "block_m": 128,
            "block_n": 32,
            "block_k": 64,
            "dtype_str": "fp16",
            "num_warps": 4
        },
        "ms": 0.0237,
        "min_ms": 0.0239,
        "max_ms": 0.0237,
        "GB/s": 33.14,
        "TFLOPS": 22.62
    },
    {
        "params": {
            "M": 2048,
            "N": 1024,
            "K": 64,
            "block_m": 128,
            "block_n": 64,
            "block_k": 64,
            "dtype_str": "fp16",
            "num_warps": 4
        },
        "ms": 0.0232,
        "min_ms": 0.0233,
        "max_ms": 0.0231,
        "GB/s": 33.94,
        "TFLOPS": 23.17
    },
    {
        "params": {
            "M": 64,
            "N": 64,
            "K": 128,
            "block_m": 16,
            "block_n": 16,
            "block_k": 128,
            "dtype_str": "fp16",
            "num_warps": 4
        },
        "ms": 0.0069,
        "min_ms": 0.0071,
        "max_ms": 0.0068,
        "GB/s": 9.56,
        "TFLOPS": 0.31
    },
    {
        "params": {
            "M": 64,
            "N": 64,
            "K": 128,
            "block_m": 16,
            "block_n": 32,
            "block_k": 128,
            "dtype_str": "fp16",
            "num_warps": 4
        },
        "ms": 0.0069,
        "min_ms": 0.007,
        "max_ms": 0.0068,
        "GB/s": 9.56,
        "TFLOPS": 0.31
    },
    {
        "params": {
            "M": 64,
            "N": 64,
            "K": 128,
            "block_m": 32,
            "block_n": 16,
            "block_k": 128,
            "dtype_str": "fp16",
            "num_warps": 4
        },
        "ms": 0.0074,
        "min_ms": 0.0075,
        "max_ms": 0.0073,
        "GB/s": 8.88,
        "TFLOPS": 0.28
    },
    {
        "params": {
            "M": 64,
            "N": 64,
            "K": 128,
            "block_m": 32,
            "block_n": 32,
            "block_k": 128,
            "dtype_str": "fp16",
            "num_warps": 4
        },
        "ms": 0.0079,
        "min_ms": 0.008,
        "max_ms": 0.0077,
        "GB/s": 8.34,
        "TFLOPS": 0.27
    },
    {
        "params": {
            "M": 64,
            "N": 64,
            "K": 128,
            "block_m": 64,
            "block_n": 16,
            "block_k": 128,
            "dtype_str": "fp16",
            "num_warps": 4
        },
        "ms": 0.008,
        "min_ms": 0.0081,
        "max_ms": 0.0079,
        "GB/s": 8.21,
        "TFLOPS": 0.26
    },
    {
        "params": {
            "M": 64,
            "N": 64,
            "K": 128,
            "block_m": 64,
            "block_n": 32,
            "block_k": 128,
            "dtype_str": "fp16",
            "num_warps": 4
        },
        "ms": 0.0086,
        "min_ms": 0.0087,
        "max_ms": 0.0085,
        "GB/s": 7.64,
        "TFLOPS": 0.24
    },
    {
        "params": {
            "M": 64,
            "N": 128,
            "K": 128,
            "block_m": 16,
            "block_n": 16,
            "block_k": 128,
            "dtype_str": "fp16",
            "num_warps": 4
        },
        "ms": 0.0089,
        "min_ms": 0.009,
        "max_ms": 0.0088,
        "GB/s": 11.1,
        "TFLOPS": 0.47
    },
    {
        "params": {
            "M": 64,
            "N": 128,
            "K": 128,
            "block_m": 16,
            "block_n": 32,
            "block_k": 128,
            "dtype_str": "fp16",
            "num_warps": 4
        },
        "ms": 0.0088,
        "min_ms": 0.0089,
        "max_ms": 0.0088,
        "GB/s": 11.15,
        "TFLOPS": 0.48
    },
    {
        "params": {
            "M": 64,
            "N": 128,
            "K": 128,
            "block_m": 32,
            "block_n": 16,
            "block_k": 128,
            "dtype_str": "fp16",
            "num_warps": 4
        },
        "ms": 0.0092,
        "min_ms": 0.0094,
        "max_ms": 0.0091,
        "GB/s": 10.66,
        "TFLOPS": 0.45
    },
    {
        "params": {
            "M": 64,
            "N": 128,
            "K": 128,
            "block_m": 32,
            "block_n": 32,
            "block_k": 128,
            "dtype_str": "fp16",
            "num_warps": 4
        },
        "ms": 0.0098,
        "min_ms": 0.0099,
        "max_ms": 0.0097,
        "GB/s": 10.05,
        "TFLOPS": 0.43
    },
    {
        "params": {
            "M": 64,
            "N": 128,
            "K": 128,
            "block_m": 64,
            "block_n": 16,
            "block_k": 128,
            "dtype_str": "fp16",
            "num_warps": 4
        },
        "ms": 0.0098,
        "min_ms": 0.01,
        "max_ms": 0.0097,
        "GB/s": 10.01,
        "TFLOPS": 0.43
    },
    {
        "params": {
            "M": 64,
            "N": 128,
            "K": 128,
            "block_m": 64,
            "block_n": 32,
            "block_k": 128,
            "dtype_str": "fp16",
            "num_warps": 4
        },
        "ms": 0.0105,
        "min_ms": 0.0107,
        "max_ms": 0.0104,
        "GB/s": 9.39,
        "TFLOPS": 0.4
    },
    {
        "params": {
            "M": 64,
            "N": 256,
            "K": 128,
            "block_m": 16,
            "block_n": 16,
            "block_k": 128,
            "dtype_str": "fp16",
            "num_warps": 4
        },
        "ms": 0.0128,
        "min_ms": 0.0129,
        "max_ms": 0.0128,
        "GB/s": 12.77,
        "TFLOPS": 0.65
    },
    {
        "params": {
            "M": 64,
            "N": 256,
            "K": 128,
            "block_m": 16,
            "block_n": 32,
            "block_k": 128,
            "dtype_str": "fp16",
            "num_warps": 4
        },
        "ms": 0.0127,
        "min_ms": 0.0128,
        "max_ms": 0.0127,
        "GB/s": 12.85,
        "TFLOPS": 0.66
    },
    {
        "params": {
            "M": 64,
            "N": 256,
            "K": 128,
            "block_m": 32,
            "block_n": 16,
            "block_k": 128,
            "dtype_str": "fp16",
            "num_warps": 4
        },
        "ms": 0.013,
        "min_ms": 0.0131,
        "max_ms": 0.0129,
        "GB/s": 12.61,
        "TFLOPS": 0.65
    },
    {
        "params": {
            "M": 64,
            "N": 256,
            "K": 128,
            "block_m": 32,
            "block_n": 32,
            "block_k": 128,
            "dtype_str": "fp16",
            "num_warps": 4
        },
        "ms": 0.0138,
        "min_ms": 0.0138,
        "max_ms": 0.0136,
        "GB/s": 11.91,
        "TFLOPS": 0.61
    },
    {
        "params": {
            "M": 64,
            "N": 256,
            "K": 128,
            "block_m": 64,
            "block_n": 16,
            "block_k": 128,
            "dtype_str": "fp16",
            "num_warps": 4
        },
        "ms": 0.0136,
        "min_ms": 0.0138,
        "max_ms": 0.0135,
        "GB/s": 12.02,
        "TFLOPS": 0.62
    },
    {
        "params": {
            "M": 64,
            "N": 256,
            "K": 128,
            "block_m": 64,
            "block_n": 32,
            "block_k": 128,
            "dtype_str": "fp16",
            "num_warps": 4
        },
        "ms": 0.0144,
        "min_ms": 0.0146,
        "max_ms": 0.0143,
        "GB/s": 11.35,
        "TFLOPS": 0.58
    },
    {
        "params": {
            "M": 128,
            "N": 64,
            "K": 128,
            "block_m": 16,
            "block_n": 16,
            "block_k": 128,
            "dtype_str": "fp16",
            "num_warps": 4
        },
        "ms": 0.0071,
        "min_ms": 0.0075,
        "max_ms": 0.007,
        "GB/s": 13.78,
        "TFLOPS": 0.59
    },
    {
        "params": {
            "M": 128,
            "N": 64,
            "K": 128,
            "block_m": 16,
            "block_n": 32,
            "block_k": 128,
            "dtype_str": "fp16",
            "num_warps": 4
        },
        "ms": 0.0071,
        "min_ms": 0.0073,
        "max_ms": 0.007,
        "GB/s": 13.85,
        "TFLOPS": 0.59
    },
    {
        "params": {
            "M": 128,
            "N": 64,
            "K": 128,
            "block_m": 32,
            "block_n": 16,
            "block_k": 128,
            "dtype_str": "fp16",
            "num_warps": 4
        },
        "ms": 0.0075,
        "min_ms": 0.0076,
        "max_ms": 0.0074,
        "GB/s": 13.18,
        "TFLOPS": 0.56
    },
    {
        "params": {
            "M": 128,
            "N": 64,
            "K": 128,
            "block_m": 32,
            "block_n": 32,
            "block_k": 128,
            "dtype_str": "fp16",
            "num_warps": 4
        },
        "ms": 0.0079,
        "min_ms": 0.008,
        "max_ms": 0.0079,
        "GB/s": 12.45,
        "TFLOPS": 0.53
    },
    {
        "params": {
            "M": 128,
            "N": 64,
            "K": 128,
            "block_m": 64,
            "block_n": 16,
            "block_k": 128,
            "dtype_str": "fp16",
            "num_warps": 4
        },
        "ms": 0.0079,
        "min_ms": 0.0081,
        "max_ms": 0.0079,
        "GB/s": 12.38,
        "TFLOPS": 0.53
    },
    {
        "params": {
            "M": 128,
            "N": 64,
            "K": 128,
            "block_m": 64,
            "block_n": 32,
            "block_k": 128,
            "dtype_str": "fp16",
            "num_warps": 4
        },
        "ms": 0.0085,
        "min_ms": 0.0087,
        "max_ms": 0.0084,
        "GB/s": 11.51,
        "TFLOPS": 0.49
    },
    {
        "params": {
            "M": 128,
            "N": 128,
            "K": 128,
            "block_m": 16,
            "block_n": 16,
            "block_k": 128,
            "dtype_str": "fp16",
            "num_warps": 4
        },
        "ms": 0.0091,
        "min_ms": 0.0093,
        "max_ms": 0.009,
        "GB/s": 14.4,
        "TFLOPS": 0.92
    },
    {
        "params": {
            "M": 128,
            "N": 128,
            "K": 128,
            "block_m": 16,
            "block_n": 32,
            "block_k": 128,
            "dtype_str": "fp16",
            "num_warps": 4
        },
        "ms": 0.0091,
        "min_ms": 0.0092,
        "max_ms": 0.009,
        "GB/s": 14.47,
        "TFLOPS": 0.93
    },
    {
        "params": {
            "M": 128,
            "N": 128,
            "K": 128,
            "block_m": 32,
            "block_n": 16,
            "block_k": 128,
            "dtype_str": "fp16",
            "num_warps": 4
        },
        "ms": 0.0093,
        "min_ms": 0.0095,
        "max_ms": 0.0093,
        "GB/s": 14.03,
        "TFLOPS": 0.9
    },
    {
        "params": {
            "M": 128,
            "N": 128,
            "K": 128,
            "block_m": 32,
            "block_n": 32,
            "block_k": 128,
            "dtype_str": "fp16",
            "num_warps": 4
        },
        "ms": 0.0099,
        "min_ms": 0.01,
        "max_ms": 0.0099,
        "GB/s": 13.24,
        "TFLOPS": 0.85
    },
    {
        "params": {
            "M": 128,
            "N": 128,
            "K": 128,
            "block_m": 64,
            "block_n": 16,
            "block_k": 128,
            "dtype_str": "fp16",
            "num_warps": 4
        },
        "ms": 0.0099,
        "min_ms": 0.01,
        "max_ms": 0.0097,
        "GB/s": 13.29,
        "TFLOPS": 0.85
    },
    {
        "params": {
            "M": 128,
            "N": 128,
            "K": 128,
            "block_m": 64,
            "block_n": 32,
            "block_k": 128,
            "dtype_str": "fp16",
            "num_warps": 4
        },
        "ms": 0.0105,
        "min_ms": 0.0107,
        "max_ms": 0.0104,
        "GB/s": 12.48,
        "TFLOPS": 0.8
    },
    {
        "params": {
            "M": 128,
            "N": 256,
            "K": 128,
            "block_m": 16,
            "block_n": 16,
            "block_k": 128,
            "dtype_str": "fp16",
            "num_warps": 4
        },
        "ms": 0.0131,
        "min_ms": 0.0133,
        "max_ms": 0.013,
        "GB/s": 15.0,
        "TFLOPS": 1.28
    },
    {
        "params": {
            "M": 128,
            "N": 256,
            "K": 128,
            "block_m": 16,
            "block_n": 32,
            "block_k": 128,
            "dtype_str": "fp16",
            "num_warps": 4
        },
        "ms": 0.013,
        "min_ms": 0.0132,
        "max_ms": 0.0129,
        "GB/s": 15.09,
        "TFLOPS": 1.29
    },
    {
        "params": {
            "M": 128,
            "N": 256,
            "K": 128,
            "block_m": 32,
            "block_n": 16,
            "block_k": 128,
            "dtype_str": "fp16",
            "num_warps": 4
        },
        "ms": 0.0131,
        "min_ms": 0.0132,
        "max_ms": 0.013,
        "GB/s": 15.0,
        "TFLOPS": 1.28
    },
    {
        "params": {
            "M": 128,
            "N": 256,
            "K": 128,
            "block_m": 32,
            "block_n": 32,
            "block_k": 128,
            "dtype_str": "fp16",
            "num_warps": 4
        },
        "ms": 0.0138,
        "min_ms": 0.0139,
        "max_ms": 0.0138,
        "GB/s": 14.22,
        "TFLOPS": 1.21
    },
    {
        "params": {
            "M": 128,
            "N": 256,
            "K": 128,
            "block_m": 64,
            "block_n": 16,
            "block_k": 128,
            "dtype_str": "fp16",
            "num_warps": 4
        },
        "ms": 0.0136,
        "min_ms": 0.0138,
        "max_ms": 0.0135,
        "GB/s": 14.42,
        "TFLOPS": 1.23
    },
    {
        "params": {
            "M": 128,
            "N": 256,
            "K": 128,
            "block_m": 64,
            "block_n": 32,
            "block_k": 128,
            "dtype_str": "fp16",
            "num_warps": 4
        },
        "ms": 0.0144,
        "min_ms": 0.0146,
        "max_ms": 0.0143,
        "GB/s": 13.62,
        "TFLOPS": 1.16
    },
    {
        "params": {
            "M": 256,
            "N": 64,
            "K": 128,
            "block_m": 16,
            "block_n": 16,
            "block_k": 128,
            "dtype_str": "fp16",
            "num_warps": 4
        },
        "ms": 0.0071,
        "min_ms": 0.0073,
        "max_ms": 0.007,
        "GB/s": 22.96,
        "TFLOPS": 1.18
    },
    {
        "params": {
            "M": 256,
            "N": 64,
            "K": 128,
            "block_m": 16,
            "block_n": 32,
            "block_k": 128,
            "dtype_str": "fp16",
            "num_warps": 4
        },
        "ms": 0.0071,
        "min_ms": 0.0073,
        "max_ms": 0.007,
        "GB/s": 22.96,
        "TFLOPS": 1.18
    },
    {
        "params": {
            "M": 256,
            "N": 64,
            "K": 128,
            "block_m": 32,
            "block_n": 16,
            "block_k": 128,
            "dtype_str": "fp16",
            "num_warps": 4
        },
        "ms": 0.0076,
        "min_ms": 0.0077,
        "max_ms": 0.0075,
        "GB/s": 21.62,
        "TFLOPS": 1.11
    },
    {
        "params": {
            "M": 256,
            "N": 64,
            "K": 128,
            "block_m": 32,
            "block_n": 32,
            "block_k": 128,
            "dtype_str": "fp16",
            "num_warps": 4
        },
        "ms": 0.0081,
        "min_ms": 0.0082,
        "max_ms": 0.008,
        "GB/s": 20.33,
        "TFLOPS": 1.04
    },
    {
        "params": {
            "M": 256,
            "N": 64,
            "K": 128,
            "block_m": 64,
            "block_n": 16,
            "block_k": 128,
            "dtype_str": "fp16",
            "num_warps": 4
        },
        "ms": 0.008,
        "min_ms": 0.0081,
        "max_ms": 0.0079,
        "GB/s": 20.43,
        "TFLOPS": 1.05
    },
    {
        "params": {
            "M": 256,
            "N": 64,
            "K": 128,
            "block_m": 64,
            "block_n": 32,
            "block_k": 128,
            "dtype_str": "fp16",
            "num_warps": 4
        },
        "ms": 0.0086,
        "min_ms": 0.0087,
        "max_ms": 0.0085,
        "GB/s": 19.1,
        "TFLOPS": 0.98
    },
    {
        "params": {
            "M": 256,
            "N": 128,
            "K": 128,
            "block_m": 16,
            "block_n": 16,
            "block_k": 128,
            "dtype_str": "fp16",
            "num_warps": 4
        },
        "ms": 0.0091,
        "min_ms": 0.0093,
        "max_ms": 0.009,
        "GB/s": 21.51,
        "TFLOPS": 1.84
    },
    {
        "params": {
            "M": 256,
            "N": 128,
            "K": 128,
            "block_m": 16,
            "block_n": 32,
            "block_k": 128,
            "dtype_str": "fp16",
            "num_warps": 4
        },
        "ms": 0.0091,
        "min_ms": 0.0093,
        "max_ms": 0.009,
        "GB/s": 21.51,
        "TFLOPS": 1.84
    },
    {
        "params": {
            "M": 256,
            "N": 128,
            "K": 128,
            "block_m": 32,
            "block_n": 16,
            "block_k": 128,
            "dtype_str": "fp16",
            "num_warps": 4
        },
        "ms": 0.0095,
        "min_ms": 0.0104,
        "max_ms": 0.0094,
        "GB/s": 20.61,
        "TFLOPS": 1.76
    },
    {
        "params": {
            "M": 256,
            "N": 128,
            "K": 128,
            "block_m": 32,
            "block_n": 32,
            "block_k": 128,
            "dtype_str": "fp16",
            "num_warps": 4
        },
        "ms": 0.01,
        "min_ms": 0.0102,
        "max_ms": 0.0099,
        "GB/s": 19.62,
        "TFLOPS": 1.67
    },
    {
        "params": {
            "M": 256,
            "N": 128,
            "K": 128,
            "block_m": 64,
            "block_n": 16,
            "block_k": 128,
            "dtype_str": "fp16",
            "num_warps": 4
        },
        "ms": 0.0099,
        "min_ms": 0.01,
        "max_ms": 0.0099,
        "GB/s": 19.85,
        "TFLOPS": 1.69
    },
    {
        "params": {
            "M": 256,
            "N": 128,
            "K": 128,
            "block_m": 64,
            "block_n": 32,
            "block_k": 128,
            "dtype_str": "fp16",
            "num_warps": 4
        },
        "ms": 0.0105,
        "min_ms": 0.0107,
        "max_ms": 0.0105,
        "GB/s": 18.65,
        "TFLOPS": 1.59
    },
    {
        "params": {
            "M": 256,
            "N": 256,
            "K": 128,
            "block_m": 16,
            "block_n": 16,
            "block_k": 128,
            "dtype_str": "fp16",
            "num_warps": 4
        },
        "ms": 0.0131,
        "min_ms": 0.0133,
        "max_ms": 0.013,
        "GB/s": 20.0,
        "TFLOPS": 2.56
    },
    {
        "params": {
            "M": 256,
            "N": 256,
            "K": 128,
            "block_m": 16,
            "block_n": 32,
            "block_k": 128,
            "dtype_str": "fp16",
            "num_warps": 4
        },
        "ms": 0.013,
        "min_ms": 0.0132,
        "max_ms": 0.0129,
        "GB/s": 20.12,
        "TFLOPS": 2.58
    },
    {
        "params": {
            "M": 256,
            "N": 256,
            "K": 128,
            "block_m": 32,
            "block_n": 16,
            "block_k": 128,
            "dtype_str": "fp16",
            "num_warps": 4
        },
        "ms": 0.0132,
        "min_ms": 0.0134,
        "max_ms": 0.0131,
        "GB/s": 19.81,
        "TFLOPS": 2.54
    },
    {
        "params": {
            "M": 256,
            "N": 256,
            "K": 128,
            "block_m": 32,
            "block_n": 32,
            "block_k": 128,
            "dtype_str": "fp16",
            "num_warps": 4
        },
        "ms": 0.014,
        "min_ms": 0.0141,
        "max_ms": 0.0138,
        "GB/s": 18.79,
        "TFLOPS": 2.4
    },
    {
        "params": {
            "M": 256,
            "N": 256,
            "K": 128,
            "block_m": 64,
            "block_n": 16,
            "block_k": 128,
            "dtype_str": "fp16",
            "num_warps": 4
        },
        "ms": 0.0137,
        "min_ms": 0.0138,
        "max_ms": 0.0136,
        "GB/s": 19.18,
        "TFLOPS": 2.45
    },
    {
        "params": {
            "M": 256,
            "N": 256,
            "K": 128,
            "block_m": 64,
            "block_n": 32,
            "block_k": 128,
            "dtype_str": "fp16",
            "num_warps": 4
        },
        "ms": 0.0145,
        "min_ms": 0.0146,
        "max_ms": 0.0144,
        "GB/s": 18.11,
        "TFLOPS": 2.32
    },
    {
        "params": {
            "M": 512,
            "N": 64,
            "K": 128,
            "block_m": 16,
            "block_n": 16,
            "block_k": 128,
            "dtype_str": "fp16",
            "num_warps": 4
        },
        "ms": 0.0072,
        "min_ms": 0.0073,
        "max_ms": 0.0071,
        "GB/s": 41.1,
        "TFLOPS": 2.34
    },
    {
        "params": {
            "M": 512,
            "N": 64,
            "K": 128,
            "block_m": 16,
            "block_n": 32,
            "block_k": 128,
            "dtype_str": "fp16",
            "num_warps": 4
        },
        "ms": 0.0072,
        "min_ms": 0.0074,
        "max_ms": 0.0071,
        "GB/s": 41.1,
        "TFLOPS": 2.34
    },
    {
        "params": {
            "M": 512,
            "N": 64,
            "K": 128,
            "block_m": 32,
            "block_n": 16,
            "block_k": 128,
            "dtype_str": "fp16",
            "num_warps": 4
        },
        "ms": 0.0077,
        "min_ms": 0.0078,
        "max_ms": 0.0076,
        "GB/s": 38.51,
        "TFLOPS": 2.19
    },
    {
        "params": {
            "M": 512,
            "N": 64,
            "K": 128,
            "block_m": 32,
            "block_n": 32,
            "block_k": 128,
            "dtype_str": "fp16",
            "num_warps": 4
        },
        "ms": 0.0082,
        "min_ms": 0.0084,
        "max_ms": 0.0081,
        "GB/s": 36.06,
        "TFLOPS": 2.05
    },
    {
        "params": {
            "M": 512,
            "N": 64,
            "K": 128,
            "block_m": 64,
            "block_n": 16,
            "block_k": 128,
            "dtype_str": "fp16",
            "num_warps": 4
        },
        "ms": 0.0083,
        "min_ms": 0.0085,
        "max_ms": 0.0081,
        "GB/s": 35.71,
        "TFLOPS": 2.03
    },
    {
        "params": {
            "M": 512,
            "N": 64,
            "K": 128,
            "block_m": 64,
            "block_n": 32,
            "block_k": 128,
            "dtype_str": "fp16",
            "num_warps": 4
        },
        "ms": 0.0087,
        "min_ms": 0.0089,
        "max_ms": 0.0086,
        "GB/s": 33.9,
        "TFLOPS": 1.93
    },
    {
        "params": {
            "M": 512,
            "N": 128,
            "K": 128,
            "block_m": 16,
            "block_n": 16,
            "block_k": 128,
            "dtype_str": "fp16",
            "num_warps": 4
        },
        "ms": 0.0092,
        "min_ms": 0.0093,
        "max_ms": 0.0091,
        "GB/s": 35.69,
        "TFLOPS": 3.65
    },
    {
        "params": {
            "M": 512,
            "N": 128,
            "K": 128,
            "block_m": 16,
            "block_n": 32,
            "block_k": 128,
            "dtype_str": "fp16",
            "num_warps": 4
        },
        "ms": 0.0092,
        "min_ms": 0.0093,
        "max_ms": 0.0091,
        "GB/s": 35.69,
        "TFLOPS": 3.65
    },
    {
        "params": {
            "M": 512,
            "N": 128,
            "K": 128,
            "block_m": 32,
            "block_n": 16,
            "block_k": 128,
            "dtype_str": "fp16",
            "num_warps": 4
        },
        "ms": 0.0095,
        "min_ms": 0.0097,
        "max_ms": 0.0094,
        "GB/s": 34.34,
        "TFLOPS": 3.52
    },
    {
        "params": {
            "M": 512,
            "N": 128,
            "K": 128,
            "block_m": 32,
            "block_n": 32,
            "block_k": 128,
            "dtype_str": "fp16",
            "num_warps": 4
        },
        "ms": 0.0101,
        "min_ms": 0.0102,
        "max_ms": 0.01,
        "GB/s": 32.43,
        "TFLOPS": 3.32
    },
    {
        "params": {
            "M": 512,
            "N": 128,
            "K": 128,
            "block_m": 64,
            "block_n": 16,
            "block_k": 128,
            "dtype_str": "fp16",
            "num_warps": 4
        },
        "ms": 0.0101,
        "min_ms": 0.0103,
        "max_ms": 0.01,
        "GB/s": 32.31,
        "TFLOPS": 3.31
    },
    {
        "params": {
            "M": 512,
            "N": 128,
            "K": 128,
            "block_m": 64,
            "block_n": 32,
            "block_k": 128,
            "dtype_str": "fp16",
            "num_warps": 4
        },
        "ms": 0.0107,
        "min_ms": 0.0109,
        "max_ms": 0.0106,
        "GB/s": 30.5,
        "TFLOPS": 3.12
    },
    {
        "params": {
            "M": 512,
            "N": 256,
            "K": 128,
            "block_m": 16,
            "block_n": 16,
            "block_k": 128,
            "dtype_str": "fp16",
            "num_warps": 4
        },
        "ms": 0.0132,
        "min_ms": 0.0134,
        "max_ms": 0.0131,
        "GB/s": 29.72,
        "TFLOPS": 5.07
    },
    {
        "params": {
            "M": 512,
            "N": 256,
            "K": 128,
            "block_m": 16,
            "block_n": 32,
            "block_k": 128,
            "dtype_str": "fp16",
            "num_warps": 4
        },
        "ms": 0.0131,
        "min_ms": 0.0132,
        "max_ms": 0.013,
        "GB/s": 29.99,
        "TFLOPS": 5.12
    },
    {
        "params": {
            "M": 512,
            "N": 256,
            "K": 128,
            "block_m": 32,
            "block_n": 16,
            "block_k": 128,
            "dtype_str": "fp16",
            "num_warps": 4
        },
        "ms": 0.0133,
        "min_ms": 0.0134,
        "max_ms": 0.0132,
        "GB/s": 29.54,
        "TFLOPS": 5.04
    },
    {
        "params": {
            "M": 512,
            "N": 256,
            "K": 128,
            "block_m": 32,
            "block_n": 32,
            "block_k": 128,
            "dtype_str": "fp16",
            "num_warps": 4
        },
        "ms": 0.014,
        "min_ms": 0.0142,
        "max_ms": 0.014,
        "GB/s": 28.02,
        "TFLOPS": 4.78
    },
    {
        "params": {
            "M": 512,
            "N": 256,
            "K": 128,
            "block_m": 64,
            "block_n": 16,
            "block_k": 128,
            "dtype_str": "fp16",
            "num_warps": 4
        },
        "ms": 0.0139,
        "min_ms": 0.0141,
        "max_ms": 0.0138,
        "GB/s": 28.26,
        "TFLOPS": 4.82
    },
    {
        "params": {
            "M": 512,
            "N": 256,
            "K": 128,
            "block_m": 64,
            "block_n": 32,
            "block_k": 128,
            "dtype_str": "fp16",
            "num_warps": 4
        },
        "ms": 0.0146,
        "min_ms": 0.0148,
        "max_ms": 0.0145,
        "GB/s": 26.87,
        "TFLOPS": 4.59
    }
]