geak_eval/data/ROCm/data/performance/golden_results/reverse_range_triton_perf.json
[
    {
        "params": {
            "N_processed": 512,
            "dtype_str": "fp32",
            "num_warps": 1
        },
        "ms": 0.006,
        "min_ms": 0.0061,
        "max_ms": 0.0059,
        "GB/s": 0.68,
        "TFLOPS": 0.0
    },
    {
        "params": {
            "N_processed": 512,
            "dtype_str": "fp16",
            "num_warps": 1
        },
        "ms": 0.006,
        "min_ms": 0.0061,
        "max_ms": 0.0059,
        "GB/s": 0.34,
        "TFLOPS": 0.0
    },
    {
        "params": {
            "N_processed": 512,
            "dtype_str": "bf16",
            "num_warps": 1
        },
        "ms": 0.006,
        "min_ms": 0.0061,
        "max_ms": 0.0059,
        "GB/s": 0.34,
        "TFLOPS": 0.0
    },
    {
        "params": {
            "N_processed": 512,
            "dtype_str": "fp32",
            "num_warps": 2
        },
        "ms": 0.006,
        "min_ms": 0.0061,
        "max_ms": 0.0059,
        "GB/s": 0.69,
        "TFLOPS": 0.0
    },
    {
        "params": {
            "N_processed": 512,
            "dtype_str": "fp16",
            "num_warps": 2
        },
        "ms": 0.006,
        "min_ms": 0.0061,
        "max_ms": 0.0059,
        "GB/s": 0.34,
        "TFLOPS": 0.0
    },
    {
        "params": {
            "N_processed": 512,
            "dtype_str": "bf16",
            "num_warps": 2
        },
        "ms": 0.006,
        "min_ms": 0.0061,
        "max_ms": 0.0059,
        "GB/s": 0.34,
        "TFLOPS": 0.0
    },
    {
        "params": {
            "N_processed": 512,
            "dtype_str": "fp32",
            "num_warps": 4
        },
        "ms": 0.006,
        "min_ms": 0.0061,
        "max_ms": 0.0059,
        "GB/s": 0.69,
        "TFLOPS": 0.0
    },
    {
        "params": {
            "N_processed": 512,
            "dtype_str": "fp16",
            "num_warps": 4
        },
        "ms": 0.006,
        "min_ms": 0.0061,
        "max_ms": 0.0059,
        "GB/s": 0.34,
        "TFLOPS": 0.0
    },
    {
        "params": {
            "N_processed": 512,
            "dtype_str": "bf16",
            "num_warps": 4
        },
        "ms": 0.006,
        "min_ms": 0.0061,
        "max_ms": 0.0059,
        "GB/s": 0.34,
        "TFLOPS": 0.0
    }
]